character,jap text,Eng,Esp
Yamamoto Akuji (talking),おっちゃん、 俺の下に付く気はないか？,"Pops, are you gonna take me under your wing?","Papá, ¿vas a tomarme bajo tu ala?"
Kaga Tarou (talking),………………,………………,………………
Yamamoto Akuji (talking),"おっちゃんってよ、昔っから 差し出がましいお蘭を嫌ってたよな。
そのせいで、 お蘭が好き勝手やり始めて 随分と冷飯食わされたんだろ？
ま、詳しくは知らないんだがな。 ほとんど俺の推測だけどよ。","Oh man, I've always hated Ran, who is so hard to offer.
That's why Ran started doing whatever he wanted and was forced to eat a lot of cold food, right?
Well, I don't know the details. It's mostly my guess though.","Oh hombre, siempre he odiado a Ran, que es muy difícil de ofrecer.
Es por eso que Ran comenzó a hacer lo que quería y se vio obligado a comer mucha comida fría, ¿verdad?
Bueno, no sé los detalles. Sin embargo, es sobre todo mi suposición."
Kaga Tarou (talking),……まあ、おおむね当たっておるがな。,"……Well, you're generally right.","……Bueno, en general tienes razón."
Yamamoto Akuji (talking),"親父がおっ死んじまった今、 順当に行きゃあ俺が組の跡取りだ。
なら、親父の右腕だったおっちゃんが 俺のところでその腕振るってくれても おかしくはねーよな。
蘭の下よか、待遇はいいはずだぜ？","Now that my father is dead, I'm the heir to the clan, if all goes well.
So it's not surprising that my father's right hand man would be working for me.
I'm sure he'll be treated better than under Ran.","Ahora que mi padre ha muerto, soy el heredero del clan.
Así que no sería de extrañar que la mano derecha de mi padre tomara el relevo en mi lugar.
Estoy seguro de que será tratado mejor que bajo Ran."
Kaga Tarou (talking),"このたわけが……
百発は死んでおらぬ、行方不明じゃ。 はき違えるでない。","This tale of woe is……
Hundreds of bullets are not dead, they are missing. Don't get me wrong.","Este error es……
Cientos de balas no están muertas, están desaparecidas. No te equivoques."
Yamamoto Akuji (talking),"おっちゃんの気持ちは解るけどよ。 でもなあ……
俺ぁ、戦場で地獄見てきたクチだが、 うらなりびょうたんみてーな親父じゃ まず秒殺されちまう世界だったぜ。
わりーけど、 そりゃちと望み薄だと思うがな。","I understand how you feel. But you know……
I've seen hell on the battlefield, and it's a world where a father like Uranai Ribeitan would be Satsu in a second.
Sorry, but I don't think that's very promising.","Entiendo cómo te sientes. ¿Pero sabes qué?……
He visto el infierno en los campos de batalla, y es un mundo donde un padre como Uranai Ribeye Tan sería Satsu en un segundo.
Lo siento, pero no creo que eso sea muy prometedor."
Kaga Tarou (talking),……百発の息子だと言うのに、 情のかけらもない男よの、お主……,"……You're the son of a hundred shots, but you're a man without a shred of compassion, you……","……Eres el hijo de cien tiros, pero eres un hombre sin una pizca de compasión, tú……"
Yamamoto Akuji (talking),だからよー、おっちゃん。 その“親父の息子”っつー言い方、 やめてくんねぇか？,"That's why, old man. Can you stop saying “my father's son” like that?","Por eso, viejo. ¿Puedes dejar de decir “hijo de mi padre” así?"
Kaga Tarou (talking),"とにかく、儂は百発の幹部であって、 今もそのつもりでおるのじゃ。
それが故に…… 百発の流儀に反するおぬしのやり方に 荷担する気はない。","Anyway, I am an executive of Hyakuhatsu and still intend to be one.
Therefore, I have no intention to be a part of…… your way of doing things, which is not in the Hyakuhatsu way.","De todos modos, fui y sigo siendo miembro ejecutivo de Hundred Blasts.
Por eso…… no voy a participar en su forma de hacer las cosas, que va en contra de nuestra forma de hacer las cosas."
Yamamoto Akuji (talking),どーしてもか？,No matter?,¿No importa?
Kaga Tarou (talking),"どうしても、じゃ。
だいたいのう、本来なら儂の腕と刀は お主が面倒を引き起こさねば、 封じたまま死ぬるつもりだったのじゃぞ？
これだけ言えば、 お主でも解ったであろうが。 さあ、去ぬるがよいわ。","By all means.
Besides, my arm and my sword were originally going to die in a sealed-off state unless you took care of them.
Now that I've said all that, even you would understand. Now, off you go.","Por supuesto.
Además, mi brazo y mi espada iban a morir originalmente sellados si no te ocupabas de ellos.
Ahora que he dicho todo eso, incluso tú lo entenderías. Ahora, vete."
Yamamoto Akuji (talking),おっちゃんなあ、そんな調子じゃ この地下牢で余生過ごすことになるぜ？,"You know, you're going to spend the rest of your life in this dungeon at this rate.","Sabes, muchacho, a este paso, pasarás el resto de tu vida en este calabozo."
Kaga Tarou (talking),覚悟の上よ。,I'm ready.,Estoy listo.
Yamamoto Akuji (talking),やれやれ。,Oh dear.,"Oh, Dios."
Yamamoto Akuji (talking),"頼むわ、おっちゃん。 俺の部下になってくれや。
おっちゃんみたいに腕の立つ奴が 今のご時世じゃ必要なんだよ。 だから、頼む。","Please, old man. I want you to be my subordinate.
I need someone as skilled as you in this day and age. So, please.","Por favor, viejo. Sé mi subordinado.
Hoy en día necesito a alguien tan hábil como tú. Así que, por favor."
Kaga Tarou (talking),"………………
今は、このような所におる故、 時間だけには余裕がある。
そこで、儂もいろいろと 考えたのじゃがな。","………………
Now that I am in a place like this, I have time to spare.
So I've been thinking about it.","………………
Ahora que estoy en un lugar como éste, tengo tiempo de sobra.
Así que he estado pensando mucho en ello."
Yamamoto Akuji (talking),ん？　何を？,Hmm?　What?,¿Eh?　¿Qué?
Kaga Tarou (talking),"百発がのう…… お主のことをこう言うておった。
悪司はああ見えて、心根は優しい。 今でこそ手の付けられぬ暴れ者に なってしもうたが……
いつかきっと、 父である自分の言うことを 解ってくれる時が来る、との。","A hundred shots… That's what he said about you.
Akuji may look like that, but he has a kind heart. Now he has become a violent person who is impossible to control… but he said that one day he will understand what he, his father, has to say.","Cien tiros… Eso dijo del dueño.
Akuji se ve así, pero es amable de corazón. Ahora me habría convertido en una persona violenta incontrolable…
Algún día, estoy seguro, llegará el momento en que entenderá lo que yo, su padre, digo."
Yamamoto Akuji (talking),はー、なんのこっちゃ。,"Ha, what the heck.","Ja, qué lío."
Kaga Tarou (talking),……ハナクソほじって聞くでない。 全く、お主は子供か……,Don't listen to…… sniffing gibberish. You are a child at all……,No escuches a…… snigger. ¿Eres un niño? ……
Yamamoto Akuji (talking),ああ、わりーわりー。 ……で？,"Oh, wow - wow - wow. At ……?","Oh, wow - wow - wow. ¿En ……?"
Kaga Tarou (talking),"百発の意志に添うならば、 息子のお主にあ奴の心を しかと伝るべきかもしれぬ。
儂ならば、それができるはずじゃ。 いや、できるのは儂だけかもしれぬ。","If it is Hundred's will, perhaps he should tell his son about his heart.
I should be able to do that. Or perhaps I am the only one who can.","Si es la voluntad de Cien Ráfagas, tal vez debería hablarle a su hijo de su corazón.
Debería poder hacerlo. No, puede que sea el único que pueda."
Yamamoto Akuji (talking),おっちゃん、話なげぇよ。 ……要するに部下になるってことか？,"Pops, you're rambling…… In short, you want me to be your subordinate?","Papá, estás hablando demasiado…… En resumen, ¿quieres que sea tu subordinado?"
Kaga Tarou (talking),"部下と言うより、目付役じゃ。 それでならお主の下についてもよい。
……おそらくはそれが、 百発の望むところであろうからの。","I'm not a subordinate, I'm more of a steward. Then I would be happy to work for you.
……perhaps that is what Hyakuhatsu would like.","Soy más un administrador que un subordinado. Entonces puedo trabajar para ti.
……porque eso es lo que probablemente querría Hundred Blasts."
Yamamoto Akuji (talking),"ま、何でもいいや。 とにかく部下として働いてくれりゃあ。
んじゃ、おっちゃん。 よろしく頼むわ。","Well, whatever. Just work as my subordinate.
Well then, old man. I'm looking forward to working with you.","Bueno, lo que sea. Sólo trabaja para mí como subordinado.
Bueno, viejo. Estoy deseando trabajar con usted."
Kaga Tarou (talking),"………………ただし。
百発が戦地から戻って、 お主の為すこと許すまじと言えば……
儂は、百発の側に付くぞ。","………………However.
If Hundred Bullets comes back from the war and says what you do is unforgivable,……
I will stand by him.","………………Sin embargo.
Si Cien Balas vuelve de la guerra y dice que lo que haces es imperdonable, ……
Lo apoyaré."
Yamamoto Akuji (talking),おーけーおーけー、りょーかい。 それでいーぜ。,"Okey-dokey, nice. That's it.","Okey-dokey, genial. Está bien."
Yamamoto Akuji (thinking),親父が帰ってくる訳ないもんな。 そうなりゃずっと俺の部下だ。 いやぁ助かるねー。,"There's no way my dad's coming back. Then he'll always be my man. Oh, thank God.","No hay manera de que mi padre vuelva. Entonces siempre será mi hombre. ¡Oh, gracias a Dios!"
Kaga Tarou (talking),……悪司よ、何を考えておる？,"……Akuji, what are you thinking?","……Akuji, ¿en qué estás pensando?"
Yamamoto Akuji (talking),いんや別にー。,"No, it's nothing.",No me importa.
Yamamoto Akuji (talking),よし、おっちゃん。 悪ィがいっちょ拷問にかけさせて貰うぜ。,"All right, old man. I'm sorry, but I'm going to have to torture you for a while.","Muy bien, viejo. Lo siento, pero voy a tener que torturarte durante un tiempo."
Kaga Tarou (talking),拷問じゃと……？ 何を吐かせようと言うのじゃ。,"Torture, you say……? What are you trying to make me throw up?","¿Tortura, dices……? ¿Qué estás tratando de hacerme vomitar?"
Yamamoto Akuji (talking),"………………
いろいろだ。","………………
Various.","Disponible en: ………………
Varios."
Kaga Tarou (talking),何じゃそれは、いい加減な……,"What's that, not a good……","¿Qué es eso, no es agradable……"
Yamamoto Akuji (talking),"おっちゃん、元はわかめ組の幹部だしな、 今でもいろいろ内部情報知ってんだろ？
そいつが欲しい訳だ、解るかい？","Pops, you used to be an executive of the Wakame clan, and you still know a lot of inside information, don't you?
That's why we want him, you understand?","Papá, solías ser un ejecutivo del clan Wakame, y todavía sabes todo tipo de información interna, ¿no?
Por eso lo queremos, ¿entiendes?"
Yamamoto Akuji (thinking),"……っつーかな、 こんな小うるさいおっちゃんが部下だと 何かとめんどくせーしなー。
役に立ちそうな情報吐かせて ポイッと捨てるに限るぜ。","……is a bit of a pain in the ass when you have a nagging old man like him working for you.
I'll just let him spout out some useful information and throw it away.","……es un dolor de cabeza cuando se tiene a un viejo regañón como este bajo el mando.
No puedes dejar que te dé información que puede ser útil y luego tirarla."
Kaga Tarou (talking),"………………… なるほど、内部情報、か。
そうか、お主は幼い頃より あれと仲が良かったが、もしや……","………………… I see, inside information, huh?
Well, you've been friends with it since you were a little girl, but if……","………………… Ya veo, información privilegiada, ¿eh?
Bueno, has sido amigo de ella desde que eras una niña, pero si……"
Yamamoto Akuji (talking),ん？,Hmm?,¿Eh?
Kaga Tarou (talking),"お主との抗争中、 急に姿を消した幼馴染が気がかりで、 面と向かってそう言えずに誤魔化すか？
悪司よ……お主も案外若いのう。","You're worried about your childhood friend who suddenly disappeared during the war with you, and you can't say so to her face and cover it up?
Akuji you…… are also younger than you think.","¿Estás preocupado por una amiga de la infancia que desapareció repentinamente durante la guerra contigo, y no puedes decírselo a la cara, así que lo encubres?
Akuji tú…… también eres más joven de lo que crees."
Yamamoto Akuji (talking),……へ？,……he？,¿……he？
Kaga Tarou (talking),"しかしお主、あやつではない別の娘に 惚れておったのではなかったか？
いや、それはそれとして、 あやつを妾にでもするつもりなのか？
たしかにあやつは、 器量だけは良かったからの。","But you were in love with another girl, not him, weren't you?
No, that's not it. Are you going to make her your concubine?
It's true that he was a good man.","Pero tú estabas enamorado de otra chica, no de él, ¿no?
No, no es eso. ¿Vas a hacerla tu concubina?
Era una buena mujer."
Yamamoto Akuji (talking),おいおい、何言ってんだおっちゃん。,"Hey, hey, what are you talking about, old man?","Oye, oye, ¿de qué estás hablando, viejo?"
Kaga Tarou (talking),"儂は知らぬぞ、娘の消息なんぞはな。
大方、あやつもお主と同じ心持ちで 幼馴染のお主と戦いたくなくて 逃げ出したんじゃろうが……
その事で拷問にかけるなら、 無駄も無駄、大無駄じゃ。","I don't know what happened to my daughter.
Most likely, he was of the same mind as you, and ran away because he didn't want to fight your childhood friend……
If you torture him for it, it's a waste, a great waste.","No sé dónde está.
Lo más probable es que fuera de la misma opinión que tú y huyera porque no quería pelear con tu amigo de la infancia……
Si lo torturas por ello, es un desperdicio, un gran desperdicio."
Yamamoto Akuji (talking),"………幼馴染、娘………
おっちゃん、 そりゃもしかしてトコの事か？","………childhood friend, daughter………
Pops, is that you talking about Toko?","………amiga de la infancia, hija………
Papá, ¿te refieres a Toko?"
Kaga Tarou (talking),"そうか、今でもあやつをトコなどと 昔のあだ名で呼んでおるのか。
残念じゃったのう、悪司。 それほど元子を気にかけておったのにな。","I see that you still call him by his old nickname, Toko.
Too bad, Akuji. You cared for Motoko so much.","Ya veo, todavía le llamas por su antiguo apodo, Toko.
Muy mal por ti, Akuji. Te importaba mucho Motoko."
Yamamoto Akuji (talking),"………………
あー、そーいえば うちとやりあってる最中に トコが急にいなくなったっけな。
何考えてんだあのバカ、とか、 勝ち目あると思ってんのかボケ、とか、 ちーっとだけ思ってたんだが。
俺ぁてっきり、抗争のどさくさに 死んじまったのかと思い込んでたぜ。","………………
Oh, by the way, I remember when Toko suddenly disappeared while we were in the middle of an argument.
I thought for a minute, “What the hell was that idiot thinking?
I thought he died in the heat of battle.","………………
Por cierto, recuerdo cuando Toko desapareció de repente mientras discutíamos.
Por un momento pensé: “¿En qué demonios está pensando ese idiota?” o “¿Cree que tiene alguna posibilidad?”.
Pensé que había muerto en medio de una guerra."
Kaga Tarou (talking),悪司よ…… お主、演技が下手じゃのう……,Akuji…… You're not a good actor……,Akuji…… No eres un buen actor ……
Yamamoto Akuji (talking),"なーんだそっかー、 トコの奴は行方不明なのか。 そりゃいーや。
トコって結構頭はいい方だったし、 部下にできりゃ助かるかもなー。
そっかそっかー、なるほどなー。","What the hell, is that guy missing? That's okay.
Toko was a pretty smart guy, so having him as a subordinate would be a big help.
I see… I see.","¿Qué diablos, ese tipo está desaparecido? Esta bien.
Toko era un tipo bastante inteligente, así que tenerlo como subordinado podría ayudar.
Ya veo, ya veo."
Kaga Tarou (talking),……………… まさかお主、本気で……,……………… You can't be serious……,"……………… No puedes hablar en serio, ¿verdad?……"
Yamamoto Akuji (talking),"よし、拷問の目的はそれで行こう。 大決定~。どんどんぱふぱふ~。
さて、今すぐ拷問手と連絡つけっからよ、 死なない内にイロイロ話してくれや。
んじゃな、おっちゃん。 また生きて会えるといーな。","Okay, let's go with that for torture purposes. Great decision! Let's get to work!
Now, I'll get in touch with the torturer, and you can tell me all about it while I'm still alive.
See you later, old man. Hope to see you alive again.","Bien, vamos con eso a efectos de tortura. Gran decisión~. ¡Vamos, vamos, vamos, vamos, vamos!
Bueno, me pondré en contacto con los torturadores ahora mismo, para que me cuenten todo mientras esté vivo.
Hasta luego, viejo. Espero verte vivo de nuevo."
Kaga Tarou (talking),"こっ……こりゃ、悪司！ だから儂は娘のことなど知らぬと……
………………
し、しもうたわい、大ピンチじゃ……","This…… is Akuji! So I don't know my daughter ……
………………
Oh, my God, I'm in big trouble……","¡Este…… es Akuji! Así que no conozco a mi hija……
………………
Oh, Dios mío, estamos en un gran problema……"
 (talking),さーておっちゃん、 ぼちぼち喋る気になったか？,"Well, old man, are you ready to talk now?","Bueno, viejo, ¿estás listo para hablar ahora?"
 (talking),じゃから儂は、 元子の居場所など知らぬと言うに……,So I don't know where Motoko is……,Así que no sé dónde está Motoko……
 (talking),知ってる奴ほどそー言うもんだぜ。,"The more you know, the more you say.","Cuanto más sabes, más dices."
 (talking),う、うぬっ……,"Un, unu……","Un, unu: ……"
 (thinking),ま、知らなかったとしても 痛くも痒くもねーけどな。,"Well, it wouldn't hurt or itch if I didn't know.","Bueno, no estaría de más que no lo supieras."
 (thinking),くっ、悪司めが…… その余裕の態度、何か掴んでおるのか？ 本心が読めぬ……,"Damn you, Akuji…… Are you on to something with your relaxed attitude? I can't read your true intentions……","¡Maldito seas, Akuji!…… ¿Estás en algo con tu actitud relajada? No puedo leer tus verdaderas intenciones……"
 (talking),んじゃまあ、喋る気もなさそーだし もうちょい痛い目に遭って頂くとすっか。,"Well, since he doesn't seem to be willing to talk, I guess I'll let him suffer a little more.","Bueno, ya que no pareces estar dispuesto a hablar, supongo que te dejaré sufrir un poco más."
 (talking),まっ、待て悪司っ！,"Wait, wait Akuji!","¡Espera, espera Akuji!"
 (talking),じゃーなおっちゃん、達者でな。,"See you later, old man.","Hasta luego, viejo, y buena suerte."
 (talking),ぐ……ぐぬぬぬっ…………！,Gu……gunununu~…………！,¡Gu……gunununu~…………！
Elite Yakuza (talking),……若、 加賀太郎がついに口を割りました。,……Waka and Kaga Tarou finally spoke up.,……Waka y Kaga Tarou finalmente hablaron.
Yamamoto Akuji (talking),"ごくろーさん。 知らねー知らねーとか言いながら やっぱ何か知ってたんだな。
で、アレか？ 親子喧嘩でもしてムカついたから 殺して捨てたとか、そーいう話なのか？","Gokurosan. You said you didn't know, but I knew you knew something.
And that's it? Did you and your son have a fight, and you got pissed off, so you Satsu and threw him away, or something like that?","Gokurosan. Dijiste que no sabías - no sabías - pero yo sabía que sabías algo.
¿Y eso es todo? ¿Se cabreó en una pelea entre padre e hijo, así que Satsu y los tiró, o algo así?"
Elite Yakuza (talking),…………若、ご存じだったので？,"…………young, since you knew?","…………joven, porque lo sabías?"
Yamamoto Akuji (talking),"娘の消息を多少なりとも知ってるくせに 拷問するまで喋らねーってなったら そんな理由しか思いつかねーよ。
こっちは別に、トコを探して殺すとか 言ってる訳じゃねーんだからな。","If you know more than a little about your daughter's whereabouts, and you won't talk until you torture her, that's the only reason I can think of.
I'm not saying we're going to find her and Satsu her.","Si sabe más o menos dónde está su hija, y no quiere hablar hasta torturarla, es la única razón que se me ocurre.
No estoy diciendo que la busquemos para Satsu."
Elite Yakuza (talking),……若の洞察力には敬服いたします。,……I admire the insight of young man.,……Admiramos la perspicacia de los jóvenes.
Yamamoto Akuji (talking),そっかー…… トコはおっちゃんに殺されたのか。 昔は仲のいい父娘だったのになー……,I see… Toko was killed by her uncle. They used to be a close father and daughter…,"Ya veo… ¿Toko fue asesinado por el viejo? En el pasado, padre e hija eran cercanos…"
Elite Yakuza (talking),"いえ、どうやら加賀家のご息女は まだご存命のようで。
何でも、わかめ組本部のあるセンリ郊外に 町工場の密集する区間があって、 そこの廃工場に…………","No, it seems that the daughter of the Kaga family is still alive.
There is a section in the suburbs of Senri, where the Wakamegumi headquarters is located, where there is a high concentration of town factories…………","No, aparentemente la hija de la familia Kaga sigue viva.
Hay una sección del suburbio de Senri, donde se encuentra la sede del clan Wakame, en la que hay una alta concentración de fábricas de la ciudad…………"
Yamamoto Akuji (talking),……拉致監禁で拷問とか強姦とか？,"…… abduction and confinement, torture or rape?","…… ¿secuestro y confinamiento, tortura o violación?"
Elite Yakuza (talking),"今頃はぼろぼろだろう、 としか聞いていませんが、おそらく。
うわごとのように、 父に逆らった報いだ、馬鹿な娘に 育ててしまったと繰り返していました。","I only heard that she must be in tatters by now, probably.
She was repeating, as if in a whisper, that it was her father's revenge for disobeying him, and that she had raised a foolish daughter.","Sólo he oído que ya debe estar hecha polvo, probablemente.
Repetía, como en un susurro, que era el castigo de su padre por desobedecerle, y que había criado a una hija estúpida."
Yamamoto Akuji (talking),ふーん。何があったんだろーな。 聞いてみてー気もするが……,Hmmm. I wonder what happened. I'd love to hear……,Hmmm. Me pregunto qué ha pasado. Me gustaría escuchar……
Elite Yakuza (talking),……それはもう、無理かと。 今回はかなり激しく責め立てましたから。,…… I'm afraid that's no longer possible. Because I blamed him pretty hard this time.,…… Pensé que ya no era posible. Porque esta vez lo culpé muy duramente.
Yamamoto Akuji (talking),虫の息か。,Breath of the worm.,El aliento del gusano.
Elite Yakuza (talking),はい。処分は如何致しましょう？,Yes. What should we do with it?,Sí. ¿Qué debemos hacer con él?
Yamamoto Akuji (talking),"んー、 それなりに世話になったおっちゃんだし 病院に入れてやってもいーが……
まあ、いーや。お前に任せる。","Well, he's an old man who's taken care of me in his own way, and I'd be happy to put him in the hospital……
Well, no problem. I'll leave it to you.","Bueno, es un anciano que me ha cuidado a su manera, y estaría encantado de hospitalizarlo……
Bueno, no hay problema. Te lo dejo a ti."
Elite Yakuza (talking),解りました。では早速……,Understood. Then let's get started: ……,"Entendido. Entonces, sigamos con ello: ……"
