character,jap text,Eng,Esp
Kaga Tarou (talking),"すでに嫌だどうだと 言うておる時ではない！
一旦退き、戦さの場を交渉の場に変え、 わかめ組を存続させてから 再度組を再建すべきじゃ！
お蘭よ、お主とて、 まさかこの組を潰してまで争う気は……","This is not the time to be saying “No” or “No” already!
We should leave, turn the battlefield into a negotiation ground, keep Wakame-gumi alive, and rebuild it again!
Even you,  Ran, don't think that you can fight with us by destroying our organization……","No es el momento de decir que no nos gusta.
Deberíamos irnos, convertir el campo de batalla en un terreno de negociación, mantener el clan Wakame vivo y reconstruirlo de nuevo.
Tú, Ran, no creas que vas a luchar a muerte para destruir esta unión……"
Ichihashi Ran (talking),"……………………
あんたの意見は一応聞いておくよ。 ありがとさん。さ、帰っておくれ。","……………………
I'll take your opinion in passing. Thanks. Now go home.","……………………
Tomaré su punto de vista de pasada. Gracias. Ahora vete a casa."
Kaga Tarou (talking),ま、待てお蘭っ！ 話はまだ終わって……,"Wait a minute,  Ran! The story is not over yet……","¡Espera un momento,  Ran! La historia aún no ha terminado……"
Ichihashi Ran (talking),……これから仕事があるんだよ。 さ、邪魔だよ、帰っておくれ！,"…… I've got work to do now. Now, get out of my way, please!","…… Tengo que trabajar ahora. ¡Ahora, salgan de mi camino, por favor!"
Kaga Tarou (talking),おっ……お蘭！　扉を開けるのじゃ！ お蘭、話を聞け！　お蘭っ！！,"Oh…… ORan!　Open the door!  Ran, listen to me!　ORan!","¡Oh…… ORan!　¡Abran la puerta! ¡ORan, escúchame!　¡ORan!"
Kaga Tarou (talking),これも渡世のしがらみよの…… お主に恨みはないが……許せ！！,"This is just another one of the clichés of life in the world…… I have nothing against you, but…… forgive me!","Este es otro de los tópicos de la vida en la carretera…… No tengo nada contra ti, pero…… ¡perdóname!"
