character,jap text,Eng,Esp
Yamamoto Akuji (talking),"……あ、そーだ。 トコの奴も助けてやらにゃーな。 ちいっとばかしめんどくせーけど。
数人に声かけて廃工場探して、んで……
……って、もう仕事終わりだっけ。
ま、明日以降にすっか。憶えてたらな。","…… Oh, that's right. I'll have to help him out too. It's a bit of a pain in the ass.
I'll talk to a few people, find an abandoned factory, and then go to……
……I remember is the end of the workday.
Well, I'll do it after tomorrow. If I remember.","…… Ah, sí. Nosotros también tenemos que ayudarle. Es un poco complicado.
Hablaré con algunas personas, encontraré una fábrica abandonada y luego……
……Recuerdo que ya es el final de la jornada laboral.
Bueno, lo haré pasado mañana. Si me acuerdo."
narrator,"郊外にある、小さな庵。 ──加賀太郎の私邸である。
夜、ふらりと庭に出た太郎は、 庭の一隅で鳴っている鹿威しに耳を傾けつつ 曇った夜空を静かに見上げていた。","A small hermitage in the suburbs. It is the private residence of Kaga Tarou.
At night, Tarou wandered out into the garden, and quietly looked up at the cloudy Yozora while listening to the deer stalks crying in a corner of the garden.","Una pequeña ermita en los suburbios. Es la residencia privada de Kaga Tarou.
Por la noche, Tarou salió al jardín y contempló en silencio el nublado Yozora, escuchando el llanto de los ciervos en un rincón del jardín."
Kaga Tarou (talking),"満月のはずじゃが…… 今日も、月は出ておらぬのか。
垂れ込めた雲越しに、うすぼんやりと 蒼い光が見えはするが……
……満月、か。
もう長らく見ておらぬが………………… まるで、儂の心のようじゃのう…
ニホンが負け、盟友の百発は戻らず、 ウィミィが街を好き勝手に弄り回し、 組は女狐めに乗っ取られ……
その上、戦地から戻った悪司が わかめ組と骨肉の争いを 繰り広げている有様よ。","It should be a full moon, but there is no moon today either……
Through the hanging clouds, a dim blue light can be seen, but it's not a full moon today……
……Full moon, huh?
I have not seen it for a long time.……………… It's like my heart…
Japan is defeated, our ally Hyakuban has not returned, Wime has taken over the city, the gang has been taken over by a vixen, and the Wime has returned from war.
And Akuji, who returned from the war, is now fighting with Wakame clan.","Debería haber luna llena, pero…… ¿tampoco hay luna hoy?
Una tenue luz azul puede verse a través de las nubes colgantes, pero hoy no es luna llena……
……Luna llena, ¿eh?
Hace tiempo que no lo veo………………… como mi corazón…
Japón está derrotado, nuestro aliado Hyakuban no ha regresado, Wime se ha apoderado de la ciudad, y la banda ha sido tomada por una zorra……
Además, Akuji ha regresado de la guerra y ahora está luchando con el clan Wakame por la carne y la sangre del clan Wakame."
__system__??,{(RND = 0) * (☆加賀元子監禁 = 1):,,
Kaga Tarou (talking),挙げ句の果てには、 致し方なかったとは言えども 実の娘をあのような目に遭わせて…,"And to top it all off, even though he had no choice, to put his own daughter through what he did…","Y para colmo, aunque no tenía opción, hacer pasar a su propia hija por eso…"
__system__??,},,
__system__??,{(RND = 0) * (☆加賀元子監禁 \ 1):,,
Kaga Tarou (talking),挙げ句の果てには、その抗争で 実の娘が行方不明と来ておる…,"And to top it all off, his own daughter is missing because of the war…","Para colmo, su propia hija ha desaparecido en el conflicto…"
__system__??,},,
Kaga Tarou (talking),……虚しいことよの。,…… is a vain thing.,…… del vacío.
Lover (talking),……太郎様。,Dear ……Tarou.,Querido ……Tarou.
Kaga Tarou (talking),ん……おお、お主か。 どうした？,"I'm at ……. Oh, it's you. What's up?","Estoy en…… Oh, eres tú. ¿Qué pasa?"
Lover (talking),そろそろ、中へお戻り下さい。 お躰が冷えますから……,Please come back inside soon. Your body will get cold……,Es hora de volver a entrar. Tu cuerpo se está enfriando……
Kaga Tarou (talking),そうじゃな、戻ろうかの。 閨（ねや）は温めておるのか？,"Well, let's go back. Are you warming up your bedroom?","Sí, volvamos. ¿Estás calentando tu dormitorio?"
Lover (talking),はい、勿論……,"Yes, of course ……","Sí, por supuesto: ……"
Kaga Tarou (talking),そうか。 ……なら、共に参ろうか。,"I see. If you're ……, I'll come with you.","Sí. Si quieres visitar ……, iré contigo."
Lover (talking),はい。,Yes.,Sí.
Kaga Tarou (thinking),………………,………………,………………
__system__??,{☆わかめ < 15:,,
Kaga Tarou (thinking),"この事態、何とか…… 何とかせねばならぬ。
もはや、それができるのは 儂しかおらぬのじゃ、儂しか……","We have to…… do something about this.
I'm the only one who can do it. I'm the only one who can……","Tenemos que…… hacer algo al respecto.
Soy el único que puede hacerlo, soy el único que puede……"
__system__??,},,
__system__??,{☆わかめ > 14:,,
Kaga Tarou (thinking),儂に出来ることは、 もう、何もないかもしれんな……,There may be nothing more I can do……,Puede que no haya nada más que pueda hacer……
__system__??,},,
Elite Yakuza (talking),………………,………………,………………
narrator,"エリートヤクザの見つめる先には、 ロシアから来たらしい大型船が停泊していた。
大型船は幾ばくかの荷物と人を港に下ろして、 やがて、接岸している場所のハッチを閉じ始める。","The sight of Elite Yakuza was anchored by a large ship apparently from Russia.
The large ship will drop some luggage and people into the port and then begin to close the hatches where they docked.","La vista del Yakuza de élite estaba anclada por un gran barco aparentemente de Rusia.
La gran nave dejará caer algo de equipaje y personas en el puerto y luego comenzará a cerrar las escotillas donde atracaron."
Elite Yakuza (talking),やはり……居ないか。,As I thought…he's not there.,Como era de esperar… ¿no está él ahí?
Kaga Tarou (talking),……マサよ、 毎度毎度すまんの。,"…Masa, I'm sorry every time.","…Masa, siempre lo siento."
Elite Yakuza (talking),？　ああ、おやっさん…… 今日はいらっしゃったのですね。,"?　Oh, dear…… you are here today, aren't you?","?　Ah, querida…… hoy estás aquí, ¿no?"
Kaga Tarou (talking),お蘭のお陰で最近は暇でな、 ここに来る時間もできたわえ。,"Thanks to  Ran, I've had some free time lately, so I've had time to come here.","Gracias a  Ran, he tenido algo de tiempo libre últimamente, así que he tenido tiempo de venir aquí."
Elite Yakuza (talking),………………,………………,………………
Kaga Tarou (talking),で、どうじゃ。 今度の船にも乗っておらんかったか。,"So, what do you think? You weren't on this boat either?","Entonces, ¿qué opinas? ¿Tampoco estabas en este barco?"
Elite Yakuza (talking),……残念ながら。 百発様らしき人影は、どこにも……,……unfortunately. The figure that seems to be Mr. Hyakusho is nowhere to be found……,……Desgraciadamente. La figura que parece ser el Sr. Cien Tiros no aparece por ningún lado……
Kaga Tarou (talking),"……そうかえ。
あやつが……百発が帰ってくるとなれば、 出征先であった北からの船以外に ないからの。
すまぬがマサよ、これからも、 北から来る船は調べ続けてくれ。","I see……
If he…… is to return, it will be to a ship from the north, where he went on his expedition.
I'm sorry, Masa, but please keep checking for ships coming from the north.","Ya veo……
Si él…… va a regresar, será a un barco del norte, donde fue a la guerra.
Lo siento, Masa, pero por favor, sigue buscando barcos que vengan del norte."
Elite Yakuza (talking),はっ……,Haha ……,Haha ……
Kaga Tarou (talking),"組長のあやつが戦地から戻った時、 出迎えが誰もなしでは……
……あやつから留守を預かった この儂の面目は丸つぶれじゃからな。","When he comes back from the war, he will be……
……I, who was entrusted with his absence, would be disgraced.","Cuando vuelva de la guerra, será……
……Su ausencia, yo, que me ocupaba de él, sería deshonrado."
Elite Yakuza (talking),"………………
おやっさん…… 組長は、百発様はもう……","………………
Oyasan…… The leader of the group, Mr. Hyakkusama, has already……","………………
Oyasan…… El líder del grupo, Mr. Hundred Shots, ya ha……"
Kaga Tarou (talking),言うなマサよ。 それ以上は言うでない。,"Don't say it, Massa. Say no more.","No lo digas, Massa. No digas más."
Elite Yakuza (talking),……はっ。,……ha.,……ha.
Kaga Tarou (thinking),"…………百発よ、 儂は、信じておるぞ。
お主が帰ってくる、その日をな……","I believe in you,………… hundred shots.
The day you come home……","………… cien disparos, creo en ti.
El día que vuelvas……"
Kaga Tarou (talking),こっ…… これは一体どういう事なのじゃ！！,Ko~…… What the hell is this!,Ko~…… ¡Qué demonios es todo esto!
Suteki Ishi (talking),"………………んあ~ん？ 何なが、このハゲチョビン。
……あ、ああ、あああ。 組員の名簿で見たがよ。 ちょっと前の組の幹部ながね？","………………na~n？ What's with you, you bald chobin.
……a、aa、aaa。 I saw him in the list of members. He's a former gang leader, right?","………………na~n？ Qué te pasa, calvo chobin.
……a、aa、aaa。 Te vi en la lista de la banda. Es un miembro veterano de un clan anterior, ¿no?"
Kaga Tarou (talking),貴様じゃな…… お蘭がシコクから呼んだとかいう 得体の知れぬ用心棒は！,You are the…… unknown bouncer that  Ran called from Shikoku!,¡Eres…… el gorila desconocido que  Ran llamó desde Sikok!
Suteki Ishi (talking),ひ、ひへ……へへへ。 今はもう傭兵と違うがよ。 おらぁ組長やき。,"Hi、hihe……hehehe。 I'm not a mercenary anymore. Olaa, kumicho yaki.",Hi、hihe……hehehe。 Ya no somos mercenarios. Olaa kumicho yaki.
Kaga Tarou (talking),"阿呆な事をぬかすでない！ 誰が貴様なんぞを組長と認めるものか！
貴様のせいで、組の内部はおろか わかめ組のシマの堅気衆までもが 混乱しておるのじゃぞ！","Don't be stupid! Who would recognize you as the leader of this clan!
Because of you, not only the internal affairs of the Wakame clan, but even the stalwarts of the Wakame clan are in disarray!","¡No seas estúpido! ¡Nadie te reconoce como el líder de este clan!
¡Por tu culpa, no sólo los asuntos internos del clan, sino incluso los incondicionales del clan Wakame están en desorden!"
Suteki Ishi (talking),そがいなこと言うたち、 前の組長さんに任されてしもうたがよ。 しょんないが？,The former head of the group put me in charge of the group. What's wrong with that?,El anterior líder nos dejó a cargo. ¿Qué hay de malo en eso?
Kaga Tarou (talking),いかにあの女狐と言えど、 組を滅ぼしかねない真似はせぬ！ 貴様なんぞに…………,I will not let that vixen do anything that could destroy our organization! I will not let you…………,"No importa lo vil que sea esa zorra, ¡nunca haría nada que pudiera destruir el Gremio! No te dejaré…………"
Suteki Ishi (talking),……ほしたら、これは何ながか？,……What is this?,……¿Qué es esto?
narrator,素敵医師は、一枚の書状を加賀太郎に見せた。,Suteki Ishi showed one letter to Kaga Tarou.,Suteki Ishi mostró una carta a Kaga Tarou.
Kaga Tarou (talking),なっ…… こ、これは……委任状じゃと……？,What…… is this…… power of attorney or ……?,No…… ¿Esto es…… poder o ……?
Suteki Ishi (talking),前の組長さんから貰うたが。 ニセモンと違うがよ？,"I got it from the former head of the gang. It's not a fake, though, is it?","Me lo dio el antiguo jefe de la banda. Sin embargo, no es una falsificación, ¿verdad?"
Kaga Tarou (talking),"確かに、震えてはいるものの これは間違いなくお蘭の筆跡じゃが……
……じゃが、ありえぬ！ このような事は断じてありえぬ！
貴様、お蘭に何をしおったのじゃ！","Sure, it's shaky, but it's definitely your Ran's handwriting……
……but this is impossible! This is absolutely impossible!
What have you done to Ran!","Claro, es inestable, pero esta es definitivamente la letra de ORan……
……¡pero no puede ser! ¡Esto no puede ocurrir nunca!
¿Qué le has hecho a Ran?"
Suteki Ishi (talking),なーんもしちょらんがよ？,What's wrong with that?,¿Qué hay de malo en eso?
Kaga Tarou (talking),ならばお蘭に会わせいっ！！ 直に話がある！！,Then I want to see  Ran! I want to talk to him!,¡Entonces quiero ver a  Ran! ¡Quiero hablar con él!
Suteki Ishi (talking),"それはできんがよ。 前の組長にはおらぁが休暇やって、 今はシコクへ旅行中なが。
前の組長さん、おまぁら部下が無能で えらい疲れちょったきね。 ひ、ひへ、ひへへへへへへ……","I can't do that. The previous leader was on vacation with us and is now on a trip to the Philippines.
The previous boss was very tired because of the incompetence of your men. hi、hihe、hihehehehehehe……","No puedo hacer eso. El anterior responsable estaba de vacaciones con nosotros y ahora está de viaje en Filipinas.
El anterior líder estaba muy cansado por la incompetencia de sus hombres. hi、hihe、hihehehehehehe……"
Kaga Tarou (talking),"勝手なことをぬかしおってっ……！
第一、今の世では男はリーダーになれぬ！ お主に組長たる資格はないはずじゃ！","You are talking nonsense……!
First of all, in today's world, no man can be a leader! You are not qualified to be a leader!","¡Estás hablando con el culo……!
En primer lugar, en el mundo actual, ¡ningún hombre puede ser líder! No estás cualificado para ser un líder."
Suteki Ishi (talking),あらーん、私、女よーん☆ うふーん♪,"Oh, I'm a woman☆ Hmm♪","Ah, soy una mujer ☆ Hmm ♪"
Kaga Tarou (talking),……馬鹿にしおって…………！,……You're making a fool of yourself…………!,……¡Estás haciendo el ridículo…………!
narrator,"加賀太郎は、腰に差した愛刀に手をかける。
──が、抜刀は思いとどまって、 素敵医師に背を向けた。","Kaga Tarou puts his hand on his beloved sword at his waist.
──But he decides against it and turns his back to Suteki Ishi.","Kaga Tarou puso la mano en su querida espada en la cintura.
──Le dio la espalda a Suteki Ishi, pero decidió no usar el Battou."
Suteki Ishi (talking),……ん？　どこへ行くがか？,…… hmm?　Where are you going?,…… ¿Hmm?　¿A dónde vas?
Kaga Tarou (talking),貴様に報告するいわれはないわえ！,I have no business reporting to you!,No tengo que informar a usted.
Kaga Tarou (talking),"…………見ておれ、妖怪めが……
市議会に筋を通し、部下を集めて 堂々と組を取り返してくれる……！
この加賀太郎の目が黒いうちは、 貴様などの好きにはさせぬ！","…………Watch it, you specter!……
You will muscle your way through the city council, gather your men, and take back your gang with dignity……!
As long as this Kaga Tarou's eyes are black, I will not let you do what you want!","…………¡Mírate, espectro……!
¡Te abrirás paso a través del consejo de la ciudad, reunirás a tus hombres y recuperarás tu clan con dignidad……!
Mientras los ojos de este Kaga Tarou sean negros, ¡no te dejaré hacer lo que quieras!"
Suteki Ishi (talking),"……きへへ。 ああいうボケ老人はさっさと 手足をもぎ取るに限るがよ。
おーい、誰ぞおるがかー？","……kihehe。 Old people like that should be ripped limb from limb.
Hey, who's there?","……kihehe。 Los ancianos como ese deberían ser arrancados de cuajo.
Oye, ¿quién está ahí?"
Elite Yakuza (talking),…………は。,………… is.,………… es.
Suteki Ishi (talking),"さっき、ここに来よったハゲの部下、 適当な事言っておクスリ漬けに して来とおせ。
無理そうながやったら、 毒でも何でもええがやき、 始末するがよ。","Just now, my bald subordinate who came here should say something random and pluck out his medicine.
If it seems impossible, it would be fine to do anything, even if it's poison, and I'll finish it off.","Justo ahora, mi subordinado calvo que vino aquí debería decir algo al azar y arrancar su medicamento.
Si parece imposible, estaría bien hacer cualquier cosa, incluso si es veneno, y lo terminaré."
Elite Yakuza (talking),…………は……,…………ha……,…………ha……
Suteki Ishi (talking),"あー、あと何人か人質にしてきて、 あのハゲを渋々仲間にするのも手ながね。
押さえるのは、女子供にするがよ。 ああいう古いのは弱い奴をタテにした方が 絶対に効果あるがやき。","We could take a few more hostages and make the bald guy a reluctant friend.
But I'll only hold down the women and children. It is more effective to take the weak ones against the strong ones.","Podríamos tomar unos cuantos rehenes más y convertir al calvo en un amigo a regañadientes.
Pero sólo hay que sujetar a las mujeres y a los niños. Es más efectivo tomar los débiles contra los viejos."
Elite Yakuza (talking),………………,………………,………………
Suteki Ishi (talking),んー、うまいことやれよったら、 おらぁが直々に調合したスペシャルな おクスリをプレゼントするが。,"Well, if you do well, I'll give you a special medicine that I've personally concocted.","Si lo haces bien, te daré una medicina especial que he preparado personalmente."
Elite Yakuza (talking),…………っ………… ほ、本当ですか…………,…………~………… Really? …………,…………~………… ¿En serio?
Suteki Ishi (talking),組長は嘘つかんがよ？,"The boss doesn't lie, though, does he?","Pero el jefe no miente, ¿verdad?"
Elite Yakuza (talking),や……やりますっ………… やらせて頂きますっ……！！！,I'll do it!…… I'll do it!………… I'll do it!,"¡Lo haré ……, lo haré …………, lo haré ……!"
Suteki Ishi (talking),きへへへ……いいお返事なが。 頑張ってくるがよ。,Khehehehehe…… good reply. I'll do my best.,Kihehehe…… buena respuesta. Pero haré lo que pueda.
Suteki Ishi (talking),きへ……きへへへへ………… オオサカ中をおクスリ天国にするがよ…… ひゃへへへ…………！,Kihe……kihehehehe………… I'll make all of Osaka a drug heaven…… hiyahhehehe…………！,Kihe……kihehehehe………… Haz de todo Osaka un paraíso de la droga…… hiyahhehehe…………！
narrator,"加賀太郎はこの日、イコマの雑居ビルの一室に 小さな事務所を開設した。
事務所の看板には“男性復権運動推進会”とある。","On the same day, Kaga Tarou opened a small office in a building in Icoma.
The sign of the office reads “Men's Restoration Movement Promotion Association.","Kaga Tarou abrió ese mismo día una pequeña oficina en un edificio de Icoma.
El cartel de la oficina dice “Asociación de Promoción del Movimiento de Restauración de Hombres”."
Kaga Tarou (talking),"……これでよい。
今の世の中、女性上位主義に虐げられ 窮屈な思いをしておる男が多いはず。
その男どもを救いつつ、 いずれは社会に対して圧力をかけられる 大きな力を蓄えるのじゃ……
ウィミィも、国になる前は こうした運動を積み重ねたと聞く。 ならば儂にもできぬことではあるまい。
………………
しかし、こんな運動を展開できるのも 街が静かになったればこそよ……
……全ては悪司のお陰、 という言い方もできようかの。
百発よ、我らと流儀は違えど お前の息子はなかなかやりおるぞ。
認めるべきかもしれぬの。 あやつの才覚というものを……","…… is a good idea.
There must be many men in the world today who are oppressed by the female supremacy and feel trapped in their lives.
While saving those men, we will eventually build up a great power to exert pressure on society……
I heard that Wime had this kind of movement before they became a country. Then I can do it, too.
………………
But we can only do this if the city is quiet……
……It's all thanks to Akuji, I guess you could say.
Hyakuhatsu, your son is quite good, even if he is different from our style.
Perhaps we should admit it. You may have to admit his talent……","…… Esto es bueno.
Debe haber muchos hombres en el mundo actual que se sienten oprimidos y atrapados por el principio de la supremacía femenina.
Debemos salvar a esos hombres y, al mismo tiempo, construir un gran poder que pueda llegar a ejercer presión sobre la sociedad……
He oído que Wime tuvo muchos de estos movimientos antes de convertirse en un país. Entonces yo también puedo hacerlo.
………………
Pero sólo podemos tener un movimiento como éste si la ciudad está tranquila……
……Todo es gracias a Akuji, supongo que se podría decir.
Cien ráfagas, tu hijo es bastante bueno, aunque no siga nuestro estilo.
Tal vez debamos admitirlo. Hay que admitir su talento……"
Kaga Tarou (talking),お蘭！　お蘭っ！ ここにおるんじゃろうが、 話がある！,ORan!　Ran! I know you're here. I need to talk to you!,¡ORan!　¡Ran! Sé que estás aquí. ¡Necesito hablar contigo!
Ichihashi Ran (talking),…………何だい、うるさいね。 大声出さなくても聞こえてるよ。,"………… What's up, it's loud. You don't have to shout, I can hear you.","………… Qué pasa, estás haciendo demasiado ruido. No tienes que gritar, puedo oírte."
Kaga Tarou (talking),お蘭……今ならまだ間に合う。 悪司と和解せよ、そうすべきじゃ！,"ORan…… it's not too late. Make peace with Akuji, you must!","ORan…… no es demasiado tarde. ¡Haz las paces con Akuji, debes hacerlo!"
Ichihashi Ran (talking),"………………
とうとうボケたのかい？　あんた…… それとも頭でもぶつけたかい？","………………
Did you finally lose your shit?　You…… or did you bump your head?","………………
¿Has perdido por fin la cabeza?　¿Has visto…… o te has dado un golpe en la cabeza?"
Kaga Tarou (talking),"儂はいたって正気じゃ！
お蘭よ、お主、このまま抗争を続けて 本当に勝てると思うておるのか？","I'm not crazy!
Ran, do you really think you can continue this war and win?","¡No estoy loco!
Ran, ¿realmente crees que puedes ganar esta guerra si sigues luchando?"
Ichihashi Ran (talking),………………,………………,………………
Kaga Tarou (talking),"じりじりと組員が減り、 金がなくなり、ショバが減り……
このままではやがて、 わかめ組は奉仕青年団と事を構える 力すら失ってしまうぞ！
……言うまでもなく、 儂とて悪司の前に膝を屈するは屈辱ぞ。
じゃがの、勝ち目のない戦さを続けて 組が無くなってはどうしようもなかろう。 後退するも勇気の一つぞ、お蘭！","Slowly the number of members is decreasing, the money is disappearing, and the amount of money is decreasing……
At this rate, Wakame-gumi will soon lose the ability to even have a business relationship with the youth service corps!
…… Needless to say, it is humiliating for me to bow my knees before Akuji.
But what can we do if we continue to fight an unwinnable war and lose our organization? Backing down is a form of courage, O-Ran!","Poco a poco vamos perdiendo socios, perdemos dinero, perdemos dinero, perdemos dinero, perdemos dinero, perdemos dinero……
¡Pronto, el clan Wakame perderá la capacidad de tener siquiera algo que ver con el Cuerpo de Servicio Juvenil!
…… No hace falta decir que es humillante para mí doblar la rodilla ante Akuji.
Pero ¿qué podemos hacer si seguimos luchando en una guerra que no se puede ganar y perdemos nuestra unión? La retirada es una forma de valor, O-Ran."
Ichihashi Ran (talking),嫌だね。,I don't like it.,No me gusta.
