"character","jap text","Eng","Esp"
"Seanel Br (talking)","………………は？ 帰るですって？","What about ………………? You're leaving?","¿Qué hay de ………………? ¿Me voy?"
"Ehavilla Me (talking)","そう驚くほどの事でもあるまい。
特Ａ級の指令書があったにも 関わらず、君およびエデンは 私に協力的ではない。
君はおろか、 ウィミィ統治下に入っているはずの 地域管理組合までもが非協力的だった。
これ以上ニホンに留まれば、 私は自分本来の仕事にまで 支障をきたしかねん。","Not so surprisingly, you and Eden have not been cooperative with me, despite the fact that I have a class A directive.
Despite a class A directive, you and Eden have been uncooperative with me.
Not only you, but even the local management association, which is supposed to be under Wime, has been uncooperative.
If I stay in Japan any longer, I may even jeopardize my own work.","No es tan sorprendente.
A pesar de tener una directiva especial de grado A, tú y Eden han sido poco cooperativos conmigo.
No sólo tú, sino incluso la asociación de gestión local, que se supone que depende de Wime, no ha cooperado.
Si me quedo en Japón más tiempo, estaré obstaculizando mi propio trabajo."
"Seanel Br (talking)","………………","………………","………………"
"Seanel Br (thinking)","ばんざーい、ばんざーい、ばんざーい！ 厄介者が一人減ってくれるわ……！","Hooray, hooray, hooray! That's one less nuisance to deal with……!","¡Hurra, hurra, hurra! Una molestia menos para ti……!"
"Ehavilla Me (talking)","……嬉しそうだな、シーネル司令。","…… You look happy, Commander Seanel.","…… Se le ve feliz, Comandante Seanel."
"Seanel Br (talking)","いえ別に。
しかし残念です、博士。 我々は結局、あなたの役には 立てなかったようで……","No, nothing.
But I am sorry, Doctor. It seems we were of no use to you after all……","No, nada.
Pero lo siento, doctor. Parece que, después de todo, no te hemos servido de nada……"
"Ehavilla Me (talking)","……虫酸が走るな、 その上っ面だけの物言いは。
本当にそう思っているのなら、 憲兵でも衛兵でも何でもいいから 今すぐ那古教にけしかけろ。
そして、強制的に那古教を潰して 私の元に教祖を連れて来たまえ。","…… is a bugger, that superficial talk.
If you really believe that, you should go to Nakokyou right now with the military police, guards, or whatever you can get your hands on.
Then, forcibly crush Nakokyou and bring Oyasama to me.","…… Es usted un bicho, la forma en que habla por los codos.
Si realmente crees eso, entonces deberías ir a Nakokyou ahora con la policía militar, los guardias o lo que quieras.
Entonces, aplasta a la fuerza a Nakokyou y tráeme a Oyasama."
"Seanel Br (talking)","ですから、現在のエデンは、 ニホンの治安回復と女性上位主義の徹底が 最重要課題だと、前にも…………","Therefore, Eden has said before that the most important issues now are to restore security in NIHON and to ensure the supremacy of women in the country…………","Por ello, Eden dice ahora que su máxima prioridad es restablecer la seguridad y garantizar la supremacía de las mujeres en el Nihongo, como ya ha hecho antes: …………"
"Ehavilla Me (talking)","君の屁理屈は聞きたくない。 全く、最後の最後まで非協力的な……","I don't want to hear your quibbles. Totally uncooperative until the very end……","No quiero oír tus objeciones. Totalmente poco cooperativo hasta el final……"
"Seanel Br (talking)","ですから、協力したいのはやまやまですが そういう訳にはいかないのですよ、博士。","So, as much as I would like to cooperate with you, that is not the way it works, Doctor.","Así que, por mucho que me gustaría ayudar, no es así como funciona, Dr."
"Ehavilla Me (talking)","もういい。
 ……そろそろ、 本国への定期便が出る頃だ。 では失礼する。","Enough is enough.…… should be getting a regular flight home soon. Now if you'll excuse me.","Suficiente.…… ya debería tener vuelos regulares a casa. Ahora, si me disculpan."
"Seanel Br (talking)","………………えっ？ 帰るって……今日、今すぐに？","……………… What? You're leaving…… today, right now?","……………… ¿Qué? ¿Te vas de…… hoy, ahora mismo?"
"Ehavilla Me (talking)","そうだが。","Yes, but.","Sí, pero."
"Seanel Br (talking)","そうって、博士…… 私物や研究施設は……","So, Dr…… personal belongings and research facilities can be found at ……","Así lo afirma el Dr…… Los efectos personales y las instalaciones de investigación están disponibles en ……"
"Ehavilla Me (talking)","すべて処分して頂いて結構。 重要なサンプルやデータはすでに 貨物機で本国に送ってある。","You may dispose of everything. Important samples and data have already been sent home by cargo plane.","Puedes disponer de todo. Ya se han enviado a casa muestras y datos importantes en un avión de carga."
"Seanel Br (talking)","…………そうですか。","………… I see.","………… Ya veo."
"Seanel Br (thinking)","そりゃ良かったわ…… あんたが居なくなったらすぐに、 まとめて全部焼却炉に送ってやる！","That's good to hear…… As soon as you're gone, we'll send them all to the incinerator, en masse!","Me alegro de oírlo…… ¡En cuanto te vayas, los enviaremos a todos a la incineradora, en masa!"
"Ehavilla Me (talking)","………………では、これで。","At ………………, this is it.","En ………………, en esto."
"Seanel Br (talking)","……さようなら、イハビーラ博士。 また会える日まで……","…… Goodbye, Dr. Ehavilla. Until we meet again: ……","…… Adiós, Dr. Ehavilla. Hasta que nos volvamos a encontrar……"
"Ehavilla Me (talking)","…………………………
そうそう、一つ言いそびれたが。
君の非協力的な態度および発言は 余すことなく国防総省上層部に 伝えてある。
極東の島国、しかも基地指令の首など 国防総省の胸三寸で 軽く切り飛ばせるだろう。","…………………………
Oh, yes, one thing I failed to mention.
Your uncooperative attitude and comments have been fully communicated to the upper echelons of the Pentagon.
The head of a base commander in an island nation in the Far East can be easily cut off at the whim of the Pentagon.","…………………………
Ah, sí, una cosa que no mencioné.
Su actitud y declaraciones poco cooperativas han sido transmitidas al alto mando del Ministerio de Defensa con todo detalle.
La cabeza de un comandante de base en un país insular del Lejano Oriente puede ser fácilmente cortada a capricho del Ministerio de Defensa."
"Seanel Br (talking)","……………………………………はい？","…………………………………… hai?","…………………………………… hai?"
"Ehavilla Me (talking)","シーネル司令…… 君も本国へ帰る準備をしておくといい。
最も君は、研究室に戻るだけの私と違い 生まれ故郷のアイダホまで 真っ直ぐ帰る事になるだろうが。","Seanel  Command…… You should get ready to head back home.
You'll be heading straight back to your native Idaho, unlike me who'll just be going back to the lab.","Seanel Comando…… Tú también deberías estar listo para ir a casa.
Volverás directamente a tu Idaho natal, a diferencia de mí, que sólo volveré al laboratorio."
"Seanel Br (talking)","………………な……","………………な……","………………な……"
"Ehavilla Me (talking)","何、これはあくまで仮決定だ。 心配することはない。 軍はそうそう士官の首など切らぬよ。
少なくとも後任の司令官が決まるまで 君はその椅子に座っていられるだろう。
ではな、シーネル司令。 また会える日まで……","What? This is only a tentative decision. There is nothing to worry about. The military doesn't fire officers that often.
At least you'll be able to sit in that chair until a replacement commander is found.
Good-bye, Commander Seanel. Until we meet again……","Qué, esto es sólo una decisión provisional. No hay nada de qué preocuparse. El ejército no despide a los oficiales tan a menudo.
Al menos podrá sentarse en esa silla hasta que se encuentre un comandante sustituto.
Adiós, Comandante Seanel. Hasta que nos volvamos a encontrar……"
"Seanel Br (talking)","………………
み、見苦しいハッタリね。 私のようなエリート士官を 本国が放逐するもんですか……
あー、せいせいした。 明日からのんびりしよう……","………………
I'm sorry, but you're bluffing. How can the home country let an elite officer like me go ……
Oh, I'm so relieved. Let's take it easy tomorrow……","………………
 'Te estás tirando un farol, te estás tirando un farol. ¿Cómo puede el país de origen dejar libre a un oficial de élite como yo? ……
Ah, estoy tan aliviada. Vamos a tomarlo con calma mañana……"
"Judy Ca (talking)","……シーネル司令。 本国より命令書が届いております。","……Seanel Command. Orders have been received from your home country.","……Seanel Comando. Se han recibido pedidos del país de origen."
"Seanel Br (talking)","そう、ありがとうジュディ。 後で目を通すから、そこに……","Yes, thanks Judy. I'll look through it later, there: ……","Sí, gracias Judy. Lo revisaré más tarde, ahí: ……"
"Judy Ca (talking)","いえ、司令。 今すぐ目を通して下さい。","No, Commander. Please look through it now.","No, el mando. Por favor, revíselo ahora."
"Seanel Br (talking)","………………？
ええと……何、これ。 辞令………………
私の辞令？！
シーネル・ブラウン…… ニホン進駐軍エデン司令の任を解き、 情報局への転属を命ずる。
 ……や…………やったわ！ ついに転属よ、この極東の島国から おさらばできるわーーーーーー！！","………………?
Uh…… what, this. My letter of resignation………………
My letter of resignation?
Seanel and Brown…… relieve you of your duties as Commander of the Japanese Occupation Forces Eden and transfer you to the Intelligence Bureau.
I did…… and …………! I'm finally transferring and can kiss this far eastern island nation goodbye!!!!!!!!!!!!!!!!!!!!!!!!!!!!!!!!!!!","………………?
Uh…… qué, esto. Mi renuncia ………………
 ¿Mi carta de renuncia?
Seanel y Brown…… le relevan de sus funciones como Comandante de las Fuerzas de Ocupación japonesas Eden y le ordenan que se traslade a la Oficina de Inteligencia.…… y………… ¡Lo hice! Por fin me traslado y puedo despedirme de esta nación insular del Lejano Oriente."
"Judy Ca (talking)","……そんなに嬉しいのですか、司令。","…… Are you that happy, Commander?","…… ¿Está tan contento, Comandante?"
"Seanel Br (talking)","当然よ！　情報局って言ったら 上に認められた人間でなきゃ務まらない 文字通りの出世コースですしね！！
 ……で、 私の後任は誰になるのかしら？","Of course!　The Intelligence Bureau is a literal career track where you have to be the highest-ranking person in the organization to be considered for the job!
Who will replace me at ……?","Por supuesto.　Cuando digo inteligencia, tienes que ser alguien reconocido por tus superiores, ¡porque es literalmente una carrera!
 ¿Quién me va a sustituir en ……?"
"Ehavilla Me (talking)","…………私だ。","………… I am.","………… I."
"Seanel Br (talking)","な……イハビーラ博士？！ あなたいつニホンに……","What ……Ehavilla Dr.? When did you come to Japan……","¿Qué ……Ehavilla Dr? ¿Cuándo vas a venir a NIHON……"
"Ehavilla Me (talking)","昨日だ。 まずキョウの進駐軍本部に挨拶へ赴き、 それから車でエデンヘ入った。
さて、再会の喜びを分かち合う 間もなくて残念だが、 この部屋を明け渡してもらおうか。","Yesterday. First, I went to the headquarters of the Occupation Forces in Kyo to pay my respects, and then I drove into Eden.
Now, I'm sorry it's too soon to share the joy of our reunion, but I'm going to have to ask you to vacate this room.","Ayer. Primero fui a la sede de la Ocupación en Keogh para saludar, y luego me dirigí a Eden.
Ahora, siento que sea demasiado pronto para compartir la alegría de nuestro reencuentro, pero voy a tener que pedirte que le des esta habitación a Mei."
"Seanel Br (talking)","ちょ、ちょっと待って。 私の後任は本当にあなたなの？
一介の軍医が基地司令なんて、 そんなの有り得ないわ……","Wait a minute. Are you really going to replace me?
How is it possible for a military doctor to be a base commander? ……","Espera, espera un minuto. ¿Realmente me estás reemplazando?
 ¿Cómo es posible que un médico militar sea comandante de base? ……"
"Ehavilla Me (talking)","事実は事実だ。 それともまた、国防総省の指令書を 君に見せねばならんのかな？","Facts are facts. Or do I have to show you the Pentagon directive again?","Los hechos son los hechos. ¿O tengo que enseñarte otra vez la directiva del Ministerio de Defensa?"
"Seanel Br (thinking)","……あ、たしかこの人、 バックに国防総省のお偉いさんが 居たんだったわね……
 …………まさか、 前にも増してメチャクチャな事を する気なんじゃ……
 ………………
ま、いいか。 私にはもう関係ない事ですものね。","…… Oh, I thought this guy was backed by DOD brass……………… I don't think he's going to do something even more messed up than before… ……
 ………………
Oh, well. It's none of my business anymore.","…… Oh, pensé que este tipo estaba respaldado por los jefes del Pentágono……………… No creo que vaya a hacer algo aún más desordenado que antes……
 ………………
Bueno, mira. Ya no es asunto mío."
"Ehavilla Me (talking)","……何か言いたそうだな？ シーネル少佐。","…… have something to say about that? Major Seanel.","…… ¿Qué tienes que decir al respecto? Seanel Mayor."
"Seanel Br (talking)","いえいえいえ、別に何も。
さあ、早く私物をまとめなくっちゃ…… 今日の夜に出る定期便で本国に戻って 新しい配属先へ発たなきゃいけないし。
ジュディ、ちょっと手伝って。","No, no, no, nothing.
Now, I need to get my personal stuff together quickly…… I have to leave for my new assignment back home on the regular flight that leaves this evening.
Judy, a little help here.","No, no, no, nada.
Vamos, tengo que empacar mis cosas personales rápidamente…… Tengo que partir hacia mi nuevo destino en casa en el vuelo regular de esta noche.
Judy, un poco de ayuda aquí."
"Judy Ca (talking)","申し訳ありません、少佐。 私は本日付けでイハビーラ司令の 部下となりましたので……","Sorry, Major. I am now under the command of Commander Ehavilla as of today……","Lo siento, Mayor. A partir de hoy, estoy bajo el mando del Comandante Ehavilla ……"
"Seanel Br (talking)","あ……そう。 そうなるのね、仕方ないか……
それじゃあ、私はこれで。 イハビーラ司令、頑張って黄色い猿共を 統率して下さいね~~~♪","Oh…… yeah. So that's what happens, I guess……
Well then, I'll be off then. Ehavilla Commander, good luck leading those yellow monkeys~~~!","Oh…… sí. Así que eso es lo que pasa, no te culpo……
Bueno, te dejaré con ello entonces. Comandante, buena suerte liderando a esos monos amarillos."
"Judy Ca (talking)","………………
哀れですね。","………………
Pathetic.","………………
Patético."
"Ehavilla Me (talking)","ああ、本国へ戻って正式に辞令を受けて、 北極勤務だと聞かされるその時が 哀れでならんな。
たった一人でブリザードに震えながら、 北極の天候を無線で報せるだけの日々……
 ……彼女に耐えられるといいが。","Oh, how pathetic it will be when I get back home and get my official letter of appointment and am told I'm going to be assigned to the Arctic.
All alone, shivering in a blizzard, just radioing the weather in the Arctic………… Hope she can endure it.","Oh, qué patético será cuando vuelva a casa y reciba mi carta oficial de nombramiento y me digan que estoy de servicio en el Ártico.
Solo, temblando en una ventisca, informando del tiempo del Ártico por la radio………… Espero que pueda soportarlo."
"Judy Ca (talking)","情報局と言っても任務はピンから キリまであるんですね…… 知りませんでした。","I didn't know that the missions of an intelligence agency can range from pinpoint to the last……","No sabía que las misiones de un servicio de inteligencia pueden ir desde el punto de mira hasta el último……"
"Ehavilla Me (talking)","どこの世界でもそういうものだ。
彼女の二の舞を演じたくなければ 私のため懸命に働くことだ、ジュディ君。","That's the way it is in every world.
If you don't want to play second fiddle to her, work hard for me, Judy boy.","Así es en todo el mundo.
Si no quieres hacer de su segundo Mai, trabaja duro para mí, Judy chico."
"Judy Ca (talking)","は、はいっ、もちろんです！ 誠心誠意司令のため尽くさせて頂きます！","Yes, yes, of course! I will do my best for the command with all my heart and soul!","Sí, sí, por supuesto. Serviré a tus órdenes con todo mi corazón y mi alma."
"Ehavilla Me (talking)","では、早速だが…… 昨日指示した報告書を提出して貰おうか？","Well, let's get right to it…… I'll need you to submit the report I instructed you to do yesterday.","Así pues, pongámonos manos a la obra…… Necesitaré que entregues el informe que te indiqué ayer, ¿de acuerdo?"
"Judy Ca (talking)","はっ、司令。 こちらに…………","Ha, Command. Here is …………","Ha, Comando. Aquí tienes: …………"
"Ehavilla Me (talking)","ふむ…………","Hmmm …………","Hmm …………"
"__system__??","{RND \ 0:","",""
"Ehavilla Me (talking)","那古教は壊滅したのか…… まあ、ここまでは予想できたが……
 ……Ａ１号は、まだ生きているのか？","Has Nakokyou been destroyed…… Well, so far so predictable……
Is ……A1 still alive?","¿Ha sido destruida Nakokyou?…… Bueno, hasta ahora es predecible……
 ¿Sigue vivo ……A1?"
"Judy Ca (talking)","はい、諜報部がその姿を 写真に収めています。
どうやら奉仕青年団は、 那古教の教祖を捕らえたのち、 部下として雇用した模様で……","Yes, the Intelligence Service has a picture of them.
It appears that the youth service group captured the guru of Nakokyou and then hired him as a subordinate……","Sí, el Servicio de Inteligencia ha capturado una imagen de ella.
Al parecer, el Cuerpo de Jóvenes del Servicio capturó al gurú de Nakokyou y luego lo contrató como subordinado……"
"Ehavilla Me (talking)","……クククッ……そうか、 これは仕事がやりやすくなった……
待っていろ、Ａ１号…… もう逃がしはしないっ……！","Wait for me, A1,…… I won't let you get away with it anymore,……!","Espérame, A1…… No te dejaré escapar de nuevo……"
"__system__??","}","",""
"__system__??","{★那古教 = 3:","",""
"Ehavilla Me (talking)","那古教は、すでに壊滅しているのか…… 奉仕青年団が潰したそうだな。","Is Nakokyou already destroyed…… I heard the service youth group crushed it.","Nakokyou ya ha sido destruido?…… He oído que el grupo de jóvenes del servicio lo ha destruido."
"Judy Ca (talking)","残念ながら、教祖・由女の消息は つかめませんでした……","Unfortunately, we have been unable to find any news on Oyasama Yume ……","Por desgracia, no hemos podido localizar al gurú, Yume……"
"Ehavilla Me (talking)","想像はしていた。 諦め切れぬが……仕方あるまい。
Ａ１号は無かったものとして 研究を続けていくとしよう。
 ……我々には、 為さねばならぬ事があるのだからな。","I had imagined it. I can't give up on it, but…… can't help it.
We will continue our research as if A1 had never happened.
We have to do what we have to do……","Lo había imaginado. No puedo rendirme, pero no puedo…… evitarlo.
Continuaremos nuestra investigación como si el A1 nunca hubiera ocurrido.…… tenemos un trabajo que hacer."
"Judy Ca (talking)","はっ。","Ha.","Ha."
"__system__??","}","",""
"__system__??","{★那古教 \ 3:","",""
"Judy Ca (talking)","なるほど…… 那古教はまだ存続していたか。
ククッ……これはいい。 今なら軍を動かして Ａ１号を奪い返すことは容易い……
待っていろ、Ａ１号…… もう逃がしはしないっ……！","I see…… Nakokyou is still in existence?
Kukk…… this is good. Now it's easy to move the army and take back the A1……
Wait for me, A1…… I won't let you get away anymore……!","Ya veo…… Nakokyou sigue existiendo?
Kukku…… esto es bueno. Ahora es fácil mover el ejército y recuperar la A1……
Espérame, A1……, ¡no te dejaré escapar otra vez……!"
"__system__??","}","",""
"Ehavilla Me (talking)","…………さあ、我が娘たちよ。 何を為すべきかは解っているな。","………… Come, my daughters. You know what you must do.","………… Ahora, mis hijas. Ya sabes lo que debes hacer."
"kyatto Me (talking)","ハイ、博士っ！ バッチリ頭に入ってますっ！","Hi, Doc! I've got it all in my head!","¡Hola, doctor! ¡Lo tengo todo en la cabeza!"
"B4 (talking)","ええと……私たちのお姉さん、 Ａ１号を取り戻すんですよね。","Let's see,…… our sister, we're getting our A1 back.","Veamos,…… nuestra hermana, vamos a recuperar la A1."
"B5 (talking)","行く手を塞ぐ者はすべて排除。 こんな簡単な指示、解るなと言う方が 難しいと思いますが。","Eliminate all those who block your way. It would be difficult to tell you not to understand such simple instructions.","Elimina a todos los que bloquean el camino. Unas instrucciones tan sencillas, que sería más difícil decirle que no las entienda."
"Ehavilla Me (talking)","よろしい。 では頼んだぞ。","Good. Then I'm counting on you.","Bien. Entonces te pido que lo hagas."
"Yume (talking)","………………
こんな殺伐とした世の中、 いつか本当に変わるのかな……","………………
I wonder if this Satsu logged in world will really change someday ……","………………
Me pregunto si este mundo de la tala de árboles Satsu cambiará realmente algún día ……"
"nakokyou  onna (talking)","……大丈夫ですよ、那古神様。
我々が……那古神様が掲げる理想は 間違ってはいません。
ならば、いつか理想は根付き、葉を広げ、 必ず世を変えていきますよ。","It's…… okay, God Nako.
The ideals that we…… Goddess Nako uphold are not mistaken.
Then, one day, the ideal will take root, spread its leaves, and surely change the world.","Nosotros…… estamos bien, Dios Nako.
Los ideales que defendemos los dioses…… Nako no están equivocados.
Entonces, un día los ideales echarán raíces, extenderán sus hojas y seguramente cambiarán el mundo."
"Yume (talking)","………………うん…… そう……思いたいよね………","……………… yeah…… so…… I'd like to think so………","……………… sí…… así que…… me gustaría pensar………"
"nakokyou  onna (talking)","さ、那古神様。お部屋に戻りま……
 ……？ 何か外が騒がしいような……","Well, Goddess Nako. Back to your room……
 ……? Something noisy outside……","Vamos, Nako Dios. Vuelve a tu habitación……
 ……? Hay algo que hace ruido fuera……"
"Yume (talking)","あ、あっち……火事じゃない？！ 火の手が上がってる……！","Oh, isn't there…… a fire over there! There's a fire going up……!","Oh, por allí…… ¡no es eso un incendio! ¡Hay un incendio subiendo……!"
"kyatto Me (talking)","…………あっ！
見ぃつけたーーーっ！ みんな、こっちこっちーっ！！ お姉さんはこっちでーーーす！","………… Oh!
I found it! This way, this way, this way, everyone! My sister is over here!","………… ¡Ah!
 ¡Te veo! ¡Por aquí, por aquí, todos! ¡Tu hermana está aquí!"
"Yume (talking)","…………？ だ、誰、あの子…………
 …………っ……ああっ……！！","…………? Who's that girl? ……………………… ……… Oh, ……!","…………? ¿Quién es esa chica? ……………………… ……… ¡Oh, ……!"
