"character";"jap text";"Eng";"Esp"
"__system__??";"{麦 = 1:";"";""
"__system__??";"{☆大谷 = 0:";"";""
"__system__??";"}";"";""
"__system__??";"{(☆大谷 = 1) * (★愛 = 3):";"";""
"__system__??";"}";"";""
"__system__??";"{☆大谷 > 49:";"";""
"__system__??";"}";"";""
"__system__??";"}";"";""
"__system__??";"{麦 = 3:";"";""
"__system__??";"{B忠誠タイプ = 1:";"";""
"__system__??";"}";"";""
"__system__??";"}";"";""
"__system__??";"{麦 = 10:";"";""
"__system__??";"}";"";""
"__system__??";"{麦 = 11:";"";""
"__system__??";"}";"";""
"__system__??";"{麦 = 13:";"";""
"__system__??";"{H物欲抵抗 <= H物欲:";"";""
"__system__??";"}";"";""
"__system__??";"}";"";""
"__system__??";"{麦 = 15:";"";""
"__system__??";"}";"";""
"__system__??";"{麦 = 16:";"";""
"__system__??";"}";"";""
"Ootani Yoshitsugu (talking)";"…………？
 ……呼ばれてきたと言うのに、 あの男は居ないのか。";"…………?…… you say you've been called, but that guy isn't here.";"…………?…… Digo que me han llamado, pero el hombre no está aquí?"
"Nogi Kikuko (talking)";"…………あっ。 大谷様じゃないですか？ ご無沙汰しております。";"………… Oh. Is it not Mr. Ootani? It's been a while.";"………… Oh. ¿No es ese el señor Ootani? Ha pasado un tiempo."
"Ootani Yoshitsugu (talking)";"おお……喜久子お嬢様。
こちらこそ、同じ組織に居るというのに、 すれ違いばかりで恐縮です。";"Oh ……Madam Kikuko.
I'm sorry for all the misunderstandings we've had, even though we're in the same organization.";"Oh ……Madam Kikuko.
Lamento que sigamos cruzando caminos, aunque estemos en la misma organización."
"Nogi Kikuko (talking)";"いえ、大谷さんがお忙しい身だという事、 私は悪司の妻として 重々承知しておりますから。";"No, as Akuji's wife, I am well aware of your busy schedule.";"No, como esposa de Akuji, soy consciente de que Ootani está muy ocupado."
"Ootani Yoshitsugu (talking)";"ああ……そうでした。 ご結婚なさったとかで。
どうですか、生活が変わって。 何かと大変かとは思いますが……";"Oh…… it was. I heard you got married.
How is your life now? I know it must be difficult for you……";"Oh,…… fue. He oído que te has casado.
 ¿Cómo está cambiando tu vida? Sé que es mucho para tratar……"
"Nogi Kikuko (talking)";"いえ、全く。 お陰様で幸せな日々を過ごしております。";"No, not at all. Thanks to you, I am spending happy days.";"No, en absoluto. Somos felices gracias a usted."
"Ootani Yoshitsugu (talking)";"良かった、それは何より。";"Good, that's good to know.";"Bien, es bueno saberlo."
"Yamamoto Akuji (talking)";"…………何だよ。 えらい堅苦しい会話だと思ったら きっこと大谷だったのか。";"What's with …………? I thought it was a very formal conversation, but it was Kikkoto Ootani.";"………… ¿Qué demonios? Pensé que era una conversación muy formal, pero era Kikkoto Ootani."
"Nogi Kikuko (talking)";"まあ、旦那様。お聞きでしたか？";"Well, sir. Did you hear that?";"Bien, señor. ¿Te has enterado?"
"Ootani Yoshitsugu (talking)";"……今すぐ来いと人を呼びつけて、 席を外しているとは、随分だな。";"…… You call someone to come over right now and then you're out of your seat, how dare you.";"…… Es todo un acontecimiento llamar a alguien para que venga ahora, y que luego abandone su asiento."
"Yamamoto Akuji (talking)";"こらえてくれ、ションベンだ。";"Hold it, I'm pissing.";"Espera, es una meada."
"Ootani Yoshitsugu (talking)";"………………
いや、乃木大将もお嬢様も、 お前のそういう所に 惹かれたのだとは思うが。";"………………
No, I'm sure both General Nogi and the lady were attracted to that part of you.";"………………
No, estoy seguro de que tanto el general Nogi como la señora se sintieron atraídos por eso de usted."
"Yamamoto Akuji (talking)";"んあ？";"Hmm?";"¿Eh?"
"Ootani Yoshitsugu (talking)";"……まあいい、早く用件を言え。";"……Well, come on, just tell me what you want.";"…… Bueno, vamos, dime lo que quieres."
"Yamamoto Akuji (talking)";"……お、来たな大谷。 こっちだ、こっちー。";"…… Oh, here you are Ootani. This way, this way.";"…… Oh, estás aquí Ootani. Por aquí, por aquí."
"Ootani Yoshitsugu (talking)";"何の用だか知らないが、手短に頼む。";"I don't know what you want, but make it quick.";"No sé lo que quieres, pero por favor, sé breve."
"Yamamoto Akuji (talking)";"何だよ、いきなり手短にって。
まあゆっくり茶でも飲めよ。 それとも今急いでんのか？";"What's the matter?
Well, take your time and have a cup of tea. Or are you in a hurry?";"¿Qué te pasa, de repente quieres ser breve?
Bueno, tómate tu tiempo y toma una taza de té. ¿O tienes prisa ahora?"
"Ootani Yoshitsugu (talking)";"……別に、急いではいない。
だが、私がここに居ると迷惑になる。 お前のために言っているのだ。";"……Not that I'm in a hurry.
But my presence here would be a nuisance. I'm saying this for your own good.";"…… No es que tenga prisa.
Pero mi presencia aquí sería una molestia. Lo digo por tu bien."
"Yamamoto Akuji (talking)";"何だよ、迷惑って……";"What a nuisance……";"Qué molestia……"
"__system__??";"{RND \ 0:";"";""
"__system__??";"}";"";""
"__system__??";"{RND = 0:";"";""
"__system__??";"}";"";""
"Kako Mirai (talking)";"……おかしいにゃりね~…… 事務所に入ったと思ったにゃりが……";"…… funny nyari ne~…… nyari thought she had joined an office ……";"…… Funny Nyari Ne -…… Nyari pensó que había entrado en una oficina ……"
"Yamamoto Akuji (talking)";"……？　何やってんだ、未来。";"……?　What are you doing, Mirai?";"……?　¿Qué estás haciendo, Mirai."
"Kako Mirai (talking)";"にーちゃん、さっきこっちに 怪しい覆面男が来なかったにゃりか？
未来ちゃんから目を逸らして、 逃げるようにこっち来たにゃり。 あいつ絶対変にゃり。";"Nya-chan, did you see a suspicious masked man coming this way just now?
He turned away from Mirai and came this way to run away. That guy is definitely weird.";"Nychan, ¿has visto a un misterioso hombre enmascarado venir por aquí antes?
Apartó la mirada de Mirai y vino hacia aquí para escapar. Definitivamente es raro."
"Yamamoto Akuji (talking)";"変かどーかは知らねぇが、 覆面男ならここに居るぞ。";"I don't know if it's weird or not, but the masked man is here.";"No sé si es raro o no, pero el hombre enmascarado está aquí."
"Ootani Yoshitsugu (talking)";"……………………";"……………………";"……………………"
"Kako Mirai (talking)";"げ。 こいつにゃりよ、こいつ！";"I'm sorry, I'm sorry, I'm sorry. It's him. It's him!";"Gee. ¡Es él, es él!"
"Yamamoto Akuji (talking)";"げ、って何だおめー。 失礼なやっちゃな。";"What are you talking about? You're so rude.";"¿Qué quieres decir con “ge”? Eres muy grosero."
"Kako Mirai (talking)";"だってその覆面、ヤバいオーラが 漂いまくってるにゃりよ！？
覆面の目の穴から見えてる皮膚も すんごい色が変にゃり。 絶対病気持ちにゃりよー……";"Because that mask has an aura of something bad!
The skin that you can see through the eye holes of the mask has a very strange color. I'm sure he has a disease……";"¡Porque esa máscara tiene un aura de peligro por todas partes!
La piel que se ve a través de los agujeros de los ojos de la máscara tiene un color muy extraño. Está definitivamente enfermo……"
"Yamamoto Akuji (talking)";"滅茶苦茶ぬかすな。";"Don't be absurd.";"No seas un desastre."
"Ootani Yoshitsugu (talking)";"……仕方あるまい、 私を初めて見たのなら、 その娘のような反応が普通だろう。";"If this is the first time you've seen me, it's normal to react like that girl.";"…… no puede evitarlo, si no me ha visto nunca, es normal que reaccione como esa chica."
"Yamamoto Akuji (talking)";"あー、気にすんなよ。 こいつ基本的にバカだから。";"Oh, don't worry about it. He's basically an idiot.";"Ah, no te preocupes. Es básicamente un idiota."
"Kako Mirai (talking)";"ば、バカって何にゃりかー！！";"What do you mean, “idiot”?";"¿Qué quieres decir con “idiota”?"
"Yamamoto Akuji (talking)";"つーか、大谷ってさ、 別に病気って訳じゃねぇだろ？
たしか乃木さんは、 火傷がどうとか言ってたが……";"I mean, Ootani isn't really sick, is he?
I think Nogi said something about burns……";"Quiero decir, Ootani no está realmente enfermo, ¿verdad?
Creo que Nogi dijo algo sobre las quemaduras……"
"Kako Mirai (talking)";"火傷なんて嘘にゃり！ この人病院みたいな臭いするにゃり！ 絶対何かのヤバい病気にゃりよ！！";"No way! He smells like a hospital! He's definitely got some kind of bad disease!";"¡Las quemaduras son una mentira! ¡Huele como un hospital! ¡Definitivamente tiene alguna enfermedad grave!"
"Ootani Yoshitsugu (talking)";"……別に、私は病気などではない。 今言われた通り、戦時中の空襲で 大火傷を負っただけだ。
そのせいで、顔の形が変わってしまった。 この覆面はそのせいだ。
あと、時々は膿も出るのでな。 消毒液や皮膚薬もよく使うが。";"…… I am not sick. As you just said, I was just severely burned in an air raid during the war.
It changed the shape of my face. That's why I have this mask.
I also get pus from time to time. I often use antiseptic and skin medicine.";"…… No es que esté enfermo ni nada por el estilo. Como acabas de decir, me quemé gravemente en un ataque aéreo en tiempos de guerra.
Cambió la forma de mi cara. Por eso tengo esta máscara.
Además, de vez en cuando me sale pus. Suelo utilizar soluciones antisépticas y medicamentos para la piel."
"Kako Mirai (talking)";"なら証明して欲しいにゃり！ その覆面取るにゃりよ！！";"Then I want you to prove it! Take off that mask!";"¡Entonces quiero que lo demuestres! ¡Quítate esa máscara!"
"Ootani Yoshitsugu (talking)";"…………………… 仕方ない。";"…………………… No choice.";"…………………… No hay opción."
"narrator";"大谷は、被っている覆面を 顎から口元の辺りまでそっと持ち上げた。";"Ootani gently lifted the mask he was wearing from his chin to around his mouth.";"Ootani levantó suavemente la máscara que llevaba desde la barbilla hasta alrededor de la boca."
"Kako Mirai (talking)";"…………………………ひぅ。";"…………………………Hi ~u.";"…………………………Hi ~u."
"Yamamoto Akuji (talking)";"ありゃー、こりゃひでえ。 ほっぺたが原形留めてねーな、 歯が見えてるぜ……";"Oh my, this is terrible. His cheeks are not in their original shape. You can see his teeth……";"Oh, Dios mío, eso es terrible. Tus mejillas no tienen su forma original, se te ven los dientes……"
"Kako Mirai (talking)";"…………み、未来ちゃん退場にゃり。 気分悪くなってきたにゃり……";"…………Mi, Mirai-chan is leaving. I'm starting to feel sick……";"…………Mi, Mirai-chan se fue. Estoy empezando a sentirme mal……"
"Yamamoto Akuji (talking)";"あ……おいこら未来。
ったく、勝手なやっちゃなー。 ……気にすんなよ、大谷。";"Oh,…… Hey there, Mirai.
You're so selfish. Don't worry about ……, Ootani.";"Oh,…… Hey, vamos, Mirai.
Eres muy egoísta…… No te preocupes, Ootani."
"Seinendan Jyoshi (talking)";"……あ、あれ…… 事務所に入ったと思ったのに……";"…… Oh, that…… I thought I was in an office……";"…… Oh, eso…… Pensé que estaba en una oficina……"
"Yamamoto Akuji (talking)";"……？　おう、どーかしたか？";"……?　Oh, what's up?";"……?　¿Qué pasa?"
"Seinendan Jyoshi (talking)";"……あの、悪司さん。 覆面をした怪しい人を見ませんでしたか？";"…… Um, Akuji. Have you seen a suspicious masked person?";"…… Um, Akuji. ¿Ha visto a alguna persona sospechosa con máscaras?"
"Yamamoto Akuji (talking)";"怪しいかどーかは知らねぇが、 覆面男ならここに居るぞ。";"I don't know if it's suspicious or not, but the masked man is here.";"No sé si es sospechoso o no, pero el hombre enmascarado está aquí."
"Ootani Yoshitsugu (talking)";"……………………";"……………………";"……………………"
"Seinendan Jyoshi (talking)";"ひっ……";"(a) ……";"(copia) ……"
"Yamamoto Akuji (talking)";"ひっ、って何だおめー。 失礼だぞー？";"What are you talking about? You're being rude!";"¿Qué quieres decir con “hic”? Estás siendo grosero, ¿no?"
"Seinendan Jyoshi (talking)";"す、すみません…… でも、あの……";"Sorry, sorry…… but that ……";"Lo siento, lo siento…… Pero, um, ……"
"Ootani Yoshitsugu (talking)";"……仕方あるまい、 私を初めて見たのなら、 その娘のような反応が普通だろう。
マスクの隙間から私の爛れた皮膚を見て、 顔をしかめぬ者はまず居ないからな。";"If this is the first time you've seen me, it's normal to react like that girl.
There is no one who can look through the mask and see my sore skin and not frown.";"Si…… no me ha visto nunca, es normal que reaccione como esa chica.
No hay una sola persona que no frunza el ceño cuando ve mi piel dolorida a través de la máscara."
"Yamamoto Akuji (talking)";"爛れた皮膚？
あ……そうだ、たしか乃木さん、 火傷がどうとか言ってたな。 おめーの覆面って……";"Sore skin?
Oh…… yeah, I think Nogi said something about burns. Your mask is ……";"¿Dolor de piel?
Oh…… sí, creo que Nogi dijo algo sobre las quemaduras. Su máscara es ……"
"Ootani Yoshitsugu (talking)";"その通りだ。 大火傷で生死の境を彷徨った。
お陰で、顔の形が すっかり変わってしまってな。 覆面はそのためにつけている。";"That's right. I was on the verge of life and death due to a serious burn.
It changed the shape of my face completely. That's why I wear the mask.";"Así es. Me quemé mucho y estuve a punto de morir.
Cambió la forma de mi cara por completo. Por eso llevo la máscara."
"Yamamoto Akuji (talking)";"？";"？";"？"
"Ootani Yoshitsugu (talking)";"……仕方ないか。 見てもらうしかあるまい。";"…… I don't have a choice. You'll just have to see it.";"…… ¿No hay otra opción? Tendrás que dejar que lo vean."
"narrator";"大谷は、被っている覆面を 顎から口元の辺りまでそっと持ち上げた。";"Ootani gently lifted the mask he was wearing from his chin to around his mouth.";"Ootani levantó suavemente la máscara que llevaba desde la barbilla hasta alrededor de la boca."
"Seinendan Jyoshi (talking)";"…………………………ひぅ。";"…………………………Hi ~u.";"…………………………Hi ~u."
"Ootani Yoshitsugu (talking)";"傷から時折、膿が出るのだ。 少し臭うかもしれん。 ……今は幾分ましだと思うが。";"The wound occasionally produces pus. Might smell a little…… I think it's somewhat better now, though.";"La herida produce ocasionalmente pus. Podría oler un poco…… Creo que ahora está algo mejor."
"Yamamoto Akuji (talking)";"ありゃー、こりゃひでえ。 ほっぺたが原形留めてねーな、 歯が見えてるぜ……";"Oh my, this is terrible. His cheeks are not in their original shape. You can see his teeth……";"Oh, Dios mío, eso es terrible. Tus mejillas no tienen su forma original, se te ven los dientes……"
"Seinendan Jyoshi (talking)";"…………す、すみません。 私、ちょっと……";"………… Sorry, I'm sorry. I'm just a little ……";"………… Lo siento, lo siento. Sólo soy ……"
"Yamamoto Akuji (talking)";"あ……おいこら。
ったく、失礼なやっちゃなー。 ……気にすんなよ、大谷。";"Oh,…… Hey, hey, hey.
You're so rude! Don't worry about ……, Ootani.";"Oh,…… Hey, vamos.
Eres muy grosero…… No te preocupes, Ootani."
"Ootani Yoshitsugu (talking)";"…………いつもの事だ、慣れている。
お前とて、私と長話など したくはあるまい。 さ、早く用件を言え。";"…………It happens all the time, I'm used to it.
You don't want to have a long talk with me either. Now, come on, tell me what you want.";"………… Pasa todo el tiempo, estoy acostumbrado.
Tampoco quieres tener una larga charla conmigo. Ahora, vamos, dime lo que quieres."
"Yamamoto Akuji (talking)";"ああ、あんたもしかして、 そんなこと気にしてたのか？
心配すんな、俺はんなこと 気にしねえ方だからよ。";"Oh, you're worried about that?
Don't worry, I don't care about such things.";"Oh, ¿te preocupa eso?
No te preocupes, no me importan esas cosas."
"Ootani Yoshitsugu (talking)";"気休めはいい。";"I don't need to feel at ease.";"No te preocupes por la comodidad."
"__system__??";"{☆ギガフロート \ 0:";"";""
"__system__??";"}";"";""
"Takega Satsu (talking)";"……悪司、今学校から戻ったぞ。 そちらは客人か？";"……Akuji, I just got back from school. Are you a guest over there?";"……Akuji, ya he vuelto de la escuela. ¿Eres un invitado allí?"
"Yamamoto Akuji (talking)";"ああ、いや、部下の大谷だよ。 ほれ、乃木さんのとこの。";"Oh, no, it's my subordinate Ootani. Look, from Nogi's place.";"Oh, no, es mi subordinado Ootani. Mira, desde el lugar de Nogi."
"Ootani Yoshitsugu (talking)";"………………";"………………";"………………"
"Takega Satsu (talking)";"ああ、存じ上げている。 あまり姿を見たことはないが……";"Yes, I know who you are. I haven't seen much of you, though: ……";"Sí, sé quién eres. Sin embargo, no te he visto mucho……"
"Ootani Yoshitsugu (talking)";"私は、人を避けてしまう性でな。 ……話すのは初めてだと思う。";"I have a tendency to avoid people. I don't think I've ever talked to…… before.";"Soy de la naturaleza de evitar a la gente. Creo que nunca había hablado con ……."
"Takega Satsu (talking)";"では大谷どの、一応は初めましてと 言わせてもらおう。";"Well, Ootani, let me just say it's nice to meet you.";"Bueno, Ootani, permíteme decir que es un placer conocerte al menos."
"__system__??";"{★愛 \ 5:";"";""
"Takega Satsu (talking)";"悪司の叔母、岳画殺だ。";"This is Akuji's aunt, Takega Satsu.";"La tía de Akuji, Takega Satsu."
"__system__??";"}";"";""
"__system__??";"{★愛 = 5:";"";""
"Takega Satsu (talking)";"悪司の妻、殺だ。以後よろしく。";"I'm Satsu, wife of Akuji. Please take care of me from now on.";"Soy Satsu, esposa de Akuji. Por favor, cuida de mí a partir de ahora."
"__system__??";"}";"";""
"narrator";"殺は、大谷へごく自然に右手を差し出した。";"Satsu naturally held out his right hand to Ootani.";"Satsu con mucha naturalidad le tendió la mano derecha a Ootani."
"Ootani Yoshitsugu (talking)";"……握手をするのか、この私と。";"…… you shake hands with me, here.";"…… Me das la mano, aquí."
"Takega Satsu (talking)";"そのつもりだが。 何か問題でも？";"I intend to. What's the problem?";"Tengo la intención de hacerlo. ¿Cuál es el problema?"
"Ootani Yoshitsugu (talking)";"私が怖くはないのか。";"Are you not afraid of me?";"¿No tienes miedo de mí?"
"Takega Satsu (talking)";"それはもしや、 そなたの覆面の下の事か？";"Is that, by any chance, what's under your mask?";"¿Es eso, por casualidad, lo que hay bajo tu cubierta?"
"Ootani Yoshitsugu (talking)";"……見ていたのか。";"You've been watching …….";"Has estado viendo ……."
"Takega Satsu (talking)";"玄関先から、遠目にはな。";"From the front porch, from a distance.";"Desde la puerta, desde la distancia."
"Ootani Yoshitsugu (talking)";"………………";"………………";"………………"
"Takega Satsu (talking)";"別に握手を無理強いする気はない。 嫌なら手を収めるが……";"I'm not trying to force you to shake my hand. If you don't like it, I'll put my hand away……";"No estoy tratando de forzarte a estrechar mi mano. Si no te gusta, apartaré la mano……"
"Ootani Yoshitsugu (talking)";"……いや。 こちらこそ、よろしく頼む。";"…… No. Nice to meet you too.";"…… No. Encantado de conocerte también."
"Takega Satsu (talking)";"うむ。
 ……では私は、 茶でも淹れてこよう。";"Mm.
I'll go make myself a cup of tea at …….";"Mm.
En…… iré a prepararme una taza de té."
"Yamamoto Akuji (talking)";"ああ、よろしく頼むぜ、さっちゃん。";"Yeah, nice to meet you, Sacchan.";"Sí, encantado de conocerte, Sacchan."
"Takega Satsu (talking)";"では大谷どの、失礼する。";"Now, Ootani which, excuse me.";"Ahora, Ootani que, perdón."
"Ootani Yoshitsugu (talking)";"……肝の据わった娘だ。";"…… She's a girl with a lot of heart.";"…… Es una chica con muchas agallas."
"Yamamoto Akuji (talking)";"うちの家系だからかねー、 変なヤツに耐性があんのかもな。
だからおめーも、あんま気にしないで ここじゃ自然にしてるこった。
うちにゃ変なヤツも結構いるしよ、 おめー自身も、人間的に破綻してるとか そういう訳じゃねえだろ？
そのうち、みんな慣れてくるさ。";"Maybe it's because you come from my family. Maybe we have a high tolerance for weirdos.
That's why you don't worry too much about it and act naturally here.
There are a lot of strange people in my family, and you yourself are not a broken person or anything like that, right?
Everyone will get used to it in time.";"Tal vez sea porque vienes de mi familia, tal vez tengas una alta tolerancia a los bichos raros.
Por eso no debes preocuparte demasiado por ello y actuar con naturalidad.
Hay mucha gente extraña en mi casa, y tú mismo no eres una persona rota ni nada por el estilo, ¿verdad?
Con el tiempo, todo el mundo se acostumbrará."
"Ootani Yoshitsugu (talking)";"………………
乃木大将がお前を認めた理由、 解ったような気がする。";"………………
Nogi I think I understand why the general recognized you.";"………………
Nogi Creo que entiendo por qué el General te reconoció."
"Yamamoto Akuji (talking)";"ん？";"Hmm?";"¿Eh?"
"Ootani Yoshitsugu (talking)";"……いや、何でもない。";"…… No, it's nothing.";"…… No, no es nada."
"Yamamoto Akuji (talking)";"……よう、大谷。 調子はどうだ？";"…… Yo, Ootani. How's it going?";"…… Yo, Ootani. ¿Cómo va todo?"
"Ootani Yoshitsugu (talking)";"悪くはない。 それで、今日呼ばれた用は何だ。";"Not bad. So, what is it that I'm here for today?";"No está mal. Entonces, ¿para qué querías verme hoy?"
"Yamamoto Akuji (talking)";"よう、大谷。 ちゃんと仕事してっか？";"Hey, Ootani. Are you doing a good job?";"Oye, Ootani. ¿Estás haciendo bien tu trabajo?"
"Ootani Yoshitsugu (talking)";"勿論だ。
しかし、側で見れば見るほど お前と乃木大将には 通じるものを感じるな。";"Of course.
But the more I watch from the side, the more I feel something in common between you and General Nogi.";"Por supuesto.
Pero cuanto más te miro de reojo, más siento que tú y el general Nogi tenéis algo en común."
"Yamamoto Akuji (talking)";"ん？　どーいうこった？";"Hmm?　What do you mean?";"¿Hmm?　¿Qué quieres decir?"
"Ootani Yoshitsugu (talking)";"……いや。 我々が戦わずに済んだ方法が あったような気がするのだ。";"…… No. I have a feeling there was a way we could have avoided fighting.";"…… No. Siento que había una forma de evitar las peleas."
"Yamamoto Akuji (talking)";"んー、たとえそうだとしても 過去を振り返ったってしゃあねーぜ？ 前向いていこうや。";"Well, even if that's true, it's no use looking back, right? Let's look forward.";"Bueno, aunque sea así, no sirve de nada mirar al pasado, ¿verdad? Miremos hacia adelante."
"Ootani Yoshitsugu (talking)";"………………";"………………";"………………"
"Yamamoto Akuji (talking)";"えーっとな、あんたに 臨時ボーナスを出そうかと 思ってよ。";"Well, I thought I'd give you an extra bonus.";"Bueno, pensé en darte un bono extra."
"Ootani Yoshitsugu (talking)";"充分な給与は頂いている。 賞与など受け取れぬ。";"I am paid enough. I do not receive any bonuses.";"Recibo un salario adecuado. No recibo ninguna bonificación."
"Yamamoto Akuji (talking)";"いや、ボーナスは一応、 その給与の一部なんだけどよ。";"No, the bonus is part of the salary.";"No, la bonificación forma parte del salario."
