"character","jap text","Eng","Esp"
"White wolf Dan (talking)","そうか、お前か。 で、勝負するモンはどれだい？","Oh, yeah, it's you. So, which one do you want to play with?","Oh, sí, eres tú. Entonces, ¿con cuál quieres jugar?"
"Yamamoto Akuji (talking)","さっきそこで車かっぱいできたんで、 そいつで勝負するよ。","I just got a car there, so I'll use it to win.","Acabo de comprar un coche allí, así que lo usaré."
"White wolf Dan (talking)","おう！！ かかってこい！！","Hey! Come on!","¡Oh! ¡Vengan a buscarme!"
"Yamamoto Akuji (talking)","おーし。 いくぜ！","Oh, yeah. Let's go!","Oooh. ¡Vamos!"
"Yamamoto Akuji (talking)","……なんてこったい……","…… what a crock ……","…… Qué tontería: ……"
"White wolf Dan (talking)","この前のが、 俺の全力だったと思ったのか。
ぬるい！！
ぬるすぎる！！！！！
この俺は、限界から限界へと 走り抜ける男！！
この俺に勝つつもりなら、お前も 命のすべてを賭けるがいい！！
おっ！？ 困った者の声がする！！
今日はこれまでだ！！ 勝負ならいつでも受ける！！ あばよ！！","You thought I was at my best the last time?
Lukewarm!!!!
Too lukewarm ！！！！！
I am a man who runs from limit to limit!
If you're going to beat me, you're going to have to risk everything!
Whoa! I hear someone in trouble!
That's it for today! I'm ready for a fight! Goodbye!","¿Creías que estaba en mi mejor momento la última vez?
 ¡¡Caliente!!
Demasiado tibio ！！！！！
Soy un hombre que corre de límite en límite.
 ¡Si vas a vencerme, tendrás que arriesgar tu vida!
 ¡Vaya! ¡Oigo que alguien está en problemas!
Eso es todo por hoy. ¡Estoy listo para una pelea! ¡Adiós!"
"narrator","　　［ヴォンッッッ！！！］
ＷＷ弾は、トレーラーから激しく黒煙をあげ、 走り去って行った。","[VONK!!!!]
White wolf Dan Dan drove away from the trailer, emitting a violent plume of black smoke.","[VONK!!!!]
White wolf Dan Dan se alejó, con un humo negro que salía violentamente de su remolque."
"Yamamoto Akuji (talking)","だ~…ちっくしょ~… 連敗かよ~…","D~… damn… back-to-back losses…","Dah~… maldita sea~… derrotas consecutivas…"
"Yamamoto Akuji (talking)","ん~~…… ど~すっかな~…
俺以上にドキョーがあって、運転テクが あってなんて奴、うちにはいないん だけどな~…","Hmmm……… I don't know what to do…
There is no one in my family who has more excitement and driving skill than me…","Hmmm……… No sé qué hacer…
No hay nadie en mi familia que esté más entusiasmado y sea más hábil al volante que yo…"
"Takega Satsu (talking)","では、私が行こうか。","Well, let me go.","Entonces déjame ir."
"Yamamoto Akuji (talking)","へ？","Heh?","¿Eh?"
"__system__??","{★愛 = 5:","",""
"Takega Satsu (talking)","私もバイクに乗る事が出来るからな。","I can ride a motorcycle too, you know.","Yo también sé ir en moto."
"__system__??","}","",""
"__system__??","{★愛 \ 5:","",""
"Takega Satsu (talking)","自転車だったら、なんとかなるぞ。","If it's a bike, you can handle it.","Si vas en bicicleta, puedes arreglártelas."
"__system__??","}","",""
"Yamamoto Akuji (talking)","いや、そーいう訳にも…","No, that's not…","No, eso no es…"
"narrator","　　［ヴォンッッ］","[Vongh…]","[Von.]"
"Yamamoto Akuji (talking)","んっ！？","Hm!","¡Hm!"
"Takega Satsu (talking)","あれか。","That one.","Eso."
"narrator","悪司と殺の前に、トレーラーが現れた。","A trailer appeared in front of Akuji and Satsu.","Un remolque apareció frente a Akuji y Satsu."
"White wolf Dan (talking)","またきたか、悪司！！ 今日はその横の少女が、俺の相手か！？","There you go again, Akuji! That girl next to you is my opponent today!","¡Ya estás otra vez, Akuji! ¡La chica que está a tu lado es mi oponente hoy!"
"Yamamoto Akuji (talking)","いや、この人は俺の付き添いっちゅーか、 なんちゅーか。","No, this person is my chaperone, or something.","No, esta persona es mi acompañante, o algo así."
"Takega Satsu (talking)","私でよいのなら、いくらでも勝負するが。","If it's okay with me, I'll play as much as I want.","Si me parece bien, jugaré todo lo que quiera."
"Yamamoto Akuji (talking)","だーかーらー。","That's why.","Eso es porque…"
"narrator","　　［ヴォンヴォン！！！］","［Von von von!]","［Von von von!]"
"White wolf Dan (talking)","むっ！？","Mwah!","¡Mwah!"
"Yamamoto Akuji (talking)","あのエンジン音は……","That engine sound is ……","Ese sonido del motor es ……"
"narrator","そこに現れたのは、丸太バイクだった。","Then a log bike appeared.","Entonces apareció una moto de troncos."
"White wolf Dan (talking)","あんたは？","What about you?","¿Y tú?"
"Yamamoto Ippatsu (talking)","山本一発。","Yamamoto Ippatsu.","Yamamoto Ippatsu."
"White wolf Dan (talking)","あんたが次の、俺の挑戦者って訳か。","So you're my next challenger.","Así que tú eres mi próxima contrincante."
"Yamamoto Ippatsu (talking)","勝負か。 挑まれたのなら、 受けるのが男というもの。
何で勝負する？","Is it a match? If challenged, a man accepts.
Why do you want to play?","¿Coincide? Cuando se le desafía, el hombre acepta.
 ¿Por qué quieres jugar?"
"White wolf Dan (talking)","チキンランだ！！","Chicken run!!!!","¡¡¡Carrera de pollos!!!"
"Yamamoto Ippatsu (talking)","おもろしい！ かかってくるがいい！！","Oh, my God! Come and get it!","¡Oh, Dios mío! ¡Llámame, llámame, llámame!"
"Yamamoto Akuji (talking)","どーする？","What do we do?","¿Qué hacemos?"
"Takega Satsu (talking)","ほっといた方がよいだろう。","It would be better to leave it alone.","Sería mejor dejarlos solos."
"White wolf Dan (talking)","おおおおおおお！！！","Oh, oh, oh, oh, oh!","¡Oh, oh, oh, oh!"
"Yamamoto Ippatsu (talking)","ハイヨー、シルバー！！！","Hi-yo, Silver!","¡Hola, Silver!"
"narrator","一発は、弾の操るトレーラーより早く、 丸太バイクを発進！！
その後をトレーラーが追いかける！！","Ippatsu launches his log bike before Dan's Misao trailer!
The trailer follows!","¡Ippatsu lanza su moto de troncos antes que el remolque Dan de Misao!
A continuación, el tráiler."
"Yamamoto Ippatsu (talking)","とうっ！！","Toooooo!!!","¡¡¡Toooooo!!!"
"narrator","もうすぐ、道路が寸断されている部分。
一発はブレーキをかけず、アクセルを全開にした。
 　　［ばぉんっ！！］","Soon, the part of the road is cut off.
Ippatsu did not apply the brakes, but opened the accelerator to full throttle.
 　　[BANG!]","Pronto, la parte de la carretera que está cortada.
Ippatsu no frenó, sino que abrió el acelerador a fondo.
 　　[¡¡¡BANG!!!]"
"narrator","　　［きらぁん］
一発はブレーキをかける事なく、 そのまま、道路の切れている場所に突っ込み、 そして飛び去った。","［Kiraan.]
Without braking, the Ippatsu plunged into the road cut and flew away.","[KIRAAN]
El Ippatsu se metió de lleno en el corte de la carretera sin frenar, y luego salió volando."
"White wolf Dan (talking)","な、なにぃぃぃ！！！？？？","What, what, what, what?","¿Qué, qué, qué, qué?"
"Yamamoto Akuji (talking)","あ~……","Oh~……","Ah~……"
"Takega Satsu (talking)","なるほどな。 そうきたか…","I see. I see…","Ya veo. Ya veo…"
"White wolf Dan (talking)","なっ……
なんて男だ……
まっ……
負けたっ……！！
止まる事ばかりに気を取られ、 止まらなくていいという事に、 気がつかなかったっ…！！","What a man……
What a man……
Oh no……
I lost ……!
I was so focused on stopping that I didn't realize that I didn't have to stop…!","Nah……
Qué hombre……
Oh no……
 ¡He perdido ……!
Estaba tan concentrado en parar, que no me di cuenta de que no tenía que parar…"
"Yamamoto Akuji (talking)","フツー、止まるって。 あのじーさんは、規格外だから、 負けてトーゼンだ。","He'll stop, of course. That old man is so out of his league, he's going to lose.","Va a parar. Ese viejo está tan fuera de su liga, que va a perder."
"Yamamoto Akuji (thinking)","っていうか、じーさん、 何しにきたんだろう…","I mean, what is he doing here?","Quiero decir, ¿qué hace el viejo aquí…"
"White wolf Dan (talking)","約束だったな… 俺は、お前に負けた。 手下になってやろう。","You promised… I lost to you. I'll be your lackey.","Me lo prometiste… He perdido contigo. Seré tu sirviente."
"Yamamoto Akuji (talking)","いや、今のはイレギュラーだから、 んな、気にしなくても…","No, that was an irregularity. Don't worry about it…","No, eso fue una irregularidad, así que no te preocupes por…"
"White wolf Dan (talking)","いや！！ 負けは負けだ！！ この俺は、お前の手下になる！！","No!!! Losing is losing! I, here, will be your lackey!!!!","¡¡No!! Perder es perder. ¡Yo, aquí, seré tu lacayo!"
"Yamamoto Akuji (talking)","押し掛け手下かよ……","You're a pushover minion……","Eres un súbdito pusilánime……"
"White wolf Dan (talking)","よろしく頼む。","Best regards.","Saludos cordiales."
"Yamamoto Akuji (talking)","あー……まあ……よろしく。","Ahh…… well…… nice to meet you.","Ah…… bueno…… encantado de conocerte."
"narrator","ＷＷ弾は、トレーラーに乗り、巡回をしていた。","White wolf Dan Dan was on patrol in a trailer.","White wolf Dan Dan estaba de patrulla en un remolque."
"White wolf Dan (talking)","ここが悪名高い、ハニー土木か… 儲けてそーだなー。","So this is the infamous Hanny Civil Engineering… Looks like they must be making a lot of money.","Así que esta es la infame Hanny Ingeniería Civil… Deben estar ganando mucho dinero."
" (talking)","うっさいわねー。 あんたこそ、この馬鹿でかいトラック、 どっかやってよ。","You're so annoying. You, take this big truck and get rid of it.","Eres muy molesto. Tú, toma este gran y estúpido camión y deshazte de él."
"Mizuumi Kazuki (talking)","入り口にこんなの置いてたら 邪魔だわよ、搬入出来ないでしょっ！","If you put this thing at the entrance, it's in the way, we can't bring it in!","Si pones estas cosas en la entrada, estorban, ¡no podemos llevarlas!"
"White wolf Dan (talking)","………………","………………","………………"
"Mizuumi Kazuki (talking)","聞こえてんのっ！？","Can you hear me!","¿Puedes oírme?"
"White wolf Dan (talking)","惚れた！！！！！！！！！！！！！！","I'm in love: ！！！！！！！！！！！！！！","Estoy enamorado: ！！！！！！！！！！！！！！"
"narrator","社長室で、和樹はのんびりとお茶を飲んでいた。","In the president's office, Kazuki was leisurely drinking tea.","En el despacho del presidente, Kazuki estaba tomando té tranquilamente."
"Mizuumi Kazuki (talking)","ん~…いい陽気。 こんな日は、白いサマードレスを着た 眼鏡っ娘達に囲まれて、ピクニックとか…","Mmmm…nice weather. On a day like this, I'd like to have a picnic surrounded by bespectacled girls in Haku summer dresses…","Es un hermoso día soleado. En un día como este, puedes hacer un picnic rodeado de chicas con gafas y vestidos de verano Haku…"
"narrator","　　［ばかーーーーーーーーーーん！！！］","　　［bakaaaaaaaaaaan！！！］","　　［bakaaaaaaaaaaan！！！］"
"Mizuumi Kazuki (talking)","きゃあああ！！","Kiyahaaa！！","¡¡Kiyahaaa！！"
"narrator","なんと、トレーラーが社長室に突っ込んできた。 トレーラーは、深紅の薔薇で飾られている。","To my surprise, a trailer crashed into the president's office. The trailer is decorated with crimson roses.","Para mi sorpresa, un remolque se estrelló contra el despacho del presidente. El remolque está decorado con rosas carmesí."
"Mizuumi Kazuki (talking)","何よ、これーーー！！！！！","What the heck is this? ！！！！！","¿Qué demonios es esto? ！！！！！"
"White wolf Dan (talking)","結婚してくれーーーー！！！！！","Marry meooooo ！！！！！","Cásate conmigooooooooooo ！！！！！"
"Mizuumi Kazuki (talking)","断るーーーーーーーーー！！！！！！！！
あたしは、ウェディングドレスを着た 眼鏡っ娘を連れた、白馬の王子様と結婚 するって心に決めてんのよーーーー！！！
帰れーーーー！！！！！！！","I've made up my mind that I'm going to marry Haku horse prince with a bespectacled girl in a wedding dress!!!!!!!!!!!!!!!!!!!!!!!!!
Go home！！！！！！！","¡¡¡¡He decidido que me voy a casar con un príncipe caballo Haku con una chica con gafas en un vestido de novia!!!!
 ¡Vete a casa! ！！！！！！！"
"narrator","　　［ぺてっっ］","[Phew!]","[¡Uf!]"
"__system__??","{I装備[8] = 99:","",""
"narrator","和樹は、素早い変な虫を、 ＷＷ弾の顔に叩きつけた。","Kazuki slapped a quick, funny bug into White wolf Dan's face.","Kazuki dio una rápida y extraña palmada en la cara de White wolf Dan."
"__system__??","} else {","",""
"narrator","和樹は、使い古しの伝票を ＷＷ弾の顔に叩きつけた。","Kazuki slapped a used slip of paper into White wolf Dan's face.","Kazuki le puso un papel usado en la cara a White wolf Dan."
"__system__??","}","",""
"White wolf Dan (talking)","さらば……………俺の初恋……","Farewell…………… my first love ……","Adiós…………… mi primer amor ……"
"White wolf Dan (talking)","さー、こい！！ 勝負だーーー！！！","Come on, come on! Let's play!","¡Vamos, vamos! ¡¡¡Juguemos!!!"
"White wolf Dan (talking)","ここでもう、俺に出来る事はない… 次の街に旅立とう。
さらば、愛しき和樹。 お前に似合う男になって帰ってくるぜ。
とりあえずは、馬を飼うか……","There is nothing more I can do here… Let's leave for the next town.
Farewell, my dear Kazuki. I'll be back as a man who suits you.
For now, let's get a horse……","No hay nada más que pueda hacer aquí… partamos hacia la siguiente ciudad.
Adiós, mi querido Kazuki. Volveré como un hombre digno de ti.
De momento, vamos a por un caballo……"
