character,jap text,Eng,Esp
Ishihara Senju (talking),そう……こうしてじっと、行き交う人を 見てるのは、ボクにとって巣作りだよ。,"So ……, staring at people coming and going like this is nesting for me.",Así que…… este tipo de mirar a la gente mientras va y viene es un nido para mí.
Yamamoto Akuji (talking),ああ…… 蜘蛛の巣な。,"Yeah,…… spiderweb.","Oh,…… tela de araña."
Ishihara Senju (talking),"フフフ。
そこでさー、悪司。 その巣にひっかかりそーな女が、 向こうからきてるんだ。
いいかな？","Fufufu.
So, Akuji. There's a girl over there who's about to get caught in that nest.
May I?","Hmph.
Entonces, Akuji. Hay una mujer allí que está a punto de quedar atrapada en ese nido.
 ¿Puedo?"
Yamamoto Akuji (talking),いいけど、大騒ぎになるような事は すんじゃねーぞ。,"Okay, but don't do anything that would cause a fuss.","Bien, pero no hagas nada que provoque un escándalo."
Ishihara Senju (talking),ボクを誰だと思ってるのさ。,Who do you think I am?,¿Quién crees que soy?
narrator,"千手の言葉通り、角を曲がってこちらにくる 女がいた。 平凡な主婦に見える。
千手は子供の顔をして、 その女に近づいていった。","Just as Senju said, there was a woman coming around the corner toward us. She looked like an ordinary housewife.
Senju approached the woman with the face of a child.","Como dijo Senju, había una mujer que venía hacia nosotros por la esquina. Parece un ama de casa normal y corriente.
Senju se acercó a la mujer con cara de niño."
Ishihara Senju (talking),お母さん！！,Mother!,¡¡Madre!!
wakaishufu (talking),えっ…？,Eh…?,¿Eh?
Ishihara Senju (talking),"あ…ごめんなさい… 間違えちゃった…
だって…おばさん… ボクの死んだお母さん、 そっくりなんだもん…","I'm sorry, I made a mistake.
Because you look just like my dead mother.","Lo siento, me he equivocado.
Porque tú… te pareces a mi madre muerta."
wakaishufu (talking),まあ……,"Well, ……","Bueno, ……"
Ishihara Senju (talking),"あ…でも、おばさんの方が、 お母さんより綺麗だよ。
それに若いから… おばさんなんて言っちゃ失礼だね。 おねーさんだ。","Oh…but you are more beautiful than your mother.
And she's younger, so… It's rude to call her aunt. She's an old lady.","Ah… pero tu tía es más guapa que tu madre.
Y es más joven, así que… es grosero llamarla tía. Es una dama."
wakaishufu (talking),もう、おとなをからかってー。,"Oh, you've got to be kidding me.",Ya me estoy burlando de los adultos.
Ishihara Senju (talking),そんな事ないよ…,That's not true…,Eso no es cierto…
wakaishufu (talking),……え？,…… What?,…… ¿Qué?
Ishihara Senju (talking),おねーさん、とっても魅力的だよ。 ボク、どきどきしてきた。,"You are very attractive, lady. I'm getting nervous.","Es usted muy atractiva, señora. Estoy empezando a ponerme nervioso."
wakaishufu (talking),まあ……,Well……,"Bueno, ……"
Ishihara Senju (talking),ホント、素人は騙されやすくって ラクだなー、オトすのも。,Amateurs are so gullible and easy to fool.,"Los aficionados son muy fáciles de engañar, y es muy fácil ganárselos."
Yamamoto Akuji (talking),口八丁手八丁ってのは、 この事かって塩梅だったな。,I was surprised to hear that they were talking about this.,"El “ocho hablando, ocho haciendo” era un poco así, ¿no?"
Ishihara Senju (talking),でも、本人が望んで躰を売る事 決めたんだ。,But he decided to sell his body because he wanted to.,Pero decidió vender su cuerpo porque quería hacerlo.
Yamamoto Akuji (talking),ああ、そーだ。,"Oh, yeah.","Oh, sí."
Ishihara Senju (talking),悪司、あの人の調教、 ボクにさせてよね。 その為に動いたんだからさ。,"Akuji, please let me train her. That's what I'm working for.","Akuji, déjame entrenarla. Para eso estoy trabajando."
Yamamoto Akuji (talking),ああ。,Oh.,Oh.
Ishihara Senju (talking),クスっ… しばらくは退屈しなくてすみそーだな… クスクスっ…,Kuskus… I guess I won't have to be bored for a while… Kuskus…,Kus… no te aburrirás por un tiempo… kus… kus… kus…
Yamamoto Akuji (thinking),おとろしー、ガキだ……,"Otoshi, it's a kid……","Otoshi, es un niño……"
Kohara Koharu (talking),あら、若旦那… ごきげんよう。,"Oh, Young Master... How are you?","Oh, Joven Maestro… ¿cómo estás?"
Yamamoto Akuji (talking),おう、小春さん。 どーした、こんなとこで。,"Hey, Koharu. What's up, here.","Oh, Koharu. Qué pasa, aquí."
Kohara Koharu (talking),"退屈だったので、 何かありませんかしら…と…
あら、ステキなホテル… 若旦那ご一緒しません？","I was bored, so I thought I'd see if there was anything…
Oh, what a lovely hotel… Would you like to join us, Young Master?","Estaba aburrido, así que pensé en ver si había algo…
Bueno, es un buen hotel… ¿por qué no viene conmigo, Joven Maestro?"
Yamamoto Akuji (talking),何言ってんだい。 あんた、ユリでタチだろ？,"What are you talking about? You're a lily-livered man, aren't you?","¿De qué estás hablando? Eres un trotamundos, ¿no?"
Kohara Koharu (talking),でも、殿方を調教する事は 出来ますわよ？,"But I can train you, can't I?","Pero puedo entrenarlo, mi señor."
Yamamoto Akuji (talking),いやいや。 その言葉で、愚息も昇天だ。,"No, no, no. With those words, the foolishness is ascending.","No, no. Con esas palabras, la locura es ascendente."
Kohara Koharu (talking),"ふふ…お上手ですこと。
あら…ちょっと失礼。","Hmmm…you're good at that.
Oh…excuse me.","Hmm… eres muy bueno.
Oh… perdón."
narrator,"小春はそう言うと、今すれ違ったばかりの 女子校生の後ろに音もなく近寄った。
そして、白い布を出すと、それで そっと、娘の口を覆う。
娘は躰を一度だけびくりとさせ、 小春の胸の中に崩れ落ちた。
眠っている。","Saying this, Koharu approached noiselessly behind the schoolgirl he had just passed.
Then, he took out a Haku cloth and gently covered the girl's mouth with it.
The girl's body jerked once, and she collapsed into Koharu's chest.
She is sleeping.","Diciendo esto, Koharu se acercó sin hacer ruido detrás de la colegiala con la que acababa de cruzarse.
Luego, sacó un paño Haku y cubrió suavemente la boca de la chica con él.
El cuerpo de la chica se sacudió una vez y se desplomó en el pecho de Koharu.
Dormir."
Kohara Koharu (talking),うふふ……,Ufufu: ……,Ufufu……
Yamamoto Akuji (talking),この匂い… クロロフォルムか。,This smell… Chloroform.,Este olor… Cloroformo.
Kohara Koharu (talking),"ええ。 だって…可愛らしい蝶だったん ですもの。
羽を傷つけないように捕獲するのは、 基本でしょう？","Yes, because… it was a pretty butterfly. Because… it was a lovely butterfly.
It's a basic rule to capture them so as not to damage their wings, right?","Sí, porque… Porque… era una mariposa encantadora.
Es una regla básica capturarlos para no dañar sus alas, ¿no?"
Yamamoto Akuji (talking),基本ねぇ……,Basic hey ……,Basic hey ……
Kohara Koharu (talking),それでは、ごきげんよう。 私、先に帰らせて頂きますわ。,"Well, good day to you. I'll go home first.","Bueno, buen día para ti. Me iré a casa primero."
Yamamoto Akuji (talking),おい、その娘……,"Hey, that girl ……","Hey, esa chica: ……"
Kohara Koharu (talking),お持ち帰り…… ふふ…ふふふ……,Takeaway:…… hmmm… hmmm… hmmm… ……,Para llevar:…… hmmm… hmmm… hmmm… ……
narrator,小春は嬉しそうに両腕で娘を抱え、 歩き去った。,Koharu happily took her daughter under both arms and walked away.,"Koharu se alejó felizmente, sujetando a su hija por ambos brazos."
Yamamoto Akuji (talking),後の処理をするこっちの事も考えろよ… これだけから、キレ系は……,"Think about the rest of us who have to deal with it afterwards… From this, the sharpest type is ……","Piensa en el resto de los que tenemos que lidiar con ello después… Sólo con esto, el tipo cabreado se puede encontrar en ……"
Yamamoto Akuji (thinking),みんな、ちゃんとやってるかな…,"I hope I'm doing it right, guys…","Chicos, espero estar haciéndolo bien…"
narrator,Ａの方に、女が表示されています。 （名前　S名前　ＳＰ　SＳＰ番号）,"A, and the woman is shown. (Name S Name SP SSP No.)","A, y se muestra una mujer. (Nombre S Nombre SP Número SSP)"
Tamanegi (talking),"これは、若。 見回りお疲れさまです。
今は、これを調教中です。 もう少し時間はかかりますが…
立派な娼婦にしあげますよ。 もう少しお待ちを。","This is Young Master. Thanks for looking around.
I am training this now. It will take a little more time, but…
I'll turn you into a fine whore. Please wait a little longer.","Esto es Joven Maestro. Buen trabajo en las rondas.
Estamos entrenando esto ahora. Llevará un poco más de tiempo, pero…
La convertiré en una buena puta. Por favor, espere un poco más."
Yamamoto Akuji (thinking),みんな、ちゃんとやってるかな…,"I hope I'm doing it right, guys…","Chicos, espero estar haciéndolo bien…"
narrator,Ａの方に、女が表示されています。 （名前　S名前　ＳＰ　SＳＰ番号）,"A, and the woman is shown. (Name S Name SP SSP No.)","A, y se muestra una mujer. (Nombre S Nombre SP Número SSP)"
Kohara Koharu (talking),"あら、若旦那。 見回りお疲れさまです。
今は…この子と楽しく過ごして いますわ。
だけど、もう少し…かしら。 もう少し、この子と楽しみたいの。 よろしいですかしら？
もう少ししたら、お店に出しても 恥ずかしくない子になるから…
待っていて下さいね、若旦那… ふふっ…ふふふ…","Oh, Young Master. Thank you for making the rounds.
I'm having a good time with her.
But maybe a little more. I'd like to have a little more fun with her. May I?
In a little while, she'll be ready for the store.
Please wait for me, young master…","Oh, Joven Maestro. Gracias por sus patrullas.
Estoy… pasando un buen rato con ella.
Pero quizás un poco más. Me gustaría divertirme un poco más con ella. ¿Puedo?
Dentro de poco, estará lista para la tienda.
Por favor, espere por mí, joven maestro…"
Yamamoto Akuji (thinking),みんな、ちゃんとやってるかな…,"I hope I'm doing it right, guys…","Chicos, espero estar haciéndolo bien…"
narrator,Ａの方に、女が表示されています。 （名前　S名前　ＳＰ　SＳＰ番号）,"A, and the woman is shown. (Name S Name SP SSP No.)","A, y se muestra una mujer. (Nombre S Nombre SP Número SSP)"
Ishihara Senju (talking),"やあ、悪司。 元気？
あ、この子？ お店に出すには、まだまだだよ。
もう少し待っててね。 クククッ… スゴイ子にしちゃうから…
あー楽しいなー。 ふふふふっ。","Hi, Akuji. How are you?
Oh, this girl? It's not ready for the store yet.
Wait a little longer. I'll make her awesome…
This is fun. Hmmm…","Hola, Akuji. ¿Cómo estás?
Oh, ¿esta chica? Todavía no está listo para la tienda.
Espera un poco más. La haré impresionante…
Oh, esto es divertido. Hmm, hmm, hmm."
Yamamoto Akuji (thinking),んー…？ 誰もいないのかな……,Hmm…? Is there anyone here: ……,¿Hmm…? ¿Hay alguien aquí? ……
narrator,そう思いながら、奥を見ると、 そこから小さな影が出てきた。,"With this in mind, I looked toward the back and saw a small shadow emerge from there.","Con eso en mente, miré a la parte de atrás y vi una pequeña sombra emerger de allí."
Yamamoto Akuji (talking),え……,Eh ……,Eh ……
Takega Satsu (talking),ああ、悪司。 見回りか？,"Ah, Akuji. Making the rounds?","Ah, Akuji. ¿Haciendo las rondas?"
Yamamoto Akuji (talking),"どーして、さっちゃんが……
ま、まさか、タマネギか！？ それとも、小春さんか？ いや、千手か！？","Why, Sacchan is ……
No way, is it Tamanegi! Or is it Koharu? No, Senju!","Por qué es Sacchan ……
 ¿Es Tamanegi? ¿O es Koharu? ¡No, es Senju!"
Takega Satsu (talking),何を慌てている。 私は、見学していただけだ。,What's the rush? I was just observing.,¿Cuál es la prisa? Sólo estaba observando.
Yamamoto Akuji (talking),見学……,Visit ……,Visite ……
Takega Satsu (talking),ああ。,Oh.,Oh.
Yamamoto Akuji (talking),そうか…,Well…,Bueno…
__system__??,{★愛 = 5:,,
Takega Satsu (talking),まったく…妻を子供扱いするとは。,Totally….you treat my wife like a child.,Totalmente… tratar a mi esposa como una niña.
__system__??,},,
__system__??,{★愛 \ 5:,,
Takega Satsu (talking),まったく…叔母を子供扱いするとは。,Totally…you treat your aunt like a child.,No sé… en absoluto… ¿cómo pudiste tratar a mi tía como una niña?
__system__??,},,
Yamamoto Akuji (talking),お前さんなー……,"You, you, you… ……",Ya sabes quién: ……
narrator,悪司が調教の館に現れた。,Akuji showed up at the training hall.,Akuji apareció en la sala de entrenamiento.
Tamanegi (talking),若、お待ちしておりました。 ご指示を御願いいたします。,"Young Master, we have been waiting for you. Please give us your instructions.","Joven Maestro, te hemos estado esperando. Por favor, denos sus instrucciones."
Tamanegi (talking),明日は、若が来られる日ですね… 最後の仕上げといきますか。,Tomorrow is  when Young Master will come… Shall we finish up?,Mañana es el día en que los Joven Maestro pueden venir… ¿terminamos?
__system__??,{RND = 1:,,
Tamanegi (talking),それでは、行くとしますか…,"Well, let's get going…",Vamos entonces…
__system__??,},,
__system__??,{RND = 2:,,
Tamanegi (talking),これでうまくいけば…,If this works…,Si esto funciona…
__system__??,},,
__system__??,{RND = 3:,,
Ishihara Senju (talking),くすっ…どうしよっかなー。 楽しみー。,Darn…what should I do? I'm looking forward to it.,Maldita sea… ¿qué debo hacer? Estoy deseando que llegue.
__system__??,},,
__system__??,{RND = 4:,,
Ishihara Senju (talking),色々試してみたいけど、仕上げだから、 気も抜けないや。,"I'd like to try out a lot of things, but I can't be too careful because it's the finishing touches.","Me gustaría probar cosas diferentes, pero son los toques finales, así que no puedo ser demasiado exigente."
__system__??,},,
__system__??,{RND = 5:,,
Kohara Koharu (talking),くすっ…くすくすくすっ……,Dusk…dusk…dusk…dusk…dusk…dusk…dusk… ……,Smooch…smooch…smooch…smooch… ……
__system__??,},,
__system__??,{RND = 6:,,
Kohara Koharu (talking),壊れてしまったら、ごめんなさいね… その時は、その子に素質がなかったって 事だから……,I'm sorry if it breaks… then it means she didn't have the right qualities……,Lo siento si se rompe… entonces significa que no tenía las cualidades adecuadas……
__system__??,},,
__system__??,{S調教レベル = 1:,,
 (talking),よくがんばりましたね。 あなたは、本日より娼婦として 店に立つ事が出来ますよ。,"Good job, Tane. You can stand in the store as a prostitute from today.","Lo has hecho bien, Tane. A partir de hoy puedes ponerte en la tienda como prostituta."
__system__??,},,
__system__??,{S調教レベル = 2:,,
 (talking),"どうです、生まれ変わった自分は？
あなたは、本日より上級娼婦として お客様に最高のご奉仕が出来る実力を 身につけました。","How do you feel about your new life?
As of today, you have acquired the ability to serve our guests to the best of your ability as a superior prostitute.","¿Cómo te sientes con tu nueva vida?
A partir de hoy, has adquirido la capacidad de servir a nuestros huéspedes lo mejor posible como prostituta mayor."
__system__??,},,
__system__??,{S調教レベル = 3:,,
 (talking),"素晴らしい。 もう教える事は何もありません。
あらゆる嗜好のお客様に その肉体は答える事が出来るでしょう。","Excellent. There is nothing more to teach.
The body will be able to answer to all tastes.","Excelente. No hay nada más que enseñar.
El cuerpo podrá responder a todos los gustos."
__system__??,},,
 (talking),…………………,…………………,…………………
 (talking),を 解放するのですね。,You are going to release the,Usted libera el
__system__??,{S売り回数 > 100:,,
 (talking),そうですね、もう充分働いて もらったのでいいでしょう。,"Yes, you have already worked hard enough.","Sí, ya has trabajado bastante."
__system__??,},,
__system__??,{S売り回数 = 0:,,
 (talking),全然、稼いでおりませんが…… いたしかたありません。,"We are not making any money at all, but…… we have to.",No hemos ganado nada de dinero…… Tuvimos que hacerlo.
__system__??,},,
narrator,は、 その日のうちに調教の館から解放された。,was released from the training hall that day.,fue liberado de la sala de entrenamiento más tarde ese mismo día.
 (talking),"を 売却されるのですね。
ヘンリー殿が、本国のご友人に沢山注文を 受けているそうなので、いくらでも 買い取ると仰っています。
一人、５００万円です。 売られますか？","I understand that Mr. Henry has received many orders from his friends in his home country.
Mr. Henry has received many orders from his friends in his home country, and he is willing to buy them at any price.
5,000,000 yen each. Will you sell them?","Estás vendiendo el Henry.
El Sr. Henry dice que ha recibido muchos pedidos de amigos de su país, por lo que está dispuesto a comprarlos a cualquier precio.
5 millones de yenes cada uno. ¿Los venderás?"
__system__??,{☆立候補 = 2:,,
__system__??,},,
__system__??,{☆立候補 = 1:,,
__system__??,},,
Tamanegi (talking),お邪魔します…,Sorry to bother you…,Siento molestarle…
Yamamoto Akuji (talking),おう、どうした、タマネギ？,"Oh, what's up, Tamanegi?","¿Qué pasa, Tamanegi?"
Tamanegi (talking),皆様、頑張ってらっしゃるところにお邪魔 いたしましたのは、わたくしもご協力 させて頂ければと思いまして…,I am so glad that I could join you in your endeavors…,"Lamento haberlos molestado, pero pensé que me gustaría ayudar…"
Yamamoto Akuji (talking),協力？ 一体、何が出来るってんだ？,Cooperation? What the hell can we do?,¿Cooperación? ¿Qué demonios podemos hacer?
Tamanegi (talking),売春宿にてキャンペーンを企画して おります。,We are planning a campaign at a brothel.,La campaña se organiza en burdeles.
__system__??,{☆立候補 = 1:,,
Tamanegi (talking),夕子様,Dear Yuuko.,Querida Yuuko.
__system__??,},,
__system__??,{☆立候補 = 2:,,
Tamanegi (talking),殺様,Dear Satsu.,Querido Satsu.
__system__??,},,
Tamanegi (talking),のブロマイドをお客様に 配ろうと思いまして。,I was thinking of handing out bromides of,Pensé en repartir bromuros de lo siguiente a mis clientes.
Yamamoto Akuji (talking),そんなので票になるのか？,Is that going to get you votes?,¿Cuenta eso para los votos?
Tamanegi (talking),なりますよ… お客様は、可愛い女の子が好きですから。,It will be… Customers like pretty girls.,Será… a los clientes les gustan las chicas guapas.
Yamamoto Akuji (talking),ふーん……まあ任せる。,Hmmm…… well leave it to me.,Hmmm…… bueno déjalo en mis manos.
Tamanegi (talking),ありがとうございます。 ではさっそく……,Thank you very much. Now let's get started: ……,Gracias. Ahora sigamos con ello: ……
narrator,悪司は新聞を読んでいる。,Akuji is reading the newspaper.,Akuji lee el periódico.
Yamamoto Akuji (talking),うーん……女子プロ野球かー…,Hmmm…… women's professional baseball…,Hmmm…… Béisbol profesional femenino…
Seinendan Jyoshi (talking),悪司さーん、お客様です。 お通ししていいですか？,"Akuji, you have a visitor. May I let you through?","Akuji, tienes una visita. ¿Puedo dejarte pasar?"
Yamamoto Akuji (talking),誰だ？,Who is it?,¿Quién es usted?
Seinendan Jyoshi (talking),女性です。 会えばわかると仰ってますー。,She is a woman. She says you will understand when you meet her.,Mujer. Dice que lo entenderá cuando te conozca.
Yamamoto Akuji (talking),んー……保険の勧誘じゃなかったら 入ってもらってくれ。,"Hmmm……… If it's not an insurance solicitation, get them to join.","Hmmm……… Si no es una solicitud de seguro, haz que se afilien."
Seinendan Jyoshi (talking),はーい。,Hai.,Hai.
Kohara Koharu (talking),こんにちわ、若旦那。,"Hello, Young Master.","Hola, Joven Maestro."
Yamamoto Akuji (talking),あんたは、小春さん！？ 確か、タマネギと一緒にきた、調教師の…,Are you Koharu? I think you're the trainer who came with Tamanegi…,¿Eres Koharu? Creo que eres el entrenador que vino con Tamanegi…
Kohara Koharu (talking),調教師は、私のもうひとつの顔。 今は、ビジネスクリエイターですわ。,A trainer is my other face. Now I'm a business creator.,El entrenador es mi otra cara. Ahora soy un creador de negocios.
Yamamoto Akuji (talking),はぁぁぁ？？？,Huh?,¿Eh?
Kohara Koharu (talking),"若旦那にフラれてしまい、失業してから、 私、Ｗアメリカに遊学いたしましたの。
田舎に帰って蜜柑でも作って余生を 過ごそうかと思ったんですけどね……
でもまあその前に、世界旅行でもして みようと思いまして…そしてＷアメリカで 素敵な勉学と遭遇いたしましたの。
向こうの大学で、ＭＢＡ……
Ｍａｓｔｅｒ　ｏｆ　Ｂｕｓｉｎｅｓｓ Ａｄｍｉｎｉｓｔｒａｔｉｏｎの資格を 取ってまいりましたの。","After my young husband dumped me and I lost my job, I went to the U.S. to study.
I thought I would go back to the country and spend the rest of my life making citrus fruits……
But before that, I decided to travel around the world…and I encountered Suteki study in the U.S.A. I went to a university there and got an MBA .
MBA at a university over there ……
Master of　Business Master of Business Administration I have obtained my MBA degree from a university over there.","Después de que mi joven marido me dejara y yo perdiera mi trabajo, me fui a Estados Unidos a estudiar.
Pensé en volver al campo y pasar el resto de mi vida haciendo cítricos……
Pero antes de eso, decidí viajar por el mundo… y en América me encontré con el estudio de Suteki.
MBA en una universidad más allá de ……
Maestro de　Negocios Máster en Administración de Empresas. He obtenido mi título."
Yamamoto Akuji (talking),……それってそう簡単に 取れるものだったっけ？,…… Was that so easy to take?,…… ¿Era tan fácil de tomar?
Kohara Koharu (talking),それはもう、勉学しているのが私ですから 飛び級も何も思いのままで。,"It's already me who is studying, so I can skip a grade or whatever I want.","Ya soy yo quien estudia, así que puedo saltarme las clases o lo que quiera."
Yamamoto Akuji (thinking),……ちゃんと勉強して取ったのか、 それとも教授を調教して、 資格を奪い取ったのか……,Did you study hard or did you train your professor to take your credentials away from you? ……,…… ¿Has estudiado mucho o has entrenado a tu profesor para que te quite el título? ……
Kohara Koharu (talking),ちゃんと、勉強してまいりましたわよ。 教授達を調教して奪った資格では ありませんわ、若旦那。,"I've studied hard. I didn't train those professors to take away your credentials, Young Master.","Lo he estudiado bien. No he formado a los profesores para que te quiten estas calificaciones, Joven Maestro."
Yamamoto Akuji (talking),顔に出てたか。,Was it on your face?,¿Estaba en tu cara?
Kohara Koharu (talking),"はい、くっきりと。
それでですね。
娼館という非常に美味しい仕事に見向きも しない若旦那の為に、新しいビジネスを 提案に参りました。","Yes, clearly.
And so, you see.
I am here to propose a new business for Young Master who is not interested in the very tasty business of brothels.","Sí, claramente.
Así que, ya ves.
Estoy aquí para proponer un nuevo negocio para el Joven Maestro, que no está interesado en el muy sabroso negocio de los burdeles."
Yamamoto Akuji (talking),別の風俗か？ だったらいらねーよ。,Another sex industry? I don't want to be a part of it.,¿Otra industria del sexo? No quiero serlo.
Kohara Koharu (talking),違いますわ。 ハンバーガーショップです。,"No, sir. It's a hamburger store.","No, no lo es. Es una hamburguesería."
