character,jap text,Eng,Esp
Tamanegi (talking),はい、申し訳ございません…,"Yes, sorry…","Sí, lo siento…"
narrator,悪司はそこを後にした。,Akuji left there.,Akuji se fue de allí.
__system__??,},,
__system__??,{Sキャラ > 500:,,
__system__??,},,
Ishihara Senju (talking),"なになにー？ 悪司、ボク達が調教するの、 見てみたいのー？
じゃあ、じっくり楽しんでもらおっかな。 フフフ……","What is it? Akuji, you want to watch us train you?
Well then, let's let them enjoy it……","¿Qué es? Akuji, ¿quieres ver cómo te entrenamos?
Bueno, entonces, vamos a pasar un buen rato……"
narrator,タマネギ達が悪司が見ている前で,Tamanegi and his friends are watching in front of Akuji.,Tamanegi y otros frente a Akuji mirando.
narrator,を調教した。,trained.,capacitado.
narrator,　☆☆　,　☆☆　,　☆☆　
narrator,　☆☆ 　　タマネギ達の調教を受けた。,　☆☆ 　　Tamanegi and others trained.,　☆☆ 　　Tamanegi y otros entrenados.
Tamanegi (talking),これは、若……,This is Young Master...,Este es un Joven Maestro ……
Yamamoto Akuji (talking),悪いな、タマネギ。 俺、ここを潰すから。,"Sorry, Tamanegi. I'm going to crush this place.","Lo siento, Tamanegi. Voy a cerrar este lugar."
Tamanegi (talking),なんと……,What a ……,Qué ……
Yamamoto Akuji (talking),"俺の嫁さんがよ、こーいうのん ダメなんだわ。
だから、俺、足洗う事にしたんでな… すまねぇけど、次の職場、探してくれや。","My wife is not good at this kind of thing.
So I've decided to get out of the business… I'm sorry, but you'll have to find me another job.","Mi esposa, no es buena en este tipo de cosas.
Así que he decidido dejar el negocio… Lo siento, pero tendrás que encontrarme otro trabajo."
Tamanegi (talking),では、売春婦達は……,"Now, the prostitutes can go to ……",Entonces las prostitutas se pueden encontrar en ……
Yamamoto Akuji (talking),全員、解放。自由にしてやる。,All of you are free. You are free to go.,"Todos ustedes, liberados. Voy a liberarte."
Tamanegi (talking),……………は……あ……,…………… is…… is ……,…………… es…… a ……
narrator,"悪司は部下に命じて、その日のうちに 調教の館、売春宿を閉鎖した。
そして娼婦として使われていた女の子達は、 みんな解放された。","Akuji ordered his men to close the training house and brothel that day.
And all the girls who had been used as prostitutes were released.","Akuji ordenó a sus hombres que cerraran la casa de entrenamiento y el burdel ese día.
Y todas las chicas que habían sido utilizadas como prostitutas fueron liberadas."
narrator,からっぽになった調教の館に、 悪司が一人立っている。,"In the empty training hall, Akuji stands alone.","En una sala de entrenamiento vacía, Akuji está sola."
Yamamoto Akuji (talking),いい収益源だったけど、 民華さんの方が大事だからなー… しかたねぇよな、うん……,"It was a good source of revenue, but Minka is more important… but Tane is right, yeah ……","Era una buena fuente de ingresos, pero Minka es más importante… Pero Tane tiene razón, sí ……"
Yamamoto Akuji (talking),あなたは完璧な穴奴隷ですから、 調教の必要はもうありませんね…,"You are a perfect hole slave, so you no longer need to be trained…","Eres un perfecto esclavo del agujero, así que ya no necesitas ser entrenado…"
Tamanegi (talking),失礼します、若。,"Excuse me, Young Master.","Disculpe, Joven Maestro."
Yamamoto Akuji (talking),おう、どうした？,"Oh, what's up?",¿Qué pasa?
Tamanegi (talking),催促して申し訳ないのですが―― わたくし共が活かされる為の調教の館は いつ頃お作りになられるご予定で？,"I'm sorry to keep urging you to do this, but when do you plan to build a training hall for us to live in?","Siento seguir insistiendo en ello, pero ¿cuándo piensan construir la casa de formación para que vivamos en ella?"
Yamamoto Akuji (talking),んー、まあ、そのうちだ。,"Hmmm, well, we'll see.","Hmm, bueno, ya veremos."
Tamanegi (talking),"出来れば、お早く願えませんか？ 建物を建てる為に費用は必要ですが、 それ以上の見返りが若にございます。
その事、ゆめゆめ お忘れにならないよう…","If possible, could you please do so as soon as possible? It costs a lot of money to build a building, but there is more to it than just the cost.
Please do not ever forget that…","¿Puede hacerlo rápidamente, si es posible? Cuesta mucho construir un edificio, pero se obtiene mucho más a cambio.
No olvidemos nunca que…"
Yamamoto Akuji (talking),おーう。,Oooh.,Oooh.
narrator,小春は自分の育てた店の前に立っている。,Koharu is standing in front of the store he grew up in.,Koharu se encuentra frente a la tienda en la que creció.
Kohara Koharu (talking),目標売り上げもずっと継続した ままでいる… ここはもう安泰ですわね…,We've been on target for sales for a long time… we're in safe hands here…,Los objetivos de ventas se han mantenido… estamos en buenas manos…
narrator,小春は満足そうだった。,Koharu seemed satisfied.,Koharu parecía satisfecho.
