character,jap text,Eng,Esp
Yamamoto Akuji (talking),ハンバーガー…… まるっこいパンに、ハンバーグ はさんだ、アレか。,Hamburger…… is a hamburger on a round bun.,Hamburger…… Una hamburguesa en un pan redondo.
Kohara Koharu (talking),"はい、そうです。 それですわ。
ウィミィに統治されている為、抵抗感は あっても、向こうの文化がニホンに 浸透するのは時間の問題です。
その時、誰もが手軽に食べる事の 出来るファーストフード。
その先駆けとなるのが、ハンバーガーだと 確信いたしましたの。
これは絶対、イケますわよ、若旦那。
ただ、ムサ苦しい者を接客窓口に 置くのはいやですの、私。
可愛い女の子が、マニュアル通りでも にっこり笑って接客してくれれば……
どんなに鬱でも、シャッキリ躁に なれると思いますわ。
そこで、第一ターゲットは……
ハンバーガーの味を知っていて、 お金に困っていない、 寂しいウィミィ男性兵士です。
という訳で、若旦那、私は細かい経営の 計画を立てますので１号店の建設が決まり ましたら知らせて下さいな。
それでは、ごきげんよう。","Yes, that's it. That's it.
Although there is a sense of resistance because of the rule of Wime, it is only a matter of time before the culture of the other side will penetrate into Japan.
Fast food that anyone can eat easily will be the pioneer.
I am convinced that hamburgers will be the pioneer in this field.
This is definitely a good idea, Young Master.
I just don't want to put someone who is not a good person at the customer service counter.
If only a pretty girl would serve you with a smile on her face, even if it's just a manual ……
I think even the most depressed person would feel refreshed and manic.
So our first target is ……
I am a lonely Wime male soldier who knows what a hamburger tastes like and is not strapped for cash.
So, Young Master, I will make a detailed management plan, so please let me know when you decide to build the first restaurant.
Have a good day.","Sí, eso es. Eso es todo.
Aunque hay una sensación de resistencia porque el país está gobernado por el Wime, es sólo cuestión de tiempo que la cultura del otro bando penetre en Japón.
En ese momento, la comida rápida estará al alcance de todos.
Estoy convencido de que las hamburguesas serán las pioneras.
Esta es definitivamente una buena idea, Joven Maestro.
No me gusta la idea de tener una persona miserable en el servicio de atención al cliente.
Si una chica guapa puede atenderte con una sonrisa en la cara, aunque sea de manual, entonces ……
No importa lo deprimido que esté, creo que puedo llegar a ser maníaco.
Así que nuestro primer objetivo es ……
Un soldado masculino solitario que sabe a qué sabe una hamburguesa y que no está falto de dinero.
Así que, Joven Maestro, voy a hacer un plan de gestión detallado, así que por favor hágamelo saber cuando decida construir el primer restaurante.
Que tengas un buen día."
narrator,小春はいそいそと事務所を後にした。,Koharu left the office hurriedly.,Koharu salió de la oficina apresuradamente.
Yamamoto Akuji (talking),"………………
 ……て……おい……
俺は、ハンバーガーショップを開店すると 返事してねーぞー、コラー！
 ………………
つっても…実際、実入りのいい ショーバイなくて、困ってたのは 確かだしなー……
ま、騙されたと思って、やってみっか。 駄目だったら…
 ………ま、なんとかなるか……","…………………… and…… hey ……
I ain't responding when you open up a burger joint, cawler!
 ………………
I'm pretty sure I was actually in trouble because I didn't have a profitable show-buy……
I'll give it a try and see if I get suckered. If it doesn't work………… Well, we'll see what we can do……","…………………… y…… hey ……
 ¡No voy a responder cuando abras una hamburguesería, cawl!
 ………………
Estoy bastante seguro de que estaba en problemas porque no tenía un programa de compra rentable……
Lo probaré a ver si me engaño. Si no funciona………… Bueno, haremos que funcione……"
Kohara Koharu (talking),"ふ……
ふふっ…ふふふふっ… これから稼ぎますわよ。 ええ、それはもう。
よい事？ 笑顔と愛敬。 それで客の心をガッチリ掴むのですよ。
笑顔で、接客。 薄利多売、勝てば官軍。 よろしいですかしら？","Fu……
Hmmm… hmmm… I'm going to earn my money now. Yeah, that's it.
Good thing? Smiles and affection. That's how you win the hearts of your customers.
Smile and serve. If you win, you win. Am I right?","Huh ……
Hmmm… hmmm… Voy a ganar mi dinero ahora. Sí, eso es.
 ¿Es bueno? Sonrisas y afecto. Así es como se gana el corazón de sus clientes.
Sonríe y sirve. Bajos márgenes, alta calidad, todos ganan. ¿Es eso cierto?"
GAL Burger (talking),はーい、店長。,"Yes, manager.","Sí, gerente."
Kohara Koharu (talking),"よろしいですわ、いいお返事。
それでは、始めますわよ。 既に、お客様が並んでいらっしゃい ますわ。","Very well, good answer.
Now, let's Hajime. There are already customers lined up.","Muy bien, buena respuesta.
Pues bien, Hajime. Ya hay clientes en fila."
GAL Burger (talking),はーい☆,Yes☆,Sí☆
uimiiheishi (talking),腐れジャップの猿マネの ハンバーガーショップか。 まさかミミズ肉とかじゃねーだろーなー。,A hamburger store that imitates the rotten Jap monkey. I hope it's not worm meat or something.,Una hamburguesería de imitación de mono japonés podrido. Espero que no sea carne de gusano o algo así.
GAL Burger (talking),いらっしゃませー☆ ＧＡＬバーガーへ、よーこそー☆,Welcome to GAL Burger!☆,¡Bienvenido a GAL Burger!☆
uimiiheishi (talking),え……,Eh ……,Eh ……
GAL Burger (talking),ご注文をどうぞー☆,Please place your order.☆,Haz tu pedido.☆
uimiiheishi (talking),ハ……ハンバーガー……,Ha…… hamburger……,Ha…… hamburguesa……
GAL Burger (talking),はい、ありがとうございます。 サイドメニューなどはよろしい ですかー？,"Yes, thank you. Would you like a side menu, etc.?","Sí, gracias. ¿Quiere pedir un menú de acompañamiento?"
uimiiheishi (talking),あ、あの……ポテトのＬ……,"Oh, that…… potato l……","Oh, que…… patata l……"
GAL Burger (talking),はい、ありがとうございまーす。 Ｌポテト入りまーす。 他にはございませんかー？,"Yes, thank you very much. I'll have a large potato. Is there anything else?","Sí, muchas gracias. Tomaré una patata grande. ¿Hay algo más?"
uimiiheishi (talking),あの……ナゲットの９個入りと…… へ…へへへ。,That…… 9-pack of nuggets and…… hehe…hehe.,Que…… paquete de 9 nuggets y…… jeje… jeje.
narrator,ＧＡＬバーガーはそれなりに繁盛しそうだ。,GAL Burger is going to thrive in its own way.,GAL Burger es probable que prospere por derecho propio.
 (talking),若旦那。,Young Master.,Joven Maestro.
Yamamoto Akuji (talking),おう、小春さん。 どうした？,"Oh, Koharu. What's up?","Oh, Koharu. ¿Qué pasa?"
Kohara Koharu (talking),"ＧＡＬバーガーの事ですけど… もっと可愛い女の子を店員として こちらに頂けませんですかしら？
出所はどこでもよろしいですの。 若旦那の捕虜や、部下でも… 売り上げが上がると思われますの。","I'm talking about GAL Burger… can we get a prettier girl to work here as a waitress?
Anywhere is fine with me. Even if they are the Young Master's prisoners or his subordinates, it would increase our sales.","En cuanto a GAL Burger… ¿podríamos conseguir una chica más guapa para trabajar aquí como camarera?
No nos importa de dónde vengan. Incluso los prisioneros de guerra del Joven Maestro o sus subordinados aumentarían nuestras ventas."
Yamamoto Akuji (talking),わかった。 また選んでおくよ。,"Okay, I'll choose again. I'll choose again.","Vale, voy a ir a por ello. Volveré a elegir."
Kohara Koharu (talking),お願いしますね。,Please do.,Por favor.
Yamamoto Akuji (talking),おう。,Oh.,Oh.
Yamamoto Akuji (talking),ＧＡＬバーガーに店員が欲しいと 言っていただろ。 こいつでどうだ？,You said you wanted a clerk for GAL Burger. How about this guy?,Dijiste que querías un tendero para GAL Burger. ¿Qué te parece este tipo?
Kohara Koharu (talking),"まあ、嬉しい。 この子目当てのお客様が増えると 思いますわ。
ありがとうございます、若旦那。
さあ、いらっしゃい。 これからこのマニュアルに従って、 接客をして頂きますわよ。","Well, I'm glad. I'm sure you'll get more customers for her.
Thank you, Young Master.
Come, come. From now on, you will serve our customers according to this manual.","Bueno, estoy feliz. Estoy seguro de que conseguirás más clientes para ella.
Gracias, Joven Maestro.
Ven, ven. A partir de ahora, servirás a nuestros huéspedes de acuerdo con este manual."
narrator,"は 小春に連れていかれた。
ＧＡＬバーガーの売り上げが 少し上がりそうだ。","was taken to Koharu.
GAL Burger's sales are about to go up a bit.","fue llevado a Koharu.
Las ventas de GAL Burger van a subir un poco."
Kohara Koharu (talking),ふう……,Fu ……,Fu ……
Yamamoto Akuji (talking),"どーしたんだい、あんたが憂鬱な顔して、 ため息つくなんて。
ＧＡＬバーガーだって、 調子よさそーじゃねーか。","What's the matter with you, sighing with a gloomy look on your face?
Even GAL Burger seems to be in a good mood.","¿Qué te pasa, que suspiras con una mirada sombría?
Incluso GAL Burger parece estar de buen humor."
Kohara Koharu (talking),これ、見て下さいな。,"Here, take a look at this.","Toma, echa un vistazo a esto."
narrator,小春はチラシを一枚、悪司に手渡した。,Koharu handed one flyer to Akuji.,Koharu entregó un folleto a Akuji.
Yamamoto Akuji (talking),なんだこりゃ…… ピーチバーガー？？？,What the heck is this…… Peach Burger?,¿Qué es esto:…… Peach Burger?
Kohara Koharu (talking),"こちらのノウハウを研究し、あきらかに コピーしたＰＭのハンバーガーショップ ですわ。
その上、こちらより低価格で、 ニホン人向け。
Ｗアメリカの企業と提携し、 着々と店舗を増やしておりますの。
うちの客も、そちらに取られていまして…","It is a PM hamburger store that has studied and obviously copied our know-how.
Moreover, the price is lower than ours, and it is geared toward Japanese people.
They have partnered with an American company and are steadily increasing the number of stores.
They have taken all our customers…","Es una hamburguesería de la PM que ha estudiado y, obviamente, ha copiado nuestro saber hacer.
Además, los precios son más bajos que aquí, y están dirigidos a los japoneses.
Tenemos un acuerdo con una empresa americana y estamos aumentando el número de tiendas.
También nos quitan los clientes…"
Yamamoto Akuji (talking),そりゃ、一大事じゃねーか。,"That's a big deal, isn't it?","Es una gran cosa, ¿no?"
Kohara Koharu (talking),そうですわね。,"Yes, it is.",Sí.
Yamamoto Akuji (talking),なんとかしろよ。,Do something about it.,Haz algo al respecto.
Kohara Koharu (talking),もちろんですわ。,Of course.,Por supuesto.
narrator,"しかし……
小春の頑張りも限界があり、 ＧＡＬバーガーの売り上げは激減した。","However, ……
Koharu's efforts had their limits, and GAL Burger sales plummeted.","Sin embargo, ……
Los esfuerzos de Koharu tuvieron su límite y las ventas de GAL Burger cayeron en picado."
Kohara Koharu (talking),ごきげんよう、若旦那。,"Good day, Young Master.","Buenos días, Joven Maestro."
Yamamoto Akuji (talking),"おう。
どしたい。 今日はえらく顔に凄味があるぜ。","Oh.
What's going on? Your face is looking very handsome today.","Oh.
 ¿Cómo va todo? Hoy tienes una mirada de infierno en tu cara."
Kohara Koharu (talking),ええ。 私、復讐に燃えておりますの。,Yes. I am bent on revenge.,"Sí, así es. Estoy en una misión de venganza."
Yamamoto Akuji (talking),復讐？,Revenge?,¿Venganza?
Kohara Koharu (talking),"ＧＡＬバーガーですが、キャンペーンを 実施して、離れていった客足を戻して みせますわ。
ライバルでした、ピーチバーガーも スポンサーという後ろ盾をなくしました ので……潰すなら…今…かなと。","GAL Burger is going to start a campaign to bring back the customers who have left.
Our rival, Peach Burger, has also lost its sponsor, Tate, so I think it's time to destroy……… now.","GAL Burger, vamos a hacer una campaña para que vuelvan los clientes que se han ido.
Nuestro rival, Peach Burger, ha perdido a su patrocinador, Tate, así que creo que es el momento de destruir……… ahora."
Yamamoto Akuji (talking),こえ~。,Koei~.,Koei~.
Kohara Koharu (talking),"ふふ……向こうのおかげで、 色々と苦労させられましたもの……
しかも、喧嘩を売ってきたのも、向こう… それなりの代償は覚悟して 頂かないと……そう思いますでしょう？","I have had to do a lot of hard work thanks to the other side……
And they were the ones who started the fight… You have to be prepared to pay a certain price for that…… don't you think?","He tenido que trabajar mucho gracias al otro lado……
Y fueron ellos los que empezaron la pelea… Hay que estar preparado para pagar un cierto precio por ello…… ¿no crees?"
Yamamoto Akuji (talking),で、どーいう手で、トドメをさすんだ？,"So, what kind of hand are you going to use to finish him off?","Entonces, ¿qué tipo de mano vas a usar para acabar con ellos?"
Kohara Koharu (talking),こちらは、ハンバーガーを期間限定で ひとつ１００円で販売します。,"For a limited time only, this shop will sell one hamburger for 100 yen.","Sólo por tiempo limitado, cada hamburguesa se venderá por 100 yenes."
Yamamoto Akuji (talking),大丈夫か、そんな事して。,"Are you okay, doing that?","¿Estás bien, haciendo eso?"
Kohara Koharu (talking),策なしで、このような無謀な事を 申しませんわ。 ふふ……ふふふ……,I would not offer such recklessness without a plan. I will not say this without a plan…… ……,No te ofrecería tal imprudencia sin un plan. Hmmm……… Hmmm… ……
Yamamoto Akuji (talking),まー、見せてもらうとするか。,"Well, let's see.","Bueno, echemos un vistazo."
Kohara Koharu (talking),ええ……楽しみにしていらして下さいな。,"Yes, please come and enjoy …….","Sí. Por favor, venga y disfrute de ……."
narrator,小春のその言葉通り、ＧＡＬバーガーの キャンペーンは成功し、売り上げが 急拡大した。,"True to Koharu's word, the GAL Burger campaign was a success, and sales soared.","Fiel a la palabra de Koharu, la campaña GAL Burger fue un éxito y las ventas se dispararon."
__system__??,{D01 < 300:,,
Kohara Koharu (talking),"まだ無駄が多いですわね。 コストダウンの為には、もっと合理的に 的確に作業工程をつめませんと…
目標は、ＧＡＬバーガーチェーンで、 月間３０００万円ですわ。
いきますわよ。","There is still a lot of waste. In order to reduce costs, we need to be more rational and precise in our work processes…
Our goal is 30 million yen per month for the GAL Burger chain.
Let's go for it.","Todavía hay muchos residuos. Para reducir los costes, tenemos que ser más racionales y precisos en nuestros procesos de trabajo…
Nuestro objetivo es de 30 millones de yenes al mes para la cadena GAL Burger.
Vamos a por ello."
GAL Burger (talking),はい、小春さん。,"Yes, Koharu.","Sí, Koharu."
__system__??,} else {,,
GAL Burger (talking),おはようございます。 小春さん。,Good morning. Koharu.,Buenos días. Koharu.
Kohara Koharu (talking),おはよう。 売り上げは順調ですことね。,"Good morning. Sales are going well, I hope.",Buenos días. Las ventas deben ir bien.
GAL Burger (talking),はい、どこのお店もすっごく人気です。 ウハウハって感じです~☆,"Yes, all the stores are very popular. It's like we're having a good time!☆","Sí, todas las tiendas son muy populares. Es como si nos estuviéramos divirtiendo.☆"
Kohara Koharu (talking),それはよろしいですこと。 この調子ですわよ。,That's good. Keep it up.,"Eso es bueno, eso es bueno. Sigue así."
GAL Burger (talking),はーい☆,Yes☆,Sí☆
narrator,ＧＡＬバーガーチェーンは、小春が 目標としていた月間３０００万以上の売り上げを あげて、成長を続けていた。,"The GAL Burger chain continued to grow with sales of more than 30 million per month, which was Koharu's goal.","La cadena GAL Burger siguió creciendo, con unas ventas de más de 30 millones al mes, que era el objetivo de Koharu."
__system__??,},,
Yamamoto Akuji (talking),おう。,Oh.,Oh.
Kohara Koharu (talking),あら…いらっしゃい、若旦那。 視察ですかしら？,"Well…come in, Young Master. Are you here for a visit?","Oh… pase, Joven Maestro. ¿Está aquí en una visita de inspección?"
Yamamoto Akuji (talking),まー、そんな感じ。,"Well, something like that.","Bueno, eso es todo."
Kohara Koharu (talking),お店は順調でしてよ。 若旦那、今出来たてのハンバーガー、 お食べになられますかしら？,"The store is doing well. Young Master, would you like to try a freshly made hamburger now?","La tienda va bien. Joven Maestro, ¿quieres una hamburguesa recién hecha ahora?"
Yamamoto Akuji (talking),"お、いただきます。
もぐ…もぐもぐ…
なんか、軽いくいもんだな。","Oh, Bon appétit.
Munch… munch…
It's kind of light food.","Oh, tomaré un poco.
Munch… munch…
Es un tipo de comida ligera."
Kohara Koharu (talking),ふふ…それがよろしいんですのよ。 大衆受けして。,Hmmm…that's the beauty of it. Popular.,Hmmm… así es como debería ser. Recepción popular.
Tamanegi (talking),ふう………,Fu ………,Fu ………
narrator,"タマネギは額にうっすらと 浮かんだ汗を拭った。
タマネギは、洗面所で調教道具の手入れを していた。
バイブ、ラバースーツ、アナル拡張棒、 ロープ、洗濯ばさみ。 そしてパラボナアンテナ。","Tamanegi wiped the sweat from her forehead.
Tamanegi was cleaning her training tools in the bathroom.
Vibrators, rubber suits, anal extension rods, ropes, clothespins. And a parabolic antenna.","Tamanegi se secó el sudor de la frente.
Tamanegi estaba limpiando su equipo de entrenamiento en el baño.
Vibradores, trajes de goma, barras de extensión anal, cuerdas, pinzas de ropa. Y una antena parabólica."
Tamanegi (thinking),"プロの調教師として、わたくし達の大事な パートナーですからね……
商品の躰を清潔に保つ為にも、 殺菌消毒していつも綺麗にして おかなくては……","As professional trainers, they are our important partners……
In order to keep the body of the product clean, it must be Satsu disinfected and kept clean: ……","Como formadores profesionales, son nuestros socios más importantes……
Para mantener el cuerpo del producto limpio, debe ser Satsu desinfectado y siempre limpio ……"
Kohara Koharu (talking),……くす…ふふ……,…… Kusu…hmmm ……,…… Kusu… hmmm ……
narrator,小春は一人、考え事をしては クスクス笑っている。,"Koharu is alone, thinking and giggling.","Koharu está solo, pensando y riéndose."
Seinendan Jyoshi (talking),どうしたんですか？ 何かいい事でもあったんですか？,What's wrong? Did something good happen?,¿Qué pasa? ¿Ha pasado algo bueno?
Kohara Koharu (talking),……………,……………,……………
Seinendan Jyoshi (talking),………あっ……あの？,……… was…… that?,"……… Oh,…… ¿eso?"
Kohara Koharu (talking),……知りたい…？,…… want to know…?,…… quiere saber…
Seinendan Jyoshi (talking),……いっ……いえ、やっぱいいです！ ごめんなさ~い！！,"……I'm ……No, I knew it! Sorry!","…… Soy…… ¡No, lo sabía! ¡¡¡Lo siento!!!"
narrator,団員は、恐怖のあまり半泣きになって 走り去った。,"The group members ran away, half-crying in terror.","El grupo salió corriendo, medio llorando de terror."
Kohara Koharu (talking),"あ……ん……
つまらないですこと… せっかく今、思いついた責めを 実践してさしあげようと思ったのに…","Oh, ……
I was just about to put into practice the blame I just came up with…","Oh, ……
Estaba a punto de poner en práctica la culpa que se me acaba de ocurrir…"
narrator,千手は、机の上に顎をついて、 手紙を読んでいる。,Senju is reading the letter with his chin on the desk.,Senju está leyendo la carta con la barbilla sobre el escritorio.
Ishihara Senju (talking),"千手君へ。 大好きです。今度、公園へ散歩に 行きませんか？　３組　みちこ
 ………ん~………","Senju to you. I love you. Would you like to go for a walk in the park next time?　Class 3 Michiko
 ………n~………","Senju Querido. Te quiero. ¿Te gustaría ir a dar un paseo por el parque la próxima vez?　Clase 3, Michiko
 ………n~………"
narrator,千手はその手紙をごみ箱に捨てた。,Senju threw the letter in the trash.,Senju tiró la carta a la papelera.
Ishihara Senju (talking),"気持ち悪いんだよ…… 勝手に人の机の中にこんなもの 入れてさ……
それに……小便臭いガキはパス。 熟れかけからがいいんだよねー……","It's disgusting…… that you put this stuff in people's desks without permission……
And…… I'll pass on the piss stinkin' kids. I like them when they're just starting to ripen……","Es asqueroso…… Ponen estas cosas en los escritorios de la gente sin permiso……
Y…… paso de los niños apestados por la orina. Me gusta cuando están empezando a madurar……"
 (talking),おや……若。,"Oh, Young Master.",Oy…… Joven Maestro.
Yamamoto Akuji (talking),おう。,Oh.,Oh.
Tamanegi (talking),ご見学ですか？,Are you here for a tour?,¿Estás de visita?
Yamamoto Akuji (talking),んーまあ、そんなとこだ。,"Hmmm, well, that's about it.","Hmmm, bueno, eso es todo."
__system__??,{D19 > 5:,,
Tamanegi (talking),若、なんでしたら、遊んでいかれますか？,"Young Maestro,would you like to play with us?","Joven Maestro, si quieres, ¿te gustaría ir a jugar?"
Yamamoto Akuji (talking),いや、無駄ダマは撃たない主義でよ。,"No, I don't shoot for nothing.","No, estoy en el principio de no disparar a los tontos inútiles."
Tamanegi (talking),"ふふ…そうですね。 若の一物は、商売道具ですものね…
気がお変わりになった時は仰って 下さい……","Hmmm…yes. I guess the Young Master's thing is the tool of his trade…
If you change your mind, just let me know: ……","Hmm… sí. La única cosa del Joven Maestro es la herramienta del oficio…
Si cambias de opinión, házmelo saber……"
__system__??,},,
__system__??,{S娼婦状態 = 1:,,
__system__??,},,
__system__??,{Sキャラ > 500:,,
__system__??,},,
Tamanegi (talking),あ、少々お待ち頂けますか…,"Uh, could you wait a moment, please…","Uh, podría esperar un momento…"
narrator,タマネギは店の奥に入ると、 女を一人連れてきた。,Tamanegi went into the back of the store and brought a woman with him.,Tamanegi entró en la parte trasera de la tienda y trajo a una mujer con ella.
Tamanegi (talking),若、ひとつ教育してやって 頂けませんか…？,"Young Master, could you please educate him…?","Joven Maestro, ¿podría educarlo en una cosa…?"
narrator,悪司は、,Akuji is a,Akuji es un
narrator,を連れて部屋に入った。,He entered the room with,con él en la habitación.
narrator,悪司は調教の館へやってきた。,Akuji came to the training hall.,Akuji llegó a la sala de entrenamiento.
Tamanegi (talking),おや…いらっしゃいませ、若。,"Oh, welcome, Young Master.","Oh… bienvenido, Joven Maestro."
Yamamoto Akuji (talking),たまには、調教の見学をしようかと 思ってな。,I thought I'd take a look at the training once in a while.,Pensé en dar una vuelta por el centro de formación de vez en cuando.
__system__??,{S娼婦状態 = 11:,,
__system__??,},,
__system__??,{D11 = 0:,,
Tamanegi (talking),生憎ですが… 現在、調教中の娘がおりません…,Unfortunately… we do not have a daughter in training at this time…,Desafortunadamente… no tenemos una hija en formación en este momento…
Yamamoto Akuji (talking),そっか、じゃあだめだな。,"I see, then no.","Ya veo, entonces no."
