character,jap text,Eng,Esp
__system__??,{RND \ 0:,,
narrator,悪司が新聞を読んでいるところに 智子がやってきた。,Akuji was reading a newspaper when Tomoko came in.,Akuji estaba leyendo el periódico cuando llegó Tomoko.
Yamamoto Akuji (talking),どうした？,What's up?,¿Qué pasa?
Kinugasa Tomoko (talking),あの…なんだか変な人が、悪司さんに お会いしたいといらっしゃってます…,Um…there's some strange person asking to see Mr. Akuji…,Um… hay una persona extraña aquí que quiere ver a Akuji…
Yamamoto Akuji (talking),変な奴？ 額からＢ２９を発射したり する様な奴か？,Weirdo? The kind of guy who fires B-29s out of his forehead?,¿Raro? ¿El tipo de hombre que lanza B-29s desde su frente?
Kinugasa Tomoko (talking),そういう意味の変では… その…なんだかこう…ねっとりと した目で、わたしを見たりとか…,"I mean, not in a weird way, but… you know… you look at me with these… sultry eyes… or something.","Quiero decir, no de una manera extraña, como… ya sabes… me miras con esos… ojos sensuales o…"
Yamamoto Akuji (talking),お前…そんなに自分が魅力的だと 思ってんのか？,You… you think you're so attractive?,Tú… ¿crees que eres tan atractiva?
Kinugasa Tomoko (talking),うっ…そ、そういう訳じゃ…,Well… that's not why I…,Eso no es… no es por eso…
Yamamoto Akuji (talking),とりあえず、入れろ。 気持ち悪かったら 追い出せばいーんだし。,"Let them in for now. If you feel uncomfortable, just kick them out.","Mientras tanto, déjelos entrar. Y si te sientes incómodo, échalos."
Kinugasa Tomoko (talking),は、はい、わかりました…,"Ha, yes, okay…","Ja, sí, vale…"
__system__??,},,
__system__??,{RND = 0:,,
narrator,悪司が新聞を読んでいるところに 青年団女子がやってきた。,Akuji was reading a newspaper when Seinendan Jyoshi arrived.,Akuji estaba leyendo un periódico cuando llegó Seinendan Jyoshi.
Yamamoto Akuji (talking),どうした？,What's up?,¿Qué pasa?
Seinendan Jyoshi (talking),あの…なんだか変な人が、悪司さんに お会いしたいといらっしゃってます…,Um…there's some strange person asking to see Mr. Akuji…,Um… hay una persona extraña aquí que quiere ver a Akuji…
Yamamoto Akuji (talking),変な奴？ 額からＢ２９を発射したり する様な奴か？,Weirdo? The kind of guy who fires B-29s out of his forehead?,¿Raro? ¿El tipo de hombre que lanza B-29s desde su frente?
Seinendan Jyoshi (talking),そういう意味の変では… その…こう、雰囲気が もう…普通の人でなくて…,"I mean, not in a weird way… but in a… in a… in a way that's… not normal…","Quiero decir, no en una… en una forma rara, sino en una… en una… en una forma que no es… normal…"
Yamamoto Akuji (talking),とりあえず、入れろ。 気持ち悪かったら 追い出せばいーんだし。,"Let them in for now. If you feel uncomfortable, just kick them out.","Mientras tanto, déjelos entrar. Y si te sientes incómodo, échalos."
Seinendan Jyoshi (talking),は、はい、わかりました…,"Ha, yes, okay…","Ja, sí, vale…"
__system__??,},,
Tamanegi (talking),無事帰国、おめでとうございます。 若。,Congratulations on your safe return home. Young Master.,Enhorabuena por su regreso a casa sano y salvo. Joven Maestro.
Yamamoto Akuji (talking),タマネギ！？,Tamanegi!,¡Tamanegi!
Tamanegi (talking),帰国なさって、驚いたでしょう。 わかめ組があんな事になって しまっていて。,You must have been surprised when you came back to Japan. I was surprised to see what had happened to the Wakame group.,Te habrás sorprendido al volver a casa. El grupo Wakame se ha convertido en un desastre.
Yamamoto Akuji (talking),"おう。 親父も死んじまったらしい上に、 お蘭の馬鹿が…
 …考えただけで、むかっぱらがたつぜ。","Oh. My dad's dead, too, apparently, and that idiot  Ran…
I'm getting angry just thinking about it.","Oh. Mi padre también está muerto, aparentemente, y ese idiota  Ran…
Me enfado sólo de pensarlo."
Tamanegi (talking),そうですね、あの組は、温厚な元組長と 暴れっぷりのいい若とで均衡を保って いた場所ですし。,"Yes, that clan was a place where the balance was maintained between a mild-mannered ex-gumi leader and a rampaging young man.","Sí, ese clan era un lugar en el que se mantenía el equilibrio entre el antiguo líder de modales suaves y el joven alborotador."
narrator,タマネギはそう言って、カシリと 生のまま、タマネギを齧った。,"Tamanegi said so and took a bite of Tamanegi, raw with kashiri.","Tamanegi dijo esto y mordió a Tamanegi, crudo, con un kashiri."
Yamamoto Akuji (talking),う……,U……,U……
Tamanegi (talking),どうしました？,What's wrong?,¿Qué pasa?
Yamamoto Akuji (talking),いや…俺はお前の事が嫌いじゃないが、 そのタマネギ丸齧りを見ると、どうも…,"No I don't hate you, but that Tamanegi round gnawing on my face is just…","No… no es que no me gustes, pero todo ese asunto de Tamanegi, es que…"
Tamanegi (talking),ふふふ…,Hmmm…,Hmmm…
Yamamoto Akuji (talking),しかし、どうした？ お前がここにくるなんて。,But what's the matter? I can't believe you came here.,¿Pero qué pasa? No puedo creer que estés aquí.
Tamanegi (talking),若がここにいらっしゃると 聞きまして。,I heard that the Young Master is here.,He oído que Joven Maestro está aquí.
Yamamoto Akuji (talking),"お前は、わかめ組風俗部の 専属調教師じゃねーか。
それが、俺がここにいると聞いて、 どうして…","You're the exclusive trainer of the Wakamegumi sex club, aren't you?
So when you heard I was here, how did you…","Eres el entrenador exclusivo del club de sexo Wakame-gumi, ¿verdad?
Por eso, cuando escuchaste que estaba aquí, tú…"
Tamanegi (talking),お蘭姐さんが、その風俗部を 閉鎖してしまいまして。,Miss  Ran has closed down her sex club.,La señorita ORan ha cerrado su departamento de aduanas.
Yamamoto Akuji (talking),あの馬鹿大年増。 一番実入りのいい部門を閉鎖したのか。,That big old fool. Did they close down the most profitable department?,Ese viejo idiota. Ha cerrado el sector más rentable.
Tamanegi (talking),"はい。 なんでも、ウィミィの新体制の 為だとか。
ウィミィが女性の躰を売り物に するなどとんでもないと…","Yes. It is for the new organization of Wime.
It's outrageous that Wime is selling women's bodies…","Sí. Se trata de la nueva estructura de Wime.
Es indignante que Wime esté vendiendo cuerpos de mujeres…"
Yamamoto Akuji (talking),奴らそんな事にまで 口出ししやがるのか。,They even meddle in such things?,¿Incluso se meten en estas cosas?
Tamanegi (talking),それでわたくし、失業してしまった 訳です。,That is why I lost my job.,Por eso perdí mi trabajo.
Yamamoto Akuji (talking),そうだったのか。,I didn't think so.,Lo era.
Tamanegi (talking),"それでですね…
お蘭姐さんよりずっと話のわかる若のそば でしたら、わたくしも腕の振るい甲斐が あるというもの。
いかがでしょう、若。 わたくし達を使って、風俗店を お持ちになりませんか？
わたくし達の旨味を一番知って いらっしゃるのは、 若だと思うんですが…
それとこれが肝心なんですが。 調教部屋をご用意して頂かないと…","So…
I would be more than happy to work with you if I could be by your side, who understands much more than Miss Ran does.
What do you think, Young Master? I would like to use use our services for a brothel.
I think you know best what we have to offer.
And this is the most important thing. We need a training room.","Así que…
Estaría más que feliz de poner mis habilidades en buen uso al lado de un joven que entiende mucho más que la señorita  Ran.
 ¿Qué piensas, Joven Maestro? ¿Te gustaría utilizarnos para abrir tu propio burdel?
Creo que usted sabe mejor que nadie lo que podemos ofrecer.
Y esto es lo más importante. Necesitamos una sala de entrenamiento…"
Yamamoto Akuji (talking),待て、達って、どーいう事だ？ お前の他にもいるって事か？,"Wait, what do you mean, “they”? You mean there's more than you?","Espera, ¿qué quieres decir con “ellos”? ¿Quieres decir que hay más que tú?"
Tamanegi (talking),ああ、忘れてました。 入っておいで。 小春さんに、千手ボーヤ。,"Oh, I forgot. Come on in. Koharu and Senju Boya.","Oh, lo olvidé. Pasa, pasa. Koharu y Senju Boya."
Kohara Koharu (talking),はじめまして。 わかめ組の若旦那様。,"Nice to meet you, dear Young Master of the Wakame group.",Encantado de conocerte. Querido Joven Maestro del clan Wakame.
Ishihara Senju (talking),こんにちわ。,Hello.,Hola.
Tamanegi (talking),"こっちのお嬢さんは、小原小春さん。 こっちのボーヤは、石原千手と いいます。
二人共、中々のやり手ですよ。","The lady over here is Kohara Koharu. This one is Ishihara Senju.
Both of them are quite good at what they do.","La señora de aquí es Kohara Koharu. La boya de aquí se llama Ishihara Senju.
Ambos son bastante buenos en lo que hacen."
Yamamoto Akuji (talking),――ふん。 やり手のお前がそう言うんだから、 腕は確かなんだろうな。,"--Hmmm. You're a good shot, so I guess you're good at it.","--Hmm. Eres un buen tirador, así que debes ser bueno en eso."
Kohara Koharu (talking),それは、雇われてから、 いくらでも納得して頂ける機会が あるかと。,I'm sure you'll have plenty of opportunities to convince us of that after you're hired.,Estoy seguro de que habrá muchas oportunidades para convencerte de ello una vez que estés empleado.
Yamamoto Akuji (talking),ふん…,Hmmm…,Hmmm…
Kohara Koharu (talking),ふふ…,Hmmm…,Hmmm…
Ishihara Senju (talking),"雇ってよ、悪司。 今ならボク、すっごく働くよ。
ウィミィのおかげで遊べなく なっちゃって、ホント うずうずしてるんだ。","Hire me, Akuji. I'll work for you now.
I'm really itching to play now that I can't thanks to Wime.","Contrátame, Akuji. Ahora trabajaré para ti.
Tengo muchas ganas de jugar ahora que no puedo gracias a Wime."
Yamamoto Akuji (talking),大したガキだな。,Great kid.,Gran chico.
Ishihara Senju (talking),くすくすっ。,"Sniff, sniff, sniff.",Huele.
Tamanegi (talking),どうでしょう？ わたくし達を雇って頂けますか？,What do you think? Would you hire us?,¿Qué te parece? ¿Nos contrataría?
__system__??,{RETURN = 1:,,
__system__??,},,
__system__??,{RETURN = 2:,,
__system__??,},,
Yamamoto Akuji (talking),"よし、わかった。 お前達の言う通りのものを用意しよう。
その代わり、期待に応えてくれなかった 時は、遠慮なく捨てさせてもらうぞ、 タマネギ。","All right, all right. I will prepare exactly what you say.
In exchange, if you don't meet my expectations, I'll feel free to throw it away, Tamanegi.","Muy bien, muy bien. Prepararé exactamente lo que dices.
A cambio, si no está a la altura de nuestras expectativas, lo tiraremos sin reservas, Tamanegi."
Tamanegi (talking),わかりました。 わたくし達三人、若の期待に応える様、 努力します。,I understand. The three of us will strive to live up to your expectations.,Lo entiendo. Los tres nos esforzaremos por estar a la altura de sus expectativas.
Kohara Koharu (talking),よろしくお願いします。,Best regards.,Saludos cordiales.
Ishihara Senju (talking),頑張るよ、悪司。,"I'll do my best, Akuji.","Haré lo que pueda, Akuji."
narrator,こうして、悪司の元に、 タマネギ、小春、千手の三人の 調教師がやってきた。,"Thus, three trainers, Tamanegi, Koharu, and Senju, came to Akuji.","Así, tres entrenadores, Tamanegi, Koharu y Senju, llegaron a Akuji."
 (talking),悪いが今のところ、 お前達を雇う余裕はない。 他をあたってくれ。,"I'm sorry, but we can't afford to hire you at this time. You'll have to look elsewhere.","Lo siento, no podemos permitírselo en este momento. Tendrás que buscar en otra parte."
 (talking),"そうですか…
わかりました。 それではお元気で、若。","Okay…
I understand. Well then, take care, Young Master.","Bien…
Lo entiendo. Entonces, cuídese, Joven Maestro."
narrator,タマネギ達は、奉仕青年団を後にした。,Tamanegi and his group left the service youth group.,Tamanegi y sus compañeros dejaron el grupo juvenil de servicio.
__system__??,{RND \ 0:,,
Kako Mirai (talking),にーちゃん。 タマネギ臭い人が、にーちゃんに 会いたいってきてるにゃりよ。,"Ni-chan. Tamanegi stinker wants to meet you, Nyari.","Ni-chan. Tamanegi apestoso quiere conocerte, Nyari."
Yamamoto Akuji (talking),タマネギ臭い…,Tamanegi Smelly…,Tamanegi Oloroso…
Kako Mirai (talking),生タマネギ、齧ってる人にゃり。 からそうにゃり。,"Raw Tamanegi, a person who is taking a bite. I'm a bit nervous.","Crudo Tamanegi, royendo a la gente. Kara-Seunyari."
Yamamoto Akuji (talking),ああ、わかった。 通してやってくれ。,"Yeah, okay. Let him through.","Sí, de acuerdo. Déjalo pasar."
Kako Mirai (talking),はいにゃり。,"Yes, sir.","Sí, sí, sí."
__system__??,},,
__system__??,{RND = 0:,,
Seinendan Jyoshi (talking),悪司さん。 タマネギ臭い人が、悪司さんに 会いたいって…,Mr. Akuji. Tamanegi stinker wants to meet Akuji…,Sr. Akuji. Tamanegi apestoso quiere conocer a Akuji…
Yamamoto Akuji (talking),タマネギ臭い…,Tamanegi Smelly…,Tamanegi Oloroso…
Seinendan Jyoshi (talking),生タマネギ、齧ってる人です。,"Raw Tamanegi, the gnawing person.","Crudo  Tamanegi, roedor."
Yamamoto Akuji (talking),ああ、わかった。 通してやってくれ。,"Yeah, okay. Let him through.","Sí, de acuerdo. Déjalo pasar."
Seinendan Jyoshi (talking),はい。,Yes.,Sí.
__system__??,},,
Tamanegi (talking),何度もすみません、若。,"Sorry again, Young Master.","Lo siento de nuevo, Joven Maestro."
Yamamoto Akuji (talking),いや、かまわねぇよ。 どうしたんだい？,"No, I don't care. What's the matter?","No, no importa. ¿Qué pasa?"
Tamanegi (talking),"それが…仕事先を他にも色々と あたったんですが、全滅でして。
若のお邪魔になると知りつつも、 こうして再度、お願いに。
若、お願いです。 わたくし達を雇って下さい。","I tried to find a job, but I couldn't find anything.
I know I'm interrupting you, but I'm here to ask again.
Young Master, please. Please hire us.","Intenté encontrar un trabajo, pero no pude encontrar nada.
Sé que te estoy interrumpiendo, pero estoy aquí para preguntarte de nuevo.
Joven Maestro, por favor. Por favor, contrátenos."
Yamamoto Akuji (talking),うむ…,Mm…,Mm…
__system__??,{RETURN = 1:,,
__system__??,},,
__system__??,{RETURN = 2:,,
__system__??,},,
__system__??,{RETURN = 3:,,
__system__??,},,
Yamamoto Akuji (talking),よし、決めた。,"Okay, I've decided.","Bien, lo he decidido."
Tamanegi (talking),若。,Young Master.,Joven Maestro.
Yamamoto Akuji (talking),俺は絶対、風俗産業を起こさない。,I would never start a sex industry.,"Nunca, jamás, crearía una industria del sexo."
Tamanegi (talking),なんですと…,What is it…?,¿Qué es…?
Yamamoto Akuji (talking),という訳だ。 タマネギ、いくらきてもらっても、 絶対仕事はない。,"That's why. Tamanegi, no matter how many people come, there will never be any work.","Por eso. Tamanegi, no importa cuánta gente venga, nunca habrá trabajo."
Tamanegi (talking),"……そう…ですか…
わかりました… それでは、さようなら、若… お元気で。","…… I see….
Then... goodbye, Young Master… Take care.","…… Bueno… vale…
Muy bien… entonces, adiós, Joven Maestro… cuídate."
Yamamoto Akuji (talking),ああ、達者でな。,"Yeah, with gusto.","Sí, con maestría."
Tamanegi (talking),"これは、若。
わたくし達の為に、この様に立派な 設備を整えて頂き、ありがとう ございます。","This is Young Master.
Thank you very much for providing such fine facilities for us.","Esto, Joven Maestro.
Gracias por proporcionarnos tan buenas instalaciones."
Yamamoto Akuji (talking),気にいったか？,You like it?,¿Te gusta?
Tamanegi (talking),"はい、それはもう。 これでわたくし達も腕の奮い甲斐が あるというもの。
後は、わたくし達が調教した女人を 売る為のお店も、出来れば早く ご用意頂ければと。
なんせ、ナマモノですし。","Yes, that's it. Now we will be able to put our skills to good use.
Now all we need is a store to sell the women we have trained as soon as possible.
After all, they are our own flesh and blood.","Sí, eso es. Ahora podemos poner en práctica nuestras habilidades.
Ahora lo único que necesitamos es una tienda para vender a las mujeres que hemos formado, preferiblemente cuanto antes.
Al fin y al cabo, son cosas reales."
Yamamoto Akuji (talking),そうだな。 鮮度が命のモンだから、さっさと 売る店を作るとすっか。,"I guess so. Freshness is the key, so let's quickly set up a store to sell them.","Sí, así es. La frescura es esencial, así que vamos a montar rápidamente una tienda para venderla."
Tamanegi (talking),"是非――
わたくし共の様な者が調教する女人を 使い、売春をしている店は稀ですからね。
固定客もすぐにつくでしょう。
例えば…この娘。","By all means…
It is rare to find a brothel that uses women trained by the likes of us.
You will soon have a regular clientele.
For example… this girl.","Por todos los medios…
Es raro encontrar un burdel que utilice mujeres entrenadas por gente como nosotros.
Pronto tendrá una clientela fija.
Por ejemplo… esta chica."
Yuuki Noemi (talking),はぇぇぇ？？？？,Huh. ？？？？,Huh. ？？？？
Tamanegi (talking),"まだまったくの手付かずの白い女人。 それを汚す楽しさはさておき、 店に出すには、ずぶの素人。
その様な女人を店の商品にしましては、 店の、しいては若の名を汚す事に なりましょう。","A Haku woman who is still completely untouched. Aside from the pleasure of defiling her, she is a complete amateur to be used in the brothel.
If we use such a woman as a product of our services, it will be a disgrace to our brothel and, by extension, to the name of our Young Master.","Una mujer Haku que aún no ha sido tocada. Aparte del placer de ensuciarlos, es una completa aficionada a la hora de venderlos en la tienda.
Si utilizas a una mujer así como producto de la tienda, estarás deshonrando el nombre de la tienda y, por extensión, de los Joven Maestro."
Yuuki Noemi (talking),何？？ なになに？？？ 何の話ですかーー！！？,What? What what what? What are you talking about?,"¿Qué? ¿Qué, qué, qué? ¿De qué estás hablando?"
Tamanegi (talking),白を艶に染め、逸品として店に 出すのは、このわたくし達。,We are the ones who dye Haku into a glossy color and display it as a gem in our stores.,Nosotros somos los que teñimos el Haku hasta sacarle brillo y lo exponemos como una joya en nuestras tiendas.
Yuuki Noemi (talking),あ、あの、あたし、何が起こってるのか わかんないんですがーー！！,I don't know what's going on here!,¡No sé qué está pasando aquí!
Tamanegi (talking),何…それをすべて知る時、あなたの 人生は変わっていますよ。,"What…when you know it all, your life will be different.","Que… cuando lo sepas todo, tu vida habrá cambiado."
Yamamoto Akuji (talking),今から始めるのか。,You're going to Hajimemeeru now?,¿Vas a ir a Hajimemeeru ahora?
Tamanegi (talking),はい。 さっそく。,Yes. Quickly.,Sí. Rápido.
Yuuki Noemi (talking),ななな、何がですーーー！！？？,What is it?,¿Qué demonios es eso?
Yamamoto Akuji (talking),潰さないようにな。,Don't let them crush you.,No dejes que te aplasten.
Tamanegi (talking),はい。,Yes.,Sí.
Yamamoto Akuji (talking),"それと… お前の手腕はわかっている。
どの女を商品にするかは、 俺が決める。
お前は俺の願いをきき、 俺の為に動いてくれればいい。","And… I know how good you are.
I'll decide which women become commodities.
All you have to do is do me a favor and work for me.","Y… sé lo bueno que eres.
Decidiré qué mujeres convertiré en mercancía.
Sólo tienes que hacerme un favor y trabajar para mí."
Tamanegi (talking),承知いたしております。,I am aware of that.,"Sí, somos conscientes de ello."
Yamamoto Akuji (talking),その女は調教していいが、 他のヤツには、俺が命じるまで 手を出すな。,"You can train that girl, but don't touch anyone else until I tell you to.","Puedes entrenar a esa chica, pero no toques a las otras hasta que te lo ordene."
Tamanegi (talking),はい、若。,"Yes, Young Master.","Sí, Joven Maestro."
Yuuki Noemi (talking),なななな…… にゃ~~~！！？？,Nanana…… Nyah~!,¡Nana…… Nya~!
Tamanegi (talking),わたくし達、三人力を合わせ、 どのような女人も商品として みせましょう。,We three of us will work together to make an example out of any woman.,Los tres trabajaremos juntos para hacer de cada mujer un ejemplo.
Yamamoto Akuji (talking),ああ、頼んだぜ。,"Yeah, I'm counting on you.","Sí, te lo estoy pidiendo."
Tamanegi (talking),"これは、若。
一度破壊されてしまった調教の館を 再び建設して頂き、本当にありがとう ございます。
引き続き、調教に励みますゆえ、 これからも指示の方を、 よろしくお願いします…","This, Young Master.
Thank you very much for re-building the training hall that was once destroyed.
I will continue to work hard on my training, so please continue to give me instructions…","Esto, Joven Maestro.
Muchas gracias por reconstruir la sala de formación que en su día fue destruida.
Seguiré trabajando duro en mi formación, así que por favor, sigan dándome instrucciones…"
Yamamoto Akuji (talking),おう。 しっかりな。,Oh. Hang in there.,Oh. Aguanta.
Tamanegi (talking),はい、それはもう…,"Yes, that's already…","Sí, eso ya es…"
__system__??,{☆乱数 = 1:,,
Tamanegi (talking),なるほど…,I see…,Ya veo…
Tamanegi (talking),"ですか…
わかりました。 わたくしのこの手にかかれば、どんな 生娘でも一流の娼婦になりますよ。
また、仕上がり具合をお尋ね下さい… ………くくっ…","Is that…
I understand. In my hands, any raw girl can become a first-class whore.
Please ask me how it's done… ………","Es…
Lo entiendo. En mis manos, cualquier chica cruda puede convertirse en una puta de primera clase.
Por favor, pregúntame cómo se hace… ………"
__system__??,},,
__system__??,{☆乱数 = 2:,,
Kohara Koharu (talking),まあ…,Well…,Bueno…
Kohara Koharu (talking),"さん…
 ……………
ふふっ… 楽しそう…
調教状態、いつでもお聞き下さいね、 若旦那様…","Three…
 ……………
Hmmm… looks like fun…
I'm always happy to hear about your training condition, Young Master…","Tres…
 ……………
Hmmm… parece divertido…
Puedes preguntarme cuando quieras sobre el estado de tu entrenamiento, Joven Maestro…"
__system__??,},,
__system__??,{☆乱数 = 3:,,
Ishihara Senju (talking),ふーん。,Hmmm.,Hmmm.
Ishihara Senju (talking),"かー。
どっしよーかなー。 どうやっていぢめよっかなー。 血と涙、どっちが似合うかなー。
んじゃあ、またね、悪司。 どんな風にしあがるかは、お楽しみ。 あははっ。","I'm so excited.
What shall I do? I wonder how I should torture him. I wonder which suits me better, blood or tears.
Well, Tane, Akuji. How it will turn out is up to you. Hahaha.","No estoy seguro.
 ¿Qué debo hacer? ¿Cómo debo burlarme de él? ¿Qué me conviene más, la sangre o las lágrimas?
Bueno, veamos, Tane, Akuji. El resultado depende de ti. Ja, ja, ja."
__system__??,},,
Tamanegi (talking),若、調教具合をご覧になりたいの ですか？ それでは、どうぞ、こちらに…,"Young Master, would you like to see how they are doing? Well, then, please, come in here…","Joven Maestro, ¿quieres ver cómo estás? Bueno, entonces, por favor, entra…"
Ishihara Senju (talking),やあ、悪司。,"Hi, Akuji.","Hola, Akuji."
Yamamoto Akuji (talking),おう、千手。 どうした？ 買い食いの帰りか？,"Oh, Senju. What's up? You back from a shopping spree?","Oh, Senju. ¿Qué pasa? ¿Vuelves de un viaje de compras?"
Ishihara Senju (talking),退屈だったから、巣を張ってたのさ。,"I was bored, so I put up a nest.","Estaba aburrido, así que puse un nido."
Yamamoto Akuji (talking),巣？,Nest?,¿Nido?
