"character","jap text","Eng","Esp"
"narrator","言って、振り向こうとした由女の足下がもつれた。","He tried to turn around, but got tangled up under his feet.","Dijo e intentó darse la vuelta, pero los pies de Yume se enredaron."
"Yume (talking)","……あ…っとと…………","…… and …………","…… Ah… por fin…………"
"Tsukigase Nene (talking)","由女、大丈夫？ ……部屋まで送るわ、私に掴まりなさい。","Yume, are you okay?…… I'll walk you to your room, hold on to me.","Yume, ¿estás bien?…… Te acompañaré a tu habitación, agárrate a mí."
"Yume (talking)","いいよ、そんな…………","Okay, that kind of …………","Vale, no es tan buena idea…………"
"Tsukigase Nene (talking)","汗も結構、かいているみたいね。 お風呂は無理でしょうから、 躰、拭いてあげましょうか。","You seem to be sweating a lot. Since you can't take a bath, shall I wipe your body?","Parece que estás sudando mucho. No creo que puedas bañarte, ¿te limpio el cuerpo?"
"Yume (talking)","い、いいよ、そんな事まで……","Yes, okay, even that: ……","Sí, vale, incluso eso……"
"Tsukigase Nene (talking)","躰、気持ち悪いのでしょう？ 遠慮なら要らないから。","Body, you must be sick, right? Don't be shy.","Cuerpo, debes estar enfermo, ¿verdad? Si no te importa, no te molestes."
"Yume (talking)","………… じゃあ…………","………… Then …………","………… Entonces …………"
"narrator","──暖をとった部屋のベッドで、 着物を大きくはだけて露わにした由女の背を 寧々が丁寧に拭き清めていた。","─ On the bed in the warmed room, Nene was carefully wiping clean the back of Yume, who had stripped off her kimono to expose her body.","─ ─ En la cama de la habitación caldeada, Nene limpiaba con cuidado la espalda de Yume, que se había despojado de su kimono de par en par y se había expuesto."
"Yume (talking)","…………","…………","…………"
"Tsukigase Nene (talking)","……由女、どうかしたの？ 何か話したそうな顔をしているけれど。","……Yume, what's wrong? You look like you want to talk about something, though.","……Yume, ¿qué pasa? Sin embargo, parece que quieres decirme algo."
"Yume (talking)","あ、ううん、別に… 何だか、黙ってるのが照れ臭くて…","Oh, no, it's nothing… I'm just a little embarrassed to keep my mouth shut…","Me da vergüenza estar tan callado…"
"Tsukigase Nene (talking)","ふふっ…気持ちは解るわ。 何か話しましょうか。","Hmmm…I know the feeling. Shall we talk about something?","Hmm… Sé cómo te sientes. ¿Hablamos de algo?"
"Yume (talking)","うん……そうだね。 じゃあ、一つ訊いてもいい？
寧々さんって、戦争の前は 何をしてたの？","Yeah…… I guess so. Well, can I ask you one question?
What did you do before the war, Nene?","Sí……. Bueno, ¿puedo hacerte una pregunta?
 ¿Qué hacía Nene antes de la guerra?"
"Tsukigase Nene (talking)","何って……話したことなかったかしら？","What do you mean, haven't I told you about ……?","¿Cómo que no te he hablado de ……?"
"Yume (talking)","戦争が本格化するまで、陽子さんと 南に居たとは聞いたけど…… それだけだよ。","I heard you and Youko were in the South until the war got into full swing…… but that's all I know.","He oído que tú y Youko estuvisteis en el Sur hasta que la guerra entró en pleno apogeo…… Eso es todo lo que sé."
"Tsukigase Nene (talking)","…………それだけなのよ。 他はもう、忘れたわ。","………… That's all there is to it. The rest I've already forgotten.","………… Eso es todo. El resto ya lo he olvidado."
"Yume (talking)","えー、何それ……","Well, what's that ……","Er, qué es eso: ……"
"Tsukigase Nene (talking)","………………
屑のために、必死で… 屑みたいなことを沢山して… 屑たちに埋もれて、屑たちと寝て……
もし、私が屑に……惹かれなければ、 いえ、私がこの世に 生まれてこなければ……
ニホンも、南方も、今よりもっと 状況は良かったかもしれないわね。
いえ…… 私自身が屑だっただけね、きっと…","………………
I would be desperate for garbage… doing lots of rubbishy things… burrowing in the garbage, sleeping with the garbage ……
If I hadn't been attracted…… to garbage, no, if I hadn't been born into this world ……
Things might have been better in Japan and in the south.
No,…… I was just garbage myself, I'm sure…","………………
Estaría desesperado por la basura… haciendo muchas cosas basura… enterrándome en la basura, durmiendo con la basura ……
Si no me hubiera atraído…… a la basura, no, si no hubiera nacido en este mundo ……
las cosas podrían haber sido mejores en el sur, en Japón, de lo que son ahora.
No,…… Yo mismo era una basura, estoy seguro…"
"Yume (talking)","？？？？？","？？？？？","？？？？？"
"Tsukigase Nene (talking)","理解できない方がいいわ。
 ……さ、終わったわよ。 温かくして、お休みなさい。","You'd better not understand.
 ……, it's over. Stay warm and have a good night.","Es mejor que no lo entiendas.
 ……, se acabó. Manténgase caliente y tenga una buena noche."
"Yume (talking)","あ、うん……
 ……寧々さんの手って、優しいよね。","Oh, yeah……
 ……Nene's hands are so gentle.","Oh, sí……
 ……Las manos de Nene son tan suaves."
"Tsukigase Nene (talking)","えっ…？ 何を言うの、突然……","Eh…? What do you say, all of a sudden ……","¿Eh? ¿Qué dices, de repente ……"
"Yume (talking)","あ、何かね…躰拭いてもらってた時、 私にお母さんがいたら、 こんな感じかなあって、そう思って。
へへ… なんとなく、だけど……","Oh, you know… when you were wiping my body, I was thinking that if I had a mother, this is how I would feel.
Hehe… I don't know, but… ……","Cuando estabas limpiando mi cuerpo, pensaba que si tuviera una madre, sería así.
Eh… más o menos, pero… ……"
"Tsukigase Nene (talking)","……お母さん、ね。
ふふっ……もしかして、 私が老けてるって言いたいのかしら？","…… mother, right?
Hmmm……… maybe you're trying to say I'm old?","…… madre, ya sabes.
Hmmm……… ¿quizás está tratando de decirme que soy viejo?"
"Yume (talking)","ちっ、違うよ！ そうじゃなくって……","Tsk, no! It's not that……","¡No! No, no lo es……"
"Tsukigase Nene (talking)","解ってるわよ。 早くお休みなさい、ほら。","I understand. Now go to sleep.","Lo entiendo. Ahora vete a dormir, vamos."
"Yume (talking)","……はーい。","…… Hai.","…… Hai."
"Tsukigase Nene (thinking)","……………… 優しい……か。","……………… gentle ……?","……………… suave…… o."
"narrator","──早朝、たまたま早起きした由女は 何の気なしに教団本部を散歩していた。","─ ─ Early in the morning, Yume happened to wake up early and casually strolled around the headquarters of the Order.","─ ─ A primera hora de la mañana, Yume se levantó por casualidad temprano y dio un paseo casual por la sede de la Orden."
"Yume (talking)","……あれ？　遙さん？","…… Huh?　Haruka?","…… ¿Eh?　¿ Haruka?"
"narrator","ふと見ると、中庭に遙が立っていた。 抜き身の刀を正眼に構え、目を閉じて。
身じろぎ一つしないものの、 稽古の最中らしいことは由女にも解った。","I looked up and saw Haruka standing in the courtyard. She was holding a drawn sword with her eyes closed.
Although she didn't move even a muscle, Yume could tell that she was in the middle of training.","Levanté la vista y vi a Haruka de pie en el patio. Sostenía una espada desenvainada con los ojos cerrados.
Aunque no movió ni un músculo, Yume pudo comprobar que estaba en pleno entrenamiento."
"Yume (talking)","今は、声かけちゃ…… いけないよね、たぶん…","I shouldn't be talking to…… right now, maybe…","No debería estar hablando contigo ahora mismo…… Probablemente no debería…"
"narrator","思って、由女はその場でしばし遙を見つめる。
 ──と、遙の目が唐突に開いた。
それと同時に、 遙は自分の心の中に思い浮かべた三人の敵へ 稲妻のような斬撃を繰り出していく。
右側面から襲い来る敵の胴を横一文字に薙ぎ──
振り向き様、 背後の敵の手首を斬り落とし──
返す刀で正面の敵の攻撃を跳ね上げて躱し、 袈裟懸けに致命の一撃を打ち下ろす。
 ──瞬きほどの間で、 敵三人に反撃の暇すら与えず斬り斃していた。
それは、素人に過ぎない由女の目にまで、 遙の心にある敵の動きや呼吸までもが解るほどの 真に迫った動きだった。","Thinking of this, Yume stared at Haruka for a while on the spot.
Then, Haruka's eyes suddenly opened.
At the same time, Haruka unleashes a slash like a bolt of lightning at the three enemies she had imagined in her mind.
She cleaves the torso of the enemy coming at her from the right side in a single horizontal motion…
Turning around, he slashes off the wrist of the enemy behind him…
He leaps up and ducks the front enemy's attack with his return sword, and strikes down a fatal blow with his kesagake.
In the blink of an eye, he had slain three enemies without even giving them time to counterattack.
It was such a true and realistic movement that even the eyes of Yume, who was only an amateur, could understand the movements and breathing of the enemies in Haruka's mind.","Pensando, Yume miró a Haruka durante un rato en el lugar.
Y entonces los ojos de Haruka se abrieron de repente.
Al mismo tiempo, Haruka lanza un tajo como un rayo a los tres enemigos que había imaginado en su mente.
Corta el cuerpo del enemigo que viene hacia ella desde el flanco derecho en un solo movimiento horizontal…
Cuando te das la vuelta, cortas las muñecas del enemigo que está detrás de ti…
Se levanta de un salto y evita el ataque del enemigo frontal con su espada de vuelta, y le asesta un golpe mortal con su kesagake.
En un abrir y cerrar de ojos, había matado a tres enemigos sin darles tiempo a contraatacar.
Era un movimiento tan cercano a la verdad que incluso los ojos de Yume, que sólo era una aficionada, podían entender los movimientos y la respiración del enemigo en la mente de Haruka."
"Yume (talking)","う、うわー…… すごーい、すごーい……","Wow, wow…… amazing, amazing ……","Wow, wow…… Increíble, increíble ……"
"Toki Haruka (talking)","…………えっ？ あ、な……那古神様っ……！","………… eh? Oh, na…… Nako God! ……!","………… ¿eh? ¡Oh, na…… Nako Dios!"
"Yume (talking)","あ……ごめんなさい。 邪魔するつもりじゃなかったんだけど…","Oh…… sorry. Didn't mean to interrupt…","Oh…… lo siento. No quise molestarte…"
"Toki Haruka (talking)","あ、いえ……いいんです。 今朝の稽古はもう 終えるつもりでしたから……","Oh, no,…… is fine. I was going to finish my practice this morning……","Oh, no, es…… bien. Iba a terminar mi entrenamiento esta mañana……"
"Yume (talking)","汗……びっしょりだね。 あんな事、何度も繰り返してたの？","You're drenched in sweat ……. How many times did you have to do something like that?","Estás empapado de sudor ……. ¿Cuántas veces has hecho ese tipo de cosas?"
"Toki Haruka (talking)","い、いえ、五回くらいですけど…
躰より、心が疲れるんです。 イメージしてる相手に負けたら こっちが斬られちゃうから……
 ……あ、いえその、 別にほんとに怪我する訳じゃなく…","No, no, about five times…
My mind is more tired than my body. If I lose to the person I'm imagining, I get cut………… Oh, no, it's not that I'm really hurt…","No, no, unas cinco veces…
Mi mente está más cansada que mi cuerpo. Si pierdo contra la persona que estoy imaginando, me cortan………… Oh, no, no es que esté realmente herido…"
"Yume (talking)","なんとなく、解るよ。 そのくらい集中してるんだよね。","Somehow, I get it. That's how focused I am.","De alguna manera, puedo entenderlo. Así de concentrado estás."
"Toki Haruka (talking)","………………あ、は、はい…
 …あ、那古神様もやってみますか？ 私、竹刀も持ってきてるんです。
 ……そ、その、 朝の稽古、気持ちいいですし……","……………… Ah, ha, yes…
 …Oh, would you like to try Nakojin? I've brought my shinai too.…… Well, you know, it's nice to practice in the morning……","……………… Ah, ja, sí…
 …Oh, ¿te gustaría probar el Nakojin? También he traído mi shinai.…… Bueno, ya sabes, la práctica de la mañana se siente bien……"
"Yume (talking)","あはは…やってみたいんだけど、 私、きつい運動はしちゃいけないから…
でも、ちょっとだけ刀持ってみたいな。 ……駄目？","I'd like to try it, but I'm not allowed to do hard exercise…
But I'd like to hold a sword for a bit…… no?","Ja, ja, me gustaría probarlo, pero no se me permite hacer ejercicio duro…
Pero me gustaría sostener una espada por un rato…… dame?"
"Toki Haruka (talking)","あ、はい、いいですよ。 ただ、重いから…気をつけて下さい。","Oh, yes, it's fine. Just be careful…it's heavy.","Ah, sí, está bien. Sólo ten cuidado… es pesado."
"Yume (talking)","重いって、それほどでもないんでしょ？ さっきあんな簡単に振りまわ………………………… む、ムチャクチャ重い……","Heavy, not so heavy, right? It was so easy to swing around like that just now………………………… mmm, it's so heavy……","Pesado, no tan pesado, ¿verdad? Lo he hecho girar con mucha facilidad………………………… mmm, es tan pesado……"
"Toki Haruka (talking)","……刀って結局、 すごく密度の高い鋼の塊ですから…","……A sword is, after all, a very dense piece of steel…","…… Una espada es, después de todo, una pieza de acero muy densa…"
"Yume (talking)","こんなの、 よくあんなに振れるね、遙さん… 腕の太さ、私と大差ないのに……","I don't know how you can swing such a thing, Haruka… Your arms are not much bigger than mine……","No sé cómo puedes balancear algo así, Haruka… aunque tus brazos no son mucho más grandes que los míos……"
"Toki Haruka (talking)","人の躰って…いじめぬくと、 あんまり太くはならないみたいです。 筋肉の芯は固く締まるんですけど……
あと、瞬発的に力を絞り出す 呼吸法とかもあって……","It seems that the human body…does not get very thick when it is bullied. The core of the muscles become hard and tight……
Also, there are breathing exercises to squeeze out instantaneous power……","Parece que el cuerpo humano… no se pone muy espeso cuando se le intimida. El núcleo de los músculos se tensa cada vez más, pero ……
También hay ejercicios de respiración para exprimir la energía de forma instantánea……"
"Yume (talking)","……腕、触ってみてもいい？","…… Can I touch your arm?","…… ¿Puedo tocar tu brazo?"
"Toki Haruka (talking)","あ……どうぞどうぞ。","Oh,…… please go ahead.","Ah…… por favor, adelante."
"Yume (talking)","ほんとだ… 腕の中に強い筋が何本もあるね。
でも、どっちかっていうとこれ、 むにむにしてて優しい感じ……
 ……ってうわっ、 今突然硬くなった！　硬くなったよ！？","Really… you have some strong muscles in your arm.
But if anything, this one is more munchy and gentle ………… Wow, it just got hard all of a sudden!　It just got hard!","Es cierto… tienes unas fuertes estrías en el brazo.
Pero en todo caso, este es mmmmmm, es suave………… ¡Oh, Dios mío, se puso duro de repente!　¡Se está poniendo difícil!"
"Toki Haruka (talking)","今やったのが呼吸法です。 防御にも役立つし、健康法にも……
 ……あ、これ、お教えしましょうか？ 憶えるのは難しいんですけど、 躰を使うことじゃないですし……","What I just did is breathing exercises. It's useful for defense and for health ………… Oh, I can teach you this one. It's hard to remember, but it's not something you have to use your body for……","Lo que acabo de hacer es un ejercicio de respiración. Es útil para la defensa y para la salud ………… Oh, puedo enseñarte esta. Es difícil de recordar, pero no es algo para lo que tengas que usar tu cuerpo……"
"Yume (talking)","あ、うんうん、教えて！
 ………………
ね……遙さん。 これってやっぱり、胸っていうか……
 ……その、おっぱい……も、硬くなる？","Oh, yeah, yeah, tell me about it!
 ………………
Hey ……Haruka. I guess this is still more like breasts or ………… that, do your boobs…… get hard, too?","Oh, sí, sí, ¡cuéntame!
 ………………
Hey ……Haruka. Creo que estos son todavía pechos, o ………… eso, ¿también se te ponen duras las tetas ……?"
"Toki Haruka (talking)","……えっ？ あ、その……ど、どうでしょう…… もともと筋肉じゃないし……","…… eh? Oh, I don't know about that…… How about that…… I'm not a muscle to begin with……","¿Qué hay de…… eh? Oh, no sé sobre eso…… ¿Qué tal eso…… No soy un músculo para empezar……"
"Yume (talking)","昔、たしか……寧々さんか陽子さんが、 運動するのに邪魔なんだって言ってて。
苦しいくらい縛り付けないと、 どうしても動いちゃうとか……
だから、その呼吸法で硬くなれば 邪魔じゃなくなるのかな、とか…… ちょっと思ったんだけど。","I think it was ……Nene or Youko who said that it interferes with exercise.
I heard that if you don't bind them to the point of pain, they can't help but move……
So I wondered if that breathing technique would make them less of a hindrance if they were stiffened…… I was just thinking about that.","En el pasado, creo que ……Nene o Youko dijeron que estorbaban para hacer ejercicio.
Si no se les ata hasta el punto del dolor, no pueden evitar moverse……
Así que me pregunté si esa técnica de respiración sería menos molesta si se hiciera más difícil…… Lo pensé durante un tiempo."
"Toki Haruka (talking)","………………
 ……私、もともとつるぺただから… 気にしたこと、全然なくて……","………………
 ……I've always been a vine… I've never cared for it, not at all……","…………………… Siempre he sido una enredadera… Nunca me ha molestado, en absoluto……"
"Yume (talking)","……うぐ………… つ、つるぺたって…………
 …………私もそうだけど…………","…… ugu………… ts, vinepetal……… …………… I'm not so sure about that either…………","…… ugu………… ts, vinepetal……… …………… Yo también…………"
"Toki Haruka (talking)","羨ましいですね…… 陽子先輩と、寧々先輩……","I envy you…… Youko seniors and Nene seniors ……","Os envidio…… Youko mayores y Nene mayores ……"
"Yume (talking)","あ、う、うん……","Oh, um, yeah……","Uh, sí……"
"Toki Haruka (talking)","………………","………………","………………"
"Yume (talking)","………………","………………","………………"
"Toki Haruka (talking)","…………しくしくしく……","………… Shiku shiku shiku ……","………… shiku shiku shiku ……"
"Yume (talking)","…………しくしくしくしくしく……","………… ditto ditto ditto ditto ditto ……","………… Mierda, mierda, mierda, mierda: ……"
"Tsukigase Nene (talking)","陽子ったら、どこに行ったのかしら……","I wonder where Youko went: ……","Me pregunto a dónde fue Youko……"
"nakokyou  onna (talking)","……寧々様？ どうかなさいましたか？","Dear Mr……Nene? What's wrong?","Estimado Sr……Nene? ¿Qué pasa?"
"Tsukigase Nene (talking)","ええ、聖女陽子を 捜しているのですが…… ご存じありませんか？","Yes, I'm looking for Saint Youko,…… Do you know her?","Sí, estoy buscando a Santa Youko…… ¿La conoces?"
"nakokyou  onna (talking)","あ、陽子様なら、 裏手の芝生で那古神様と……","Oh, if you are Youko, you can meet Nako God on the back lawn at ……","Oh, si eres Youko-sama, puedes encontrarte con el Dios Nako en el jardín trasero en ……"
"Tsukigase Nene (talking)","由女……様と？","With Yume ……?","¿Con Yume ……?"
"nakokyou  onna (talking)","はい。 恐らく、そちらの窓から お姿を確かめられるかと思いますが…","Yes, sir. Perhaps we can see you through your window.","Sí, señor. Tal vez podamos verlo a través de su ventana…"
"narrator","──言われて寧々が窓へと目をやると、 確かにそこには由女と陽子が居た。
二人は、芝生の上に敷物を広げて傘を立て、 昼食らしい膳を置いて向かい合っていた。
楽しげに話す様が、遠目にも解る。","When Nene looked at the window, she saw Yume and Youko.
They were spreading a rug on the lawn, setting up an umbrella, and facing each other with a lunch-like dish on the table.
Even from a distance, I could see that they were talking happily.","Cuando Nene se asomó a la ventana, vio que Yume y Youko estaban efectivamente allí.
Estaban extendiendo una alfombra sobre el césped, sosteniendo una sombrilla y enfrentándose con un plato de comida sobre la mesa.
Incluso desde la distancia, se podía ver que estaban hablando alegremente."
"nakokyou  onna (talking)","お珍しく、那古神様と陽子様が 昼の膳でご一緒なさいまして。
今日は雲が薄く、朧気に日輪の見える 良い天気でしたので、たまには 趣向を変えて外で……と。","Unusually, God Nako and Youko joined us for lunch.
It was a beautiful day with thin clouds and a vague glimpse of the sun, so we took a change of pace for a change and went outside with …….","Inusualmente, Dios Nako y Youko se unieron a nosotros para el almuerzo.
Hacía un día precioso con nubes finas y un vago atisbo de sol, así que cambiamos de aires de vez en cuando y salimos al exterior con ……."
"Tsukigase Nene (talking)","……由女様のご提案ですか？","Is this a suggestion by ……Yume?","Sugerido por ……Yume?"
"nakokyou  onna (talking)","いえ、陽子様だと聞いています。
何でしたら、私が下まで行って 寧々様がお探しですと お伝えして参りましょうか？","No, I heard it was Mr. Youko.
If you want, I can go downstairs and tell them that Mr. Nene is looking for you.","No, he oído que era Lady Youko.
Si quieres, puedo bajar y decirles que Nene te está buscando."
"Tsukigase Nene (talking)","……そうですね、お願いします。
ただ、聖女陽子には あの膳が終わってから 伝えるようにして下さい。
それほど急ぎでもありませんから、 側仕えか料理番にでも言伝を頼めば 充分です。","……Yes, please do.
But please tell Saint Youko after the meal is over.
It's not that urgent, so it's enough if you ask the cook or the side servants to pass the message on to her.","…… Sí, por favor.
Pero, por favor, dígaselo a San Youko cuando termine la comida.
No es tan urgente, así que basta con que pidas a los cocineros o a los sirvientes que pasen el mensaje."
"nakokyou  onna (talking)","はい、心得ました。","Yes, I have it in mind.","Sí, me lo sé de memoria."
"Tsukigase Nene (talking)","…………ふふっ。 邪魔をしては、悪いものね。
 ………………
仲の良いこと……","………… Phew. Sorry to interrupt you, I know.
 ………………
Being good friends: ……","………… Phew. Es de mala educación interrumpirte, ¿no?
 ………………
Ser buenos amigos……"
"narrator","──呟いて、寧々は窓に背を向けた。","Muttering, Nene turned her back to the window.","─ ─ Murmurando, Nene se volvió de espaldas a la ventana."
"narrator","教団本部の片隅で、 陽子が由女の髪を切っていた。
髪切鋏や櫛を始めとして、 道具類は全て間に合わせのものだが──
陽子は慣れた手つきで、由女の髪を整えていく。","In a corner of the Order's headquarters, Youko was cutting Yume's hair.
She was using a makeshift set of tools, including a pair of haircut shears and a comb for Hajime, but Youko was getting used to it.
Youko was preparing Yume's hair with a familiar hand.","En un rincón de la sede de la Orden, Youko estaba cortando el pelo a Yume.
Utilizaba unas tijeras para cortar el pelo y un peine para Hajime, y todas las herramientas eran improvisadas…
Youko estaba preparando el pelo de Yume con una mano familiar."
