"character","jap text","Eng","Esp"
"Ehavilla Me (talking)","……これはシーネル司令。 お願いした予算と助手を わざわざ持ってきて下さったのか？","…… This is the Seanel Command. Did you bother to bring the budget and assistants I asked for?","…… Este es el comando Seanel. ¿Te has molestado en traer el presupuesto y los asistentes que te pedí?"
"Seanel Br (talking)","冗談でしょう？ 誰があんな要請、受けるもんですかっ。
あなた…健康診断に来たニホンの女性に 謝礼と言って現金を渡しているそうね。 どういうつもり？","Are you kidding? Who would accept such a request?
I heard that you…gave cash as gratuity to a Japanese woman who came for a medical checkup. What do you think you're doing?","¿Estás bromeando? ¿Quién aceptaría una petición así?
Te escucho… están dando dinero en efectivo como propina a una mujer japonesa que vino para un chequeo médico. ¿Qué crees que estás haciendo?"
"Ehavilla Me (talking)","どういうつもりも何も… 必要経費だが？","I don't know what you think you're doing… but it's a necessary expense.","No sé qué creen que están haciendo… pero es un gasto necesario."
"Seanel Br (talking)","ふざけないでっ！ こんな…こんな事に使う予算なんて どこにあるって言うのよっ！","Stop kidding around! Where is the budget for such… such a thing?","¡Deja de bromear! ¿Dónde está el presupuesto para… para esto?"
"narrator","言って、シーネルはラボの中を ぐるりと見渡した。
血液サンプル、レントゲン写真、問診票、 そして、下着姿の女性たちを撮った写真──
そうした“資料”が、 そこいら中に山と積み上げられている。","With that, Seanel looked around the lab.
Blood samples, x-rays, medical questionnaires, and photos of women in their underwear…
There were piles and piles of such “materials” all over the place.","Tras decir esto, Seanel miró alrededor del laboratorio.
Muestras de sangre, radiografías, cuestionarios médicos y fotografías de mujeres en ropa interior…
Hay montones y montones de estos “documentos” por todas partes."
"Seanel Br (talking)","詐欺やセクハラもいいところよ。 ニホンの女性を騙して、 こんな写真を撮って……
年寄りの道楽っていうには、 あまりに趣味が悪すぎるわね。 ……イハビーラ爺さん！","It's a scam and sexual harassment. Tricking Japanese women into taking pictures like this one: ……
This is too much of a hobby for an old man……Ehavilla old man!","Es una estafa y un acoso sexual. Engañar a las mujeres japonesas para que se hagan fotos así ……
Esto es demasiado gusto para un pasatiempo de ancianos……Ehavilla ¡viejo!"
"Ehavilla Me (talking)","………………","………………","………………"
"Seanel Br (talking)","本部から資料を取り寄せたのよ、 あなた、本当は齢七十を越える 男性の老科学者だそうね？
記憶と意識だけを別の躰に…… その女の躰に移植して、 今まで生き長らえてるんですって？
全く、最低ねっ… それで女になったつもり？","I got a file from headquarters that says you're actually an old male scientist over 70 years old.
You've survived all this time with only your memories and consciousness implanted in another body…… and a woman's body?
That's disgusting… And you think that makes you a woman?","Tengo un archivo de la sede que dice que en realidad eres un científico masculino de más de 70 años…
Has sobrevivido todo este tiempo implantando tus recuerdos y tu conciencia en otro cuerpo ……, ¿un cuerpo de mujer?
Eso es asqueroso… ¿y crees que eso te convierte en una mujer?"
"Ehavilla Me (talking)","この躰は、脳死した娘のものを 合法的に譲り受けたのだよ。 文句を言われる筋合いはないな。
それに、これは性転換が目的ではない。 延命と、そして女性への理解。 それだけだ。","This body was legally given to me by my brain-dead daughter. I have no reason to complain.
Besides, this is not about sex change. It's about prolonging life and understanding women. That's all.","Este cuerpo me fue dado legalmente por mi hija con muerte cerebral. No tengo derecho a quejarme.
Además, no se trata de un cambio de sexo. Se trata de prolongar la vida y comprender a las mujeres. Eso es todo."
"Seanel Br (talking)","なら何よっ…この裸体写真の山！ 変態男の盗撮趣味と一緒じゃない！
こんなものが医学と関係あるなんて 言わせませんからねっ！","Then what… this pile of naked photos! It's just like a pervert man's voyeuristic hobby!
Don't tell me this has anything to do with medicine!","Entonces qué… ¡este montón de fotos de desnudos! ¡Es como el hobby voyeurista de un pervertido!
 ¡No me digas que esto tiene que ver con la medicina!"
"Ehavilla Me (talking)","大有りなのだよ。 生体実験用の新たなサンプルを 見いだす検査も兼ねているのでね。","It's a big deal. It also serves as a test to find new samples for biological experiments.","Es una gran cosa. También sirve como prueba para encontrar nuevas muestras para experimentos biológicos."
"Seanel Br (talking)","…サンプル？","…sample?","…¿muestras?"
"Ehavilla Me (talking)","私のサンプルには、 水準以上の美しさが求められる。
醜い新世界など、誰も望みはしまい？ 種の選別は先導者としての責務だよ。
幸いなことに、ニホン女性には 適合者が多いらしい。 喜ばしいことだ……","My sample must be of above-average beauty.
Who wants an ugly new world? It is my responsibility as a leader to select the right species.
Fortunately, I've heard that many Japanese women are fit for the job. I'm glad to hear it……","Mi muestra debe ser de una belleza superior a la media.
 ¿Quién no querría un mundo nuevo y feo? Es mi deber como líder seleccionar las especies adecuadas.
Afortunadamente, parece que muchas mujeres japonesas son aptas para el trabajo. Estoy encantado……"
"Seanel Br (talking)","何を言ってるのっ…！ 訳の解らないことを言って 煙に巻こうったって…！","What are you talking about? You're trying to smoke me out by saying things I don't understand.","¿De qué estás hablando? Estás tratando de ahuyentarme diciendo cosas que no entiendo."
"Ehavilla Me (talking)","命の痛みを知る命、母なるもの…
どれほど女性が美しい存在であるか、 そして優れている存在であるか。
そして同時に… どれほど男がガサツで野蛮な 劣等種であるのか。
これは、元々男だった私だからこそ、 真に解るのだよ。
君に理解しろとは言わないが…
全ては社会的に、そして生物的に、 男を滅亡させるための研究なのだ。","Life that knows the pain of life, mother…
How beautiful and superior women are.
And at the same time, how crass, savage, and inferior men are.
I know this because I used to be a man.
I'm not asking you to understand…
It's all a study in the destruction of men, socially and biologically.","La vida que conoce el dolor de la vida, la madre …
Qué hermosas y superiores son las mujeres.
Y al mismo tiempo… qué burdos, salvajes e inferiores son los hombres.
Lo sé porque solía ser un hombre.
No te pido que entiendas…
Todo es un estudio sobre la destrucción de los hombres, social y biológicamente."
"Seanel Br (talking)","男を…滅亡って、何よそれ……","What's that about…ruining a man… ……","¿Qué es eso de… destruir a un hombre… ……"
"Ehavilla Me (talking)","……現状では、 女性上位主義など張り子の虎なのだよ、 シーネル司令。
生命としての役割分担… 女になく男にあるもの…
それらを全て、奪い取る。 それで初めて 真の女性上位主義は達成される。
私は、 その理想に全てを捧げているだけだ……","In the current state of ……, the female supremacy principle is a papier-mâché tiger, Seanel Commander.
The division of life roles… what women don't have and men do…
Take them all away. Only then will true feminism be achieved.
I'm just giving everything I have to that ideal……","…… En la situación actual, la supremacía femenina es un tigre de cartón piedra, Seanel Comandante.
La división de los roles de la vida… lo que las mujeres no tienen y los hombres sí…
Todas esas cosas, quítalas. Sólo entonces se logrará el verdadero feminismo.
Estoy dando todo lo que tengo a ese ideal……"
"narrator","言いながらも博士は、 サンプルを何度も新しいものに入れ替え、 顕微鏡を覗き続けていた。
シーネルはその姿に、 何かうすら寒いものを感じずには いられなかった。","Despite his words, Dr. Seanel kept looking into the microscope, replacing the sample with a new one over and over again.
Seanel could not help but feel something chilly at the sight of him.","A pesar de decirlo, siguió cambiando la muestra una y otra vez y siguió mirando por el microscopio.
Seanel no pudo evitar sentir algo de frío al verlo."
"Seanel Br (talking)","あ…あなたが 何をやろうとしているのかは 知らないけれど……
ウィミィの女性上位主義は、 男の否定と同義じゃないのよ？
いくら、男がクズだからって…… あなた、間違ってるっ……","Uh…I don't know what you're trying to do here, but ……
I don't know what you're trying to do, but Wime's supremacy over women is not synonymous with the denial of men, okay?
No matter how much men are scum,…… you're wrong,……","Uh… No sé lo que estás tratando de hacer, pero ……
La supremacía del Wime sobre las mujeres no es sinónimo de denigración de los hombres, ¿verdad?
No importa que los hombres sean escoria,…… te equivocas, ……"
"Ehavilla Me (talking)","………………
くくっ… くくくっ……","………………
Kukk… Kukk… Kukk… ……","………………
Kukku… Kukku… ……"
"Seanel Br (talking)","ちょ…ちょっとっ、 聞こえてるの？　博士っ…","Hey… hey, can you hear me?　Doctor…","Oye… oye, ¿puedes oírme?　Doctor…"
"Ehavilla Me (talking)","見つけた…見つけたぞ。 探し求めた抗体だ、間違いない！！
これで立証された！ この周囲の住民は被検体Ａ１号と 接触している！","I found it…I found it. The antibody we've been looking for, I'm sure of it!
This proves it! The inhabitants of this perimeter have been in contact with Subject A1!","Lo he encontrado… lo he encontrado. El anticuerpo que hemos estado buscando, ¡estoy seguro de ello!
Esto lo demuestra. ¡Los habitantes de este perímetro han estado en contacto con el sujeto A1!"
"Seanel Br (talking)","な…何よ、何のことを……","Wha…what…what are you talking about ……","Qué… qué… de qué estás hablando ……"
"Ehavilla Me (talking)","いいぞ…思った通りだ。 私の立てた仮説通りだ！
薬物投与に耐性を持たせる ために人為強化した抗体が、 外的要因で突然変異を起こしただけ…
変異した抗体が他者の体内で 異物を駆逐しているだけだ！
これが、神の力だと……？ 血の奇跡だと？ 笑わせてくれる！
この力を、あやつに与えたのが 神だと言うのなら…
くくっ…ははははっ！ 私こそが神ではないか！！","Great… just as I thought. My hypothesis is correct!
The artificially strengthened antibodies that made you resistant to the medication have been mutated by an external factor.
The mutated antibodies are simply destroying the foreign substances in the bodies of others!
You think this is the power of God ……? A miracle of blood? You make me laugh!
If you think it was God who gave him this power…
Ha-ha-ha-ha! I am the God!","Bien… tal y como pensaba. Mi hipótesis es correcta.
Los anticuerpos, mejorados artificialmente para hacerlos resistentes a los medicamentos, sólo han mutado debido a factores externos…
 ¡Los anticuerpos mutados simplemente están destruyendo las sustancias extrañas en los cuerpos de los demás!
 ¿Crees que este es el poder de Dios ……? ¿Un milagro de sangre? ¡Me haces reír!
Si crees que fue Dios quien le dio este poder…
 ¡Ja, ja, ja! ¡Yo soy el dios!"
"Seanel Br (talking)","くっ… 狂ってるっ、こいつ……","Damn… he's crazy……","Maldita sea… está loco……"
"Ehavilla Me (talking)","……シーネル司令。 一つ訪ねるが。
戦争中、ニホン軍が一時的に接収した ウィミィの財産はすべからく、 ウィミィへ返還すべし…
終戦協定に、 それは明記されているはずだな？","……Command Seanel. I have a question.
All Wime property temporarily seized by the Japanese army during the war must be returned to Wime…
Shouldn't that be stated in the end-of-war agreement?","……Comando Seanel. Tengo una pregunta.
Todos los bienes de Wime incautados temporalmente por el ejército japonés durante la guerra deben ser devueltos a Wime…
 ¿No debería estar establecido en el acuerdo de fin de guerra?"
"Seanel Br (talking)","それが、何よっ…","What is it…","Qué es lo que…"
"Ehavilla Me (talking)","ならばいい。 これで堂々と那古教へ乗り込める！
あの由女とか言う教祖… 戦時中にニホン軍が奪っていった 私の被検体に間違いないのだよ！","Then fine. Now I can ride proudly into Nakokyou!
That guru called Yume… he's definitely my subject, taken by the Nihongun army during the war!","Entonces bien. ¡Ahora puedo cabalgar con orgullo hacia Nakokyou!
Ese gurú llamado Yume… definitivamente es mi súbdito, ¡tomado por el ejército de Nihongun durante la guerra!"
"narrator","イハビーラはシーネルの胸ぐらを掴み、 興奮しきった顔で詰め寄ってくる。","Ehavilla grabs Seanel by the chest, and comes at him with an excited look on his face.","Ehavilla agarra a Seanel por el pecho y lo empuja a una esquina con una mirada agitada."
"Ehavilla Me (talking)","許可を出せ…出すのだ、司令！ 私にあの教団の立ち入り検査をさせろ！
理想郷実現のための我が研究成果が… 戦争で失った私の十年が、 今、目の前にあるのだ！
シーネル！ 許可をよこせっ！！","Give me permission… give me permission, Commander! Let me inspect the cult!
The results of my research for the realization of the utopia my decade lost in the war are now before me!
Seanel! Give me permission!","¡Deme permiso… déme permiso, Comandante! ¡Déjame inspeccionar esa secta!
Los resultados de mi investigación para la realización de la utopía, los diez años que perdí en la guerra, están ahora ante mí.
 ¡Seanel! ¡Dame permiso!"
"Seanel Br (talking)","………っ、く………","………, ku ………","………, ku ………"
"narrator","扉を締め切り、外部との接触を断った部屋の中、 陽子と寧々が思い詰めた顔で向かい合っている。
陽子の手には、大袈裟な刻印が押された 一通の書簡があった。
刻印。 ──ウィミィ進駐軍の軍章。","In a room with the door closed, cutting off all contact with the outside world, Youko and Nene face each other with thoughtful expressions on their faces.
In Youko's hand was a letter with an exaggerated engraving.
Imprint. ─ ─ Wime the military insignia of the Occupation Army.","En una habitación con la puerta cerrada y sin contacto con el exterior, Youko y Nene se enfrentan con caras pensativas.
En la mano de Youko había una carta con una huella exagerada.
Impresión. ─ ─ Wime insignia militar de las Fuerzas de Ocupación."
"Komiya Youko (talking)","いつかはこんな日が来るって 思ってたけど……
もう、来るなんてね。","I knew this day would come someday……
I can't believe it's already here.","Sabía que este día llegaría algún día……
No puedo creer que ya esté aquí."
"Tsukigase Nene (talking)","予想していたより遅いくらいよ。
あらゆる毒物を無力化し、悪性の 細菌やウィルスを残らず死滅させる 副作用ゼロの奇跡の薬……
それが、由女の血。
誰だって欲しがるわよ。 すべてが露見すればね。
もっとも……ウィミィが単純に 由女の血だけを欲しがっているとは 考えにくいのだけれど……","It's about as late as I expected.
A miracle drug with zero side effects that neutralizes all poisons and kills every last malignant bacteria and virus……
That's Yume blood.
Everyone will want it. Once it's all out in the open.
Though it's hard to imagine ……Wime only wanting Yume blood for a single Jun……","Es mucho más lento de lo que esperábamos.
Un medicamento milagroso con cero efectos secundarios que neutraliza todos los venenos y mata hasta la última bacteria y virus malignos……
Esa es la sangre de Yume.
Todo el mundo lo querrá. Una vez que todo está al descubierto.
Aunque es difícil imaginar que ……Wime sólo quiera la sangre de Yume por un solo Jun……"
"Komiya Youko (talking)","ねえ寧々…… この要請書にある任意査察って、 やっぱり由女が目的なの？","Hey Nene ……, is the voluntary inspection in this request still aimed at Yume?","Oye Nene…… ¿La inspección voluntaria en esta solicitud sigue dirigida a Yume?"
"Tsukigase Nene (talking)","でしょうね、 場合によってはエデンヘ同行を願うだの わざわざ明記しているくらいだし。
戦争犯罪の調査だとか 偉そうなことを書いてあるけど…
うちが宗教団体として 本格的に活動し始めたのは 戦後なんですからね。","I'm sure it does, because it goes out of its way to state that in some cases it wishes to be accompanied by Edenhe.
It says something about investigating war crimes and all that, but...
We didn't really start to become a fully-fledged religious organisation until after the war, you know.","Seguro que sí, porque se esfuerza en afirmar que en algunos casos desea ir acompañado de Edenhe.
Dice algo sobre investigar crímenes de guerra y todo eso, pero...
Realmente no empezamos a ser una organización religiosa de pleno derecho hasta después de la guerra, ya sabes."
"Komiya Youko (talking)","組織に対するイチャモンって事は まずない……か。
ね、査察って任意なんでしょう？ 断れないの？","It's not likely that this is a flirtation with the organization……?
You know, inspections are voluntary, right? Can't you refuse?","No es la primera vez que hace una acusación falsa contra una organización……?
Oye, las inspecciones son voluntarias, ¿no? ¿No puedes negarte?"
"Tsukigase Nene (talking)","ウィミィの言う任意なんて、 強制と同義語だと思った方がいいわ。
これはもう、 ウィミィを欺くしかないわね。","You'd better believe that Wime's term “voluntary” is synonymous with “compulsory.
Now we have no choice but to deceive Wime.","Será mejor que creas que la palabra de Wime es sinónimo de voluntario.
Esta es la única manera de engañar a Wime ahora."
"Komiya Youko (talking)","欺くのに失敗したら？
 ……って、訊くだけ野暮ね。","What if they fail to deceive?…… is a wild thing to ask.","¿Y si no logran engañar?…… es una cosa salvaje para pedir."
"Tsukigase Nene (talking)","権力による宗教弾圧を喧伝して、 信者全員を“盾”に変える。 その盾が保っている間に……","They will propagandize religious Dan oppression by the powers that be and turn all believers into “Tate”. While that Tate keeps ……","propagar la opresión religiosa Dan por el poder, convirtiendo a todos los creyentes en “Tate”. Mientras que ese Tate mantiene ……"
"Komiya Youko (talking)","私たちは由女と一緒に 逃げ出す方法を考える、か。","We'll figure out a way to escape with Yume, huh?","Ya encontraremos la manera de salir con Yume, ¿eh?"
"Tsukigase Nene (talking)","そこまで事態が悪化しないことを 祈るばかりだけれど。
最悪のシナリオは 想定しておくべきでしょうね。","I just hope things don't get that bad.
I guess we have to assume the worst case scenario.","Sólo espero que las cosas no se pongan tan mal.
Supongo que tenemos que asumir el peor escenario posible."
"Komiya Youko (talking)","…………短い蜜月だったわね。","………… It's been a short honeymoon.","………… Ha sido una luna de miel corta."
"Tsukigase Nene (talking)","蜜月？","Honeymoon?","¿Luna de miel?"
"Komiya Youko (talking)","私たち、戦前・戦中は あばずれだの鼻つまみ者だの さんざん言われてたでしょう？
利用して、利用されて、 男も女も子供も老人も関係なくて。","Before and during the war, we were called a bunch of sluts and snobs, weren't we?
We used and were used, regardless of whether we were men, women, children, or the elderly.","Antes y durante la guerra, nos llamaban mariquitas y snobs, ¿no?
Usamos y fuimos usados, hombres, mujeres, niños y ancianos por igual."
"Tsukigase Nene (talking)","……私はもう、忘れたわ。","…… I'm so over it.","…… Ya lo he hecho, lo he olvidado."
"Komiya Youko (talking)","そんな、私たち二人がさ……
聖女だなんて呼ばれて、 慈善まがいのことをやってさ。 崇められて、尊敬されて…
悪い気分じゃなかったわ。","You know, the two of us… ……
We're called saints, we do charitable things, we're revered, respected… And we're revered, respected…
I didn't feel bad.","Y los dos somos así……
Nos llaman santos, hacemos cosas de caridad. Y somos venerados, somos respetados…
No me sentí mal."
"Tsukigase Nene (talking)","由女のお陰ね。","Thanks to Yume.","Gracias a Yume."
"Komiya Youko (talking)","……照れくさいけど。
私、自暴自棄でさ、 いつでも死んでやるって、 世界中焼けてしまえって思ってたのに…
あの子、泣いてくれたから。 私の代わりに。
 ……泣いてくれたのよ。","……I know it's embarrassing.
I was so desperate, I thought I'd die anytime, I wanted the whole world to burn…
She cried for me. For me.…… cried for me.","…… Me da vergüenza decirlo.
Estaba tan desesperado, pensaba que moriría cualquier día, quería que el mundo entero ardiera…
Lloró por mí. En mi nombre.…… Ella lloró por mí."
"Tsukigase Nene (talking)","………………
陽子、昔話はまだ早いわよ。 その“最悪”が訪れた訳じゃない。
那古教っていう蜜月…… うまくやればまだ続けていられるわ。 きっとね。","………………
Youko, it's too early to talk about the old days. The “worst” hasn't happened yet.
Nakokyou is a honeymoon…… and if we play our cards right, we can still keep it going. I'm sure.","………………
Youko, es demasiado pronto para hablar del pasado. Lo “peor” no ha ocurrido.
Nakokyou es una luna de miel…… que aún puede continuar si juegas bien tus cartas. Estoy seguro."
"Komiya Youko (talking)","そうね……","Right……","Bien……"
"Tsukigase Nene (talking)","………ねえ、陽子。 一つ訊いていい？
あなたって結局、 由女をどう思ってるの？","……… Hey, Youko. Can I ask you one question?
What do you think of Yume after all?","……… Hey, Youko. ¿Puedo hacerte una pregunta?
 ¿Qué piensas de Yume después de todo?"
"Komiya Youko (talking)","…………何よそれ。","………… What's that?","………… ¿Qué es eso?"
"Tsukigase Nene (talking)","私と違って、 あなたに“その気”がないのは 解っているつもりよ。
私とあなたが関係していた頃、 あなたはそれを求めていたんじゃなく ただ自暴自棄なだけだったわ。
退屈を紛らわせていただけだった。
でも、由女への気持ちは違うわよね？","Unlike me, I know you don't have the “it” factor.
When you and I were involved, you weren't looking for it, you were just desperate.
You were just drowning your sorrows.
But your feelings for Yume are different, aren't they?","A diferencia de mí, sé que no estás de humor para ello.
Cuando tú y yo teníamos una relación, no la buscabas, sólo estabas desesperado.
Estaba ahogando mis penas.
Pero tus sentimientos por Yume son diferentes, ¿no?"
"Komiya Youko (talking)","……………… 何が言いたいの。","……………… What's the point.","……………… ¿Cuál es el objetivo?"
"Tsukigase Nene (talking)","由女は、普通じゃないもの。 それは私にもよく解る。
だから、単純に心や躰の問題じゃなく、 もっとこう、理屈じゃない部分で……
 ……あなたが由女のことを 欲しいと思っていたとしても、 私は別に驚かないわ。","Yume is something out of the ordinary. I understand it well.
So, it's not just a matter of mind or body to Jun, it's more like a non sequitur……
I wouldn't be surprised if you want Yume.","Yume es algo fuera de lo común. Lo entiendo muy bien.
Así que, no es sólo una cuestión de mente o cuerpo a Jun, es más como, de una manera no teórica, ……
No me sorprendería que en…… quisieras Yume."
"Komiya Youko (talking)","………………","………………","………………"
